name,manaCost,cmc,colorIdentity,artist,number,type,text,printings,flavor,layout,multiverseid,power,toughness,rarity,subtypes,types
Air Elemental,{3}{U}{U},5,U,Richard Thomas,,Creature — Elemental,Flying,"LEA,LEB,2ED,CED,CEI,3ED,4ED,5ED,PO2,6ED,S99,BRB,BTD,7ED,8ED,9ED,10E,DD2,M10,DPA,ME4,DD3_JVC","These spirits of the air are winsome and wild, and cannot be truly contained. Only marginally intelligent, they often substitute whimsy for strategy, delighting in mischief and mayhem.",normal,691,4,4,Uncommon,Elemental,Creature
Ancestral Recall,{U},1,U,Mark Poole,,Instant,Target player draws three cards.,"LEA,LEB,2ED,CED,CEI,VMA",,normal,692,,,Rare,,Instant
Animate Artifact,{3}{U},4,U,Douglas Shuler,,Enchantment — Aura,"Enchant artifact\nAs long as enchanted artifact isn't a creature, it's an artifact creature with power and toughness each equal to its converted mana cost.","LEA,LEB,2ED,CED,CEI,3ED,4ED,ME4",,normal,693,,,Uncommon,Aura,Enchantment
Animate Dead,{1}{B},2,B,Anson Maddocks,,Enchantment — Aura,"Enchant creature card in a graveyard\nWhen Animate Dead enters the battlefield, if it's on the battlefield, it loses ""enchant creature card in a graveyard"" and gains ""enchant creature put onto the battlefield with Animate Dead."" Return enchanted creature card to the battlefield under your control and attach Animate Dead to it. When Animate Dead leaves the battlefield, that creature's controller sacrifices it.\nEnchanted creature gets -1/-0.","LEA,LEB,2ED,CED,CEI,3ED,4ED,5ED,MED,PD3,VMA,EMA",,normal,645,,,Uncommon,Aura,Enchantment
Animate Wall,{W},1,W,Dan Frazier,,Enchantment — Aura,Enchant Wall\nEnchanted Wall can attack as though it didn't have defender.,"LEA,LEB,2ED,CED,CEI,3ED,4ED,5ED,6ED,MED",,normal,829,,,Rare,Aura,Enchantment
Ankh of Mishra,{2},2,,Amy Weber,,Artifact,"Whenever a land enters the battlefield, Ankh of Mishra deals 2 damage to that land's controller.","LEA,LEB,2ED,CED,CEI,3ED,4ED,5ED,6ED,MED,VMA",,normal,598,,,Rare,,Artifact
Armageddon,{3}{W},4,W,Jesper Myrfors,,Sorcery,Destroy all lands.,"LEA,LEB,2ED,CED,CEI,3ED,4ED,5ED,POR,pJGP,PO2,ATH,6ED,S99,MED,ME4,VMA,V14",,normal,830,,,Rare,,Sorcery
Aspect of Wolf,{1}{G},2,G,Jeff A. Menges,,Enchantment — Aura,"Enchant creature\nEnchanted creature gets +X/+Y, where X is half the number of Forests you control, rounded down, and Y is half the number of Forests you control, rounded up.","LEA,LEB,2ED,CED,CEI,3ED,4ED,5ED",,normal,737,,,Rare,Aura,Enchantment
Bad Moon,{1}{B},2,B,Jesper Myrfors,,Enchantment,Black creatures get +1/+1.,"LEA,LEB,2ED,CED,CEI,3ED,4ED,5ED,TSB,DDD,C14,DD3_GVL",,normal,646,,,Rare,,Enchantment
Badlands,,,"B,R",Rob Alexander,,Land — Swamp Mountain,({T}: Add {B} or {R} to your mana pool.),"LEA,LEB,2ED,CED,CEI,3ED,ME2,ME4,VMA",,normal,878,,,Rare,"Swamp,Mountain",Land
Balance,{1}{W},2,W,Mark Poole,,Sorcery,"Each player chooses a number of lands he or she controls equal to the number of lands controlled by the player who controls the fewest, then sacrifices the rest. Players discard cards and sacrifice creatures the same way.","LEA,LEB,2ED,CED,CEI,3ED,4ED,pJGP,V09,ME4,VMA,EMA",,normal,831,,,Rare,,Sorcery
Basalt Monolith,{3},3,,Jesper Myrfors,,Artifact,Basalt Monolith doesn't untap during your untap step.\n{T}: Add {C}{C}{C} to your mana pool.\n{3}: Untap Basalt Monolith.,"LEA,LEB,2ED,CED,CEI,3ED,ME4,C13,C15",,normal,599,,,Uncommon,,Artifact
Bayou,,,"B,G",Jesper Myrfors,,Land — Swamp Forest,({T}: Add {B} or {G} to your mana pool.),"LEA,LEB,2ED,CED,CEI,3ED,ME3,ME4,VMA",,normal,879,,,Rare,"Swamp,Forest",Land
Benalish Hero,{W},1,W,Douglas Shuler,,Creature — Human Soldier,"Banding (Any creatures with banding, and up to one without, can attack in a band. Bands are blocked as a group. If any creatures with banding you control are blocking or being blocked by a creature, you divide that creature's combat damage, not its controller, among any of the creatures it's being blocked by or is blocking.)","LEA,LEB,2ED,CED,CEI,3ED,4ED,5ED,MED","Benalia has a complex caste system that changes with the lunar year. No matter what the season, the only caste that cannot be attained by either heredity or money is that of the hero.",normal,832,1,1,Common,"Human,Soldier",Creature
Berserk,{G},1,G,Dan Frazier,,Instant,"Cast Berserk only before the combat damage step.\nTarget creature gains trample and gets +X/+0 until end of turn, where X is its power. At the beginning of the next end step, destroy that creature if it attacked this turn.","LEA,LEB,2ED,CED,CEI,MED,V09,VMA",,normal,738,,,Uncommon,,Instant
Birds of Paradise,{G},1,G,Mark Poole,,Creature — Bird,Flying\n{T}: Add one mana of any color to your mana pool.,"LEA,LEB,2ED,CED,CEI,3ED,pMEI,4ED,5ED,6ED,7ED,8ED,RAV,10E,M10,M11,M12",,normal,739,0,1,Rare,Bird,Creature
Black Knight,{B}{B},2,B,Jeff A. Menges,,Creature — Human Knight,"First strike (This creature deals combat damage before creatures without first strike.)\nProtection from white (This creature can't be blocked, targeted, dealt damage, or enchanted by anything white.)","LEA,LEB,2ED,CED,CEI,3ED,4ED,5ED,ATH,pFNM,MED,M10,M11,ME4",Battle doesn't need a purpose; the battle is its own purpose. You don't ask why a plague spreads or a field burns. Don't ask why I fight.,normal,647,2,2,Uncommon,"Human,Knight",Creature
Black Lotus,{0},,,Christopher Rush,,Artifact,"{T}, Sacrifice Black Lotus: Add three mana of any one color to your mana pool.","LEA,LEB,2ED,CED,CEI,VMA",,normal,600,,,Rare,,Artifact
Black Vise,{1},1,,Richard Thomas,,Artifact,"As Black Vise enters the battlefield, choose an opponent.\nAt the beginning of the chosen player's upkeep, Black Vise deals X damage to that player, where X is the number of cards in his or her hand minus 4.","LEA,LEB,2ED,CED,CEI,3ED,4ED,ME3,V10",,normal,601,,,Uncommon,,Artifact
Black Ward,{W},1,W,Dan Frazier,,Enchantment — Aura,Enchant creature\nEnchanted creature has protection from black. This effect doesn't remove Black Ward.,"LEA,LEB,2ED,CED,CEI,3ED,4ED",,normal,833,,,Uncommon,Aura,Enchantment
Blaze of Glory,{W},1,W,Richard Thomas,,Instant,Cast Blaze of Glory only during combat before blockers are declared.\nTarget creature defending player controls can block any number of creatures this turn. It blocks each attacking creature this turn if able.,"LEA,LEB,2ED,CED,CEI,ME4",,normal,834,,,Rare,,Instant
Blessing,{W}{W},2,W,Julie Baroh,,Enchantment — Aura,Enchant creature\n{W}: Enchanted creature gets +1/+1 until end of turn.,"LEA,LEB,2ED,CED,CEI,3ED,4ED,M14",,normal,835,,,Rare,Aura,Enchantment
Blue Elemental Blast,{U},1,U,Richard Thomas,,Instant,Choose one —\n• Counter target red spell.\n• Destroy target red permanent.,"LEA,LEB,2ED,CED,CEI,3ED,pMEI,4ED,ME4",,normal,694,,,Common,,Instant
Blue Ward,{W},1,W,Dan Frazier,,Enchantment — Aura,Enchant creature\nEnchanted creature has protection from blue. This effect doesn't remove Blue Ward.,"LEA,LEB,2ED,CED,CEI,3ED,4ED",,normal,836,,,Uncommon,Aura,Enchantment
Bog Wraith,{3}{B},4,B,Jeff A. Menges,,Creature — Wraith,Swampwalk (This creature can't be blocked as long as defending player controls a Swamp.),"LEA,LEB,2ED,CED,CEI,3ED,4ED,RQS,ITP,5ED,POR,6ED,S99,7ED,8ED,9ED,10E,M10",'Twas in the bogs of Cannelbrae\nMy mate did meet an early grave\n'Twas nothing left for us to save\nIn the peat-filled bogs of Cannelbrae.,normal,648,3,3,Uncommon,Wraith,Creature
Braingeyser,{X}{U}{U},2,U,Mark Tedin,,Sorcery,Target player draws X cards.,"LEA,LEB,2ED,CED,CEI,3ED,ME4",,normal,695,,,Rare,,Sorcery
Burrowing,{R},1,R,Mark Poole,,Enchantment — Aura,Enchant creature\nEnchanted creature has mountainwalk. (It can't be blocked as long as defending player controls a Mountain.),"LEA,LEB,2ED,CED,CEI,3ED,4ED,6ED",,normal,783,,,Uncommon,Aura,Enchantment
Camouflage,{G},1,G,Jesper Myrfors,,Instant,"Cast Camouflage only during your declare attackers step.\nThis turn, instead of declaring blockers, each defending player chooses any number of creatures he or she controls and divides them into a number of piles equal to the number of attacking creatures for whom that player is the defending player. Creatures he or she controls that can block additional creatures may likewise be put into additional piles. Assign each pile to a different one of those attacking creatures at random. Each creature in a pile that can block the creature that pile is assigned to does so. (Piles can be empty.)","LEA,LEB,2ED,CED,CEI",,normal,740,,,Uncommon,,Instant
Castle,{3}{W},4,W,Dameon Willich,,Enchantment,Untapped creatures you control get +0/+2.,"LEA,LEB,2ED,CED,CEI,3ED,4ED,5ED,6ED,7ED",,normal,837,,,Uncommon,,Enchantment
Celestial Prism,{3},3,,Amy Weber,,Artifact,"{2}, {T}: Add one mana of any color to your mana pool.","LEA,LEB,2ED,CED,CEI,3ED,4ED",,normal,602,,,Uncommon,,Artifact
Channel,{G}{G},2,G,Richard Thomas,,Sorcery,"Until end of turn, any time you could activate a mana ability, you may pay 1 life. If you do, add {C} to your mana pool.","LEA,LEB,2ED,CED,CEI,3ED,4ED,V09,ME4,VMA",,normal,741,,,Uncommon,,Sorcery
Chaos Orb,{2},2,,Mark Tedin,,Artifact,"{1}, {T}: If Chaos Orb is on the battlefield, flip Chaos Orb onto the battlefield from a height of at least one foot. If Chaos Orb turns over completely at least once during the flip, destroy all nontoken permanents it touches. Then destroy Chaos Orb.","LEA,LEB,2ED,CED,CEI",,normal,603,,,Rare,,Artifact
Chaoslace,{R},1,R,Dameon Willich,,Instant,Target spell or permanent becomes red. (Its mana symbols remain unchanged.),"LEA,LEB,2ED,CED,CEI,3ED,4ED",,normal,784,,,Rare,,Instant
Circle of Protection: Black,{1}{W},2,W,Jesper Myrfors,,Enchantment,"{1}: The next time a black source of your choice would deal damage to you this turn, prevent that damage.","LEB,2ED,CED,CEI,3ED,4ED,ICE,RQS,ITP,5ED,TMP,6ED,7ED,8ED,9ED",,normal,838,,,Common,,Enchantment
Circle of Protection: Blue,{1}{W},2,W,Dameon Willich,,Enchantment,"{1}: The next time a blue source of your choice would deal damage to you this turn, prevent that damage.","LEA,LEB,2ED,CED,CEI,3ED,4ED,ICE,5ED,TMP,6ED,7ED,8ED",,normal,839,,,Common,,Enchantment
Circle of Protection: Green,{1}{W},2,W,Sandra Everingham,,Enchantment,"{1}: The next time a green source of your choice would deal damage to you this turn, prevent that damage.","LEA,LEB,2ED,CED,CEI,3ED,4ED,ICE,5ED,TMP,6ED,7ED,8ED",,normal,840,,,Common,,Enchantment
Circle of Protection: Red,{1}{W},2,W,Mark Tedin,,Enchantment,"{1}: The next time a red source of your choice would deal damage to you this turn, prevent that damage.","LEA,LEB,2ED,CED,CEI,3ED,4ED,ICE,RQS,ITP,5ED,TMP,6ED,pFNM,7ED,8ED,9ED",,normal,841,,,Common,,Enchantment
Circle of Protection: White,{1}{W},2,W,Douglas Shuler,,Enchantment,"{1}: The next time a white source of your choice would deal damage to you this turn, prevent that damage.","LEA,LEB,2ED,CED,CEI,3ED,4ED,ICE,5ED,TMP,6ED,7ED,8ED",,normal,842,,,Common,,Enchantment
Clockwork Beast,{6},6,,Drew Tucker,,Artifact Creature — Beast,"Clockwork Beast enters the battlefield with seven +1/+0 counters on it.\nAt end of combat, if Clockwork Beast attacked or blocked this combat, remove a +1/+0 counter from it.\n{X}, {T}: Put up to X +1/+0 counters on Clockwork Beast. This ability can't cause the total number of +1/+0 counters on Clockwork Beast to be greater than seven. Activate this ability only during your upkeep.","LEA,LEB,2ED,CED,CEI,3ED,4ED,RQS,ITP,5ED,BTD,MED",,normal,604,0,4,Rare,Beast,"Artifact,Creature"
Clone,{3}{U},4,U,Julie Baroh,,Creature — Shapeshifter,You may have Clone enter the battlefield as a copy of any creature on the battlefield.,"LEA,LEB,2ED,CED,CEI,3ED,ONS,9ED,10E,M10,M11,DDI,M13,M14",,normal,696,0,0,Uncommon,Shapeshifter,Creature
Cockatrice,{3}{G}{G},5,G,Dan Frazier,,Creature — Cockatrice,"Flying\nWhenever Cockatrice blocks or becomes blocked by a non-Wall creature, destroy that creature at end of combat.","LEA,LEB,2ED,CED,CEI,3ED,4ED,5ED,TSB",,normal,742,2,4,Rare,Cockatrice,Creature
Consecrate Land,{W},1,W,Jeff A. Menges,,Enchantment — Aura,Enchant land\nEnchanted land has indestructible and can't be enchanted by other Auras.,"LEA,LEB,2ED,CED,CEI,TSB",,normal,843,,,Uncommon,Aura,Enchantment
Conservator,{4},4,,Amy Weber,,Artifact,"{3}, {T}: Prevent the next 2 damage that would be dealt to you this turn.","LEA,LEB,2ED,CED,CEI,3ED,4ED",,normal,605,,,Uncommon,,Artifact
Contract from Below,{B},1,B,Douglas Shuler,,Sorcery,"Remove Contract from Below from your deck before playing if you're not playing for ante.\nDiscard your hand, ante the top card of your library, then draw seven cards.","LEA,LEB,2ED,CED,CEI,3ED",,normal,649,,,Rare,,Sorcery
Control Magic,{2}{U}{U},4,U,Dameon Willich,,Enchantment — Aura,Enchant creature\nYou control enchanted creature.,"LEA,LEB,2ED,CED,CEI,3ED,4ED,BRB,ME4,C13,DDM,VMA,EMA",,normal,697,,,Uncommon,Aura,Enchantment
Conversion,{2}{W}{W},4,W,Jesper Myrfors,,Enchantment,"At the beginning of your upkeep, sacrifice Conversion unless you pay {W}{W}.\nAll Mountains are Plains.","LEA,LEB,2ED,CED,CEI,3ED,4ED,ME4",,normal,844,,,Uncommon,,Enchantment
Copper Tablet,{2},2,,Amy Weber,,Artifact,"At the beginning of each player's upkeep, Copper Tablet deals 1 damage to that player.","LEA,LEB,2ED,CED,CEI,MED",,normal,606,,,Uncommon,,Artifact
Copy Artifact,{1}{U},2,U,Amy Weber,,Enchantment,"You may have Copy Artifact enter the battlefield as a copy of any artifact on the battlefield, except it's an enchantment in addition to its other types.","LEA,LEB,2ED,CED,CEI,3ED,ME4",,normal,698,,,Rare,,Enchantment
Counterspell,{U}{U},2,U,Mark Poole,,Instant,Counter target spell.,"LEA,LEB,2ED,CED,CEI,3ED,pLGM,4ED,ICE,5ED,TMP,pJGP,6ED,S99,MMQ,BRB,pFNM,S00,BTD,7ED,ME2,DD2,ME4,VMA,DD3_JVC,TPR,EMA",,normal,699,,,Uncommon,,Instant
Craw Wurm,{4}{G}{G},6,G,Daniel Gelon,,Creature — Wurm,,"LEA,LEB,2ED,CED,CEI,3ED,4ED,5ED,8ED,9ED,10E,M10",The most terrifying thing about the Craw Wurm is probably the horrible crashing sound it makes as it speeds through the forest. This noise is so loud it echoes through the trees and seems to come from all directions at once.,normal,743,6,4,Common,Wurm,Creature
Creature Bond,{1}{U},2,U,Anson Maddocks,,Enchantment — Aura,"Enchant creature\nWhen enchanted creature dies, Creature Bond deals damage equal to that creature's toughness to the creature's controller.","LEA,LEB,2ED,CED,CEI,3ED,4ED",,normal,700,,,Common,Aura,Enchantment
Crusade,{W}{W},2,W,Mark Poole,,Enchantment,White creatures get +1/+1.,"LEA,LEB,2ED,CED,CEI,3ED,4ED,5ED,6ED,pSUS,MED,DDF",,normal,845,,,Rare,,Enchantment
Crystal Rod,{1},1,,Amy Weber,,Artifact,"Whenever a player casts a blue spell, you may pay {1}. If you do, you gain 1 life.","LEA,LEB,2ED,CED,CEI,3ED,4ED,5ED,6ED,7ED,8ED",,normal,607,,,Uncommon,,Artifact
Cursed Land,{2}{B}{B},4,B,Jesper Myrfors,,Enchantment — Aura,"Enchant land\nAt the beginning of the upkeep of enchanted land's controller, Cursed Land deals 1 damage to that player.","LEA,LEB,2ED,CED,CEI,3ED,4ED,RQS,ITP,5ED",,normal,650,,,Uncommon,Aura,Enchantment
Cyclopean Tomb,{4},4,,Anson Maddocks,,Artifact,"{2}, {T}: Put a mire counter on target non-Swamp land. That land is a Swamp for as long as it has a mire counter on it. Activate this ability only during your upkeep.\nWhen Cyclopean Tomb is put into a graveyard from the battlefield, at the beginning of each of your upkeeps for the rest of the game, remove all mire counters from a land that a mire counter was put onto with Cyclopean Tomb but that a mire counter has not been removed from with Cyclopean Tomb.","LEA,LEB,2ED,CED,CEI,ME4",,normal,608,,,Rare,,Artifact
Dark Ritual,{B},1,B,Sandra Everingham,,Instant,Add {B}{B}{B} to your mana pool.,"LEA,LEB,2ED,CED,CEI,3ED,4ED,ICE,RQS,MIR,ITP,5ED,TMP,pJGP,USG,MMQ,BRB,BTD,DKM,CST,DDC,HOP,DDE,ME4,V13,VMA,DD3_DVD,TPR",,normal,651,,,Common,,Instant
Darkpact,{B}{B}{B},3,B,Quinton Hoover,,Sorcery,Remove Darkpact from your deck before playing if you're not playing for ante.\nYou own target card in the ante. Exchange that card with the top card of your library.,"LEA,LEB,2ED,CED,CEI,3ED",,normal,652,,,Rare,,Sorcery
Death Ward,{W},1,W,Mark Poole,,Instant,Regenerate target creature.,"LEA,LEB,2ED,CED,CEI,3ED,4ED,ICE,5ED,MED",,normal,846,,,Common,,Instant
Deathgrip,{B}{B},2,B,Anson Maddocks,,Enchantment,{B}{B}: Counter target green spell.,"LEA,LEB,2ED,CED,CEI,3ED,4ED,5ED,ME4",,normal,653,,,Uncommon,,Enchantment
Deathlace,{B},1,B,Sandra Everingham,,Instant,Target spell or permanent becomes black. (Mana symbols on that permanent remain unchanged.),"LEA,LEB,2ED,CED,CEI,3ED,4ED",,normal,654,,,Rare,,Instant
Demonic Attorney,{1}{B}{B},3,B,Daniel Gelon,,Sorcery,Remove Demonic Attorney from your deck before playing if you're not playing for ante.\nEach player antes the top card of his or her library.,"LEA,LEB,2ED,CED,CEI,3ED",,normal,655,,,Rare,,Sorcery
Demonic Hordes,{3}{B}{B}{B},6,B,Jesper Myrfors,,Creature — Demon,"{T}: Destroy target land.\nAt the beginning of your upkeep, unless you pay {B}{B}{B}, tap Demonic Hordes and sacrifice a land of an opponent's choice.","LEA,LEB,2ED,CED,CEI,3ED,ME4","Created to destroy Dominia, Demons can sometimes be bent to a more focused purpose.",normal,656,5,5,Rare,Demon,Creature
Demonic Tutor,{1}{B},2,B,Douglas Shuler,,Sorcery,Search your library for a card and put that card into your hand. Then shuffle your library.,"LEA,LEB,2ED,CED,CEI,3ED,pJGP,DDC,ME4,VMA,DD3_DVD",,normal,657,,,Uncommon,,Sorcery
Dingus Egg,{4},4,,Dan Frazier,,Artifact,"Whenever a land is put into a graveyard from the battlefield, Dingus Egg deals 2 damage to that land's controller.","LEA,LEB,2ED,CED,CEI,3ED,4ED,5ED,6ED,7ED,8ED",,normal,609,,,Rare,,Artifact
Disenchant,{1}{W},2,W,Amy Weber,,Instant,Destroy target artifact or enchantment.,"LEA,LEB,2ED,CED,CEI,3ED,4ED,ICE,pARL,MIR,5ED,TMP,USG,ATH,6ED,MMQ,BRB,pFNM,S00,7ED,pMPR,CST,TSB,ME2,ME3,TPR",,normal,847,,,Common,,Instant
Disintegrate,{X}{R},1,R,Anson Maddocks,,Sorcery,"Disintegrate deals X damage to target creature or player. That creature can't be regenerated this turn. If the creature would die this turn, exile it instead.","LEA,LEB,2ED,CED,CEI,3ED,4ED,RQS,ITP,5ED,TSB",,normal,785,,,Common,,Sorcery
Disrupting Scepter,{3},3,,Dan Frazier,,Artifact,"{3}, {T}: Target player discards a card. Activate this ability only during your turn.","LEA,LEB,2ED,CED,CEI,3ED,4ED,5ED,6ED,7ED,8ED,9ED",,normal,610,,,Rare,,Artifact
Dragon Whelp,{2}{R}{R},4,R,Amy Weber,,Creature — Dragon,"Flying\n{R}: Dragon Whelp gets +1/+0 until end of turn. If this ability has been activated four or more times this turn, sacrifice Dragon Whelp at the beginning of the next end step.","LEA,LEB,2ED,CED,CEI,3ED,4ED,TSB,DRB,M10,ARC,DDG,CMD","""O to be a dragon . . . of silkworm size or immense . . .""\n—Marianne Moore, ""O to Be a Dragon""",normal,786,2,3,Uncommon,Dragon,Creature
Drain Life,{X}{1}{B},2,B,Douglas Shuler,,Sorcery,"Spend only black mana on X.\nDrain Life deals X damage to target creature or player. You gain life equal to the damage dealt, but not more life than the player's life total before Drain Life dealt damage or the creature's toughness.","LEA,LEB,2ED,CED,CEI,3ED,4ED,MIR,5ED,pFNM,BTD",,normal,658,,,Common,,Sorcery
Drain Power,{U}{U},2,U,Douglas Shuler,,Sorcery,Target player activates a mana ability of each land he or she controls. Then put all mana from that player's mana pool into yours.,"LEA,LEB,2ED,CED,CEI,3ED,4ED,5ED,ME4",,normal,701,,,Rare,,Sorcery
Drudge Skeletons,{1}{B},2,B,Sandra Everingham,,Creature — Skeleton,"{B}: Regenerate Drudge Skeletons. (The next time this creature would be destroyed this turn, it isn't. Instead tap it, remove all damage from it, and remove it from combat.)","LEA,LEB,2ED,CED,CEI,3ED,4ED,5ED,6ED,S00,7ED,8ED,9ED,10E,M10,DDD,DPA,DD3_GVL","Bones scattered around us joined to form misshapen bodies. We struck at them repeatedly—they fell, but soon formed again, with the same mocking look on their faceless skulls.",normal,659,1,1,Common,Skeleton,Creature
Dwarven Demolition Team,{2}{R},3,R,Kev Brockschmidt,,Creature — Dwarf,{T}: Destroy target Wall.,"LEA,LEB,2ED,CED,CEI,8ED","Foolishly, Najib retreated to his castle at El-Abar; the next morning he was dead. In just one night, the dwarven forces had reduced the mighty walls to mere rubble.",normal,787,1,1,Uncommon,Dwarf,Creature
Dwarven Warriors,{2}{R},3,R,Douglas Shuler,,Creature — Dwarf Warrior,{T}: Target creature with power 2 or less can't be blocked this turn.,"LEA,LEB,2ED,CED,CEI,3ED,4ED,5ED",,normal,788,1,1,Common,"Dwarf,Warrior",Creature
Earth Elemental,{3}{R}{R},5,R,Dan Frazier,,Creature — Elemental,,"LEA,LEB,2ED,CED,CEI,3ED,4ED,S99,10E,DPA","Earth Elementals have the eternal strength of stone and the endurance of mountains. Primordially connected to the land they inhabit, they take a long-term view of things, scorning the impetuous haste of short-lived mortal creatures.",normal,789,4,5,Uncommon,Elemental,Creature
Earthbind,{R},1,R,Quinton Hoover,,Enchantment — Aura,"Enchant creature\nWhen Earthbind enters the battlefield, if enchanted creature has flying, Earthbind deals 2 damage to that creature and Earthbind gains ""Enchanted creature loses flying.""","LEA,LEB,2ED,CED,CEI,3ED",,normal,790,,,Common,Aura,Enchantment
Earthquake,{X}{R},1,R,Dan Frazier,,Sorcery,Earthquake deals X damage to each creature without flying and each player.,"LEA,LEB,2ED,CED,CEI,3ED,4ED,5ED,POR,PO2,6ED,7ED,M10,CMD,C15",,normal,791,,,Rare,,Sorcery
Elvish Archers,{1}{G},2,G,Anson Maddocks,,Creature — Elf Archer,First strike,"LEA,LEB,2ED,CED,CEI,3ED,4ED,RQS,ITP,5ED,6ED,7ED","I tell you, there was so many arrows flying about you couldn't hardly see the sun. So I says to young Angus, ""Well, at least now we're fighting in the shade!""",normal,744,2,1,Rare,"Elf,Archer",Creature
Evil Presence,{B},1,B,Sandra Everingham,,Enchantment — Aura,Enchant land\nEnchanted land is a Swamp.,"LEA,LEB,2ED,CED,CEI,3ED,4ED,5ED,ME3,NPH",,normal,660,,,Uncommon,Aura,Enchantment
False Orders,{R},1,R,Anson Maddocks,,Instant,Cast False Orders only during the declare blockers step.\nRemove target creature defending player controls from combat. Creatures it was blocking that had become blocked by only that creature this combat become unblocked. You may have it block an attacking creature of your choice.,"LEA,LEB,2ED,CED,CEI",,normal,792,,,Common,,Instant
Farmstead,{W}{W}{W},3,W,Mark Poole,,Enchantment — Aura,"Enchant land\nEnchanted land has ""At the beginning of your upkeep, you may pay {W}{W}. If you do, you gain 1 life.""","LEA,LEB,2ED,CED,CEI,3ED",,normal,848,,,Rare,Aura,Enchantment
Fastbond,{G},1,G,Mark Poole,,Enchantment,"You may play any number of lands on each of your turns.\nWhenever you play a land, if it wasn't the first land you played this turn, Fastbond deals 1 damage to you.","LEA,LEB,2ED,CED,CEI,3ED,ME4,VMA",,normal,745,,,Rare,,Enchantment
Fear,{B}{B},2,B,Mark Poole,,Enchantment — Aura,Enchant creature (Target a creature as you cast this. This card enters the battlefield attached to that creature.)\nEnchanted creature has fear. (It can't be blocked except by artifact creatures and/or black creatures.),"LEA,LEB,2ED,CED,CEI,3ED,4ED,ICE,5ED,6ED,7ED,8ED,9ED,10E",,normal,661,,,Common,Aura,Enchantment
Feedback,{2}{U},3,U,Quinton Hoover,,Enchantment — Aura,"Enchant enchantment\nAt the beginning of the upkeep of enchanted enchantment's controller, Feedback deals 1 damage to that player.","LEA,LEB,2ED,CED,CEI,3ED,4ED,RQS,ITP,5ED",,normal,702,,,Uncommon,Aura,Enchantment
Fire Elemental,{3}{R}{R},5,R,Melissa A. Benson,,Creature — Elemental,,"LEA,LEB,2ED,CED,CEI,3ED,4ED,6ED,S99,7ED,M13","Fire Elementals are ruthless infernos, annihilating and consuming their foes in a frenzied holocaust. Crackling and blazing, they sear swift, terrible paths, leaving the land charred and scorched in their wake.",normal,793,5,4,Uncommon,Elemental,Creature
Fireball,{X}{R},1,R,Mark Tedin,,Sorcery,"Fireball deals X damage divided evenly, rounded down, among any number of target creatures and/or players.\nFireball costs {1} more to cast for each target beyond the first.","LEA,LEB,2ED,CED,CEI,3ED,pMEI,4ED,RQS,pARL,ITP,5ED,ATH,BTD,pMPR,DST,DD2,M10,ARC,M11,PD2,ME4,M12,C13,DD3_JVC",,normal,794,,,Common,,Sorcery
Firebreathing,{R},1,R,Dan Frazier,,Enchantment — Aura,Enchant creature\n{R}: Enchanted creature gets +1/+0 until end of turn.,"LEA,LEB,2ED,CED,CEI,3ED,4ED,MIR,5ED,6ED,9ED,10E,M10,M12","""And topples round the dreary west\nA looming bastion fringed with fire.""\n—Alfred, Lord Tennyson, ""In Memoriam""",normal,795,,,Common,Aura,Enchantment
Flashfires,{3}{R},4,R,Dameon Willich,,Sorcery,Destroy all Plains.,"LEA,LEB,2ED,CED,CEI,3ED,4ED,5ED,POR,6ED,8ED,9ED",,normal,796,,,Uncommon,,Sorcery
Flight,{U},1,U,Anson Maddocks,,Enchantment — Aura,Enchant creature\nEnchanted creature has flying.,"LEA,LEB,2ED,CED,CEI,3ED,4ED,5ED,6ED,S00,7ED,8ED,9ED,M12",,normal,703,,,Common,Aura,Enchantment
Fog,{G},1,G,Jesper Myrfors,,Instant,Prevent all combat damage that would be dealt this turn.,"LEA,LEB,2ED,CED,CEI,3ED,4ED,MIR,5ED,6ED,BTD,7ED,M10,ARC,M11,ME4,M12,M13,M14,EMA",,normal,746,,,Common,,Instant
Force of Nature,{2}{G}{G}{G}{G},6,G,Douglas Shuler,,Creature — Elemental,"Trample (This creature can deal excess combat damage to defending player or planeswalker while attacking.)\nAt the beginning of your upkeep, Force of Nature deals 8 damage to you unless you pay {G}{G}{G}{G}.","LEA,LEB,2ED,CED,CEI,3ED,4ED,5ED,BTD,pREL,9ED,ME4",,normal,747,8,8,Rare,Elemental,Creature
Forcefield,{3},3,,Dan Frazier,,Artifact,"{1}: The next time an unblocked creature of your choice would deal combat damage to you this turn, prevent all but 1 of that damage.","LEA,LEB,2ED,CED,CEI,MED",,normal,611,,,Rare,,Artifact
