name,cost,artist,number,type,text,printings
Armillary Sphere,,Franz Vohwinkel,235,Artifact,"{2}, {T}, Sacrifice Armillary Sphere: Search your library for up to two basic land cards, reveal them, and put them into your hand. Then shuffle your library.","CON,DDG,CMD,DDI,PC2,C13"
Azorius Keyrune,,Daniel Ljunggren,236,Artifact,{T}: Add {W} or {U} to your mana pool.\n{W}{U}: Azorius Keyrune becomes a 2/2 white and blue Bird artifact creature with flying until end of turn.,"RTR,C13"
Basalt Monolith,,Yeong-Hao Han,237,Artifact,Basalt Monolith doesn't untap during your untap step.\n{T}: Add {3} to your mana pool.
{3}: Untap Basalt Monolith.,"LEA,LEB,2ED,CED,CEI,3ED,ME4,C13,C15"
Carnage Altar,,James Paick,238,Artifact,"{3}, Sacrifice a creature: Draw a card.","ZEN,C13"
Conjurer's Closet,,Jason Felix,239,Artifact,"At the beginning of your end step, you may exile target creature you control, then return that card to the battlefield under your control.","AVR,C13"
Crawlspace,,Franz Vohwinkel,240,Artifact,No more than two creatures can attack you each combat.,"ULG,C13"
Darksteel Ingot,,Martina Pilcerova,241,Artifact,Indestructible\n{T}: Add one mana of any color to your mana pool.,"pARL,DST,CMD,M14,C13,C15"
Druidic Satchel,,Matt Stewart,242,Artifact,"{2}, {T}: Reveal the top card of your library. If it's a creature card, put a 1/1 green Saproling creature token onto the battlefield. If it's a land card, put that card onto the battlefield under your control. If it's a noncreature, nonland card, you gain 2 life.","M12,C13"
Eye of Doom,,Yeong-Hao Han,243,Artifact,"When Eye of Doom enters the battlefield, each player chooses a nonland permanent and puts a doom counter on it.\n{2}, {T}, Sacrifice Eye of Doom: Destroy each permanent with a doom counter on it.",C13
Jar of Eyeballs,,Jaime Jones,244,Artifact,"Whenever a creature you control dies, put two eyeball counters on Jar of Eyeballs.\n{3}, {T}, Remove all eyeball counters from Jar of Eyeballs: Look at the top X cards of your library, where X is the number of eyeball counters removed this way. Put one of them into your hand and the rest on the bottom of your library in any order.","DKA,C13"
Leonin Bladetrap,,Randy Gallegos,245,Artifact,"Flash (You may cast this spell any time you could cast an instant.)\n{2}, Sacrifice Leonin Bladetrap: Leonin Bladetrap deals 2 damage to each attacking creature without flying.","MRD,C13"
Mirari,,Donato Giancola,246,Legendary Artifact,"Whenever you cast an instant or sorcery spell, you may pay {3}. If you do, copy that spell. You may choose new targets for the copy.","ODY,TSB,V10,C13"
Myr Battlesphere,,Franz Vohwinkel,247,Artifact Creature — Myr Construct,"When Myr Battlesphere enters the battlefield, put four 1/1 colorless Myr artifact creature tokens onto the battlefield.\nWhenever Myr Battlesphere attacks, you may tap X untapped Myr you control. If you do, Myr Battlesphere gets +X/+0 until end of turn and deals X damage to defending player.","SOM,C13,C14"
Nevinyrral's Disk,,Steve Argyle,248,Artifact,"Nevinyrral's Disk enters the battlefield tapped.\n{1}, {T}: Destroy all artifacts, creatures, and enchantments.","LEA,LEB,2ED,CED,CEI,3ED,4ED,5ED,ATH,MED,V10,C13,VMA,C14"
Nihil Spellbomb,,Franz Vohwinkel,249,Artifact,"{T}, Sacrifice Nihil Spellbomb: Exile all cards from target player's graveyard.\nWhen Nihil Spellbomb is put into a graveyard from the battlefield, you may pay {B}. If you do, draw a card.","SOM,C13"
Obelisk of Esper,,Francis Tsai,250,Artifact,"{T}: Add {W}, {U}, or {B} to your mana pool.","ALA,ARC,C13"
Obelisk of Grixis,,Nils Hamm,251,Artifact,"{T}: Add {U}, {B}, or {R} to your mana pool.","ALA,DDH,C13"
Obelisk of Jund,,Brandon Kitkouski,252,Artifact,"{T}: Add {B}, {R}, or {G} to your mana pool.","ALA,C13"
Pilgrim's Eye,,Dan Scott,253,Artifact Creature — Thopter,"Flying\nWhen Pilgrim's Eye enters the battlefield, you may search your library for a basic land card, reveal it, put it into your hand, then shuffle your library.","WWK,DDI,C13,C14,BFZ"
Plague Boiler,,Mark Tedin,254,Artifact,"At the beginning of your upkeep, put a plague counter on Plague Boiler.\n{1}{B}{G}: Put a plague counter on Plague Boiler or remove a plague counter from it.
When Plague Boiler has three or more plague counters on it, sacrifice it. If you do, destroy all nonland permanents.","RAV,C13"
Pristine Talisman,,Matt Cavotta,255,Artifact,{T}: Add {1} to your mana pool. You gain 1 life.,"pMGD,NPH,C13,C14"
Seer's Sundial,,Franz Vohwinkel,256,Artifact,"Landfall — Whenever a land enters the battlefield under your control, you may pay {2}. If you do, draw a card.","WWK,C13,C14,DDP,C15"
Selesnya Signet,,Raoul Vitale,257,Artifact,"{1}, {T}: Add {G}{W} to your mana pool.","RAV,CMD,C13"
Simic Signet,,Mike Sass,258,Artifact,"{1}, {T}: Add {G}{U} to your mana pool.","DIS,CMD,C13,C15"
Sol Ring,,Mike Bierek,259,Artifact,{T}: Add {2} to your mana pool.,"LEA,LEB,2ED,CED,CEI,3ED,pJGP,V10,ME4,CMD,C13,VMA,C14,C15"
Spine of Ish Sah,,Daniel Ljunggren,260,Artifact,"When Spine of Ish Sah enters the battlefield, destroy target permanent.\nWhen Spine of Ish Sah is put into a graveyard from the battlefield, return Spine of Ish Sah to its owner's hand.","MBS,C13,C14"
Sun Droplet,,Greg Hildebrandt,261,Artifact,"Whenever you're dealt damage, put that many charge counters on Sun Droplet.\nAt the beginning of each upkeep, you may remove a charge counter from Sun Droplet. If you do, you gain 1 life.","MRD,ARC,C13"
Surveyor's Scope,,Daniel Ljunggren,262,Artifact,"{T}, Exile Surveyor's Scope: Search your library for up to X basic land cards, where X is the number of players who control at least two more lands than you. Put those cards onto the battlefield, then shuffle your library.",C13
Swiftfoot Boots,,Svetlin Velinov,263,Artifact — Equipment,Equipped creature has hexproof and haste.\nEquip {1},"M12,C13,C14,C15"
Sword of the Paruns,,Greg Hildebrandt,264,Artifact — Equipment,"As long as equipped creature is tapped, tapped creatures you control get +2/+0.\nAs long as equipped creature is untapped, untapped creatures you control get +0/+2.
{3}: You may tap or untap equipped creature.
Equip {3}","GPT,C13"
Temple Bell,,Mark Tedin,265,Artifact,{T}: Each player draws a card.,"M11,C13"
Thousand-Year Elixir,,Richard Sardinha,266,Artifact,"You may activate abilities of creatures you control as though those creatures had haste.\n{1}, {T}: Untap target creature.","LRW,C13"
Thunderstaff,,Cliff Childs,267,Artifact,"As long as Thunderstaff is untapped, if a creature would deal combat damage to you, prevent 1 of that damage.\n{2}, {T}: Attacking creatures get +1/+0 until end of turn.","DST,ARC,C13"
Tower of Fortunes,,Matt Cavotta,268,Artifact,"{8}, {T}: Draw four cards.","MRD,C13"
Viseling,,Kev Walker,269,Artifact Creature — Construct,"At the beginning of each opponent's upkeep, Viseling deals X damage to that player, where X is the number of cards in his or her hand minus 4.","NMS,C13"
Wayfarer's Bauble,,Darrell Riche,270,Artifact,"{2}, {T}, Sacrifice Wayfarer's Bauble: Search your library for a basic land card and put that card onto the battlefield tapped. Then shuffle your library.","5DN,DDI,C13,C14,MM2,C15"
Well of Lost Dreams,,Jeff Miracola,271,Artifact,"Whenever you gain life, you may pay {X}, where X is less than or equal to the amount of life you gained. If you do, draw X cards.","DST,C13"
Akoum Refuge,,Fred Fields,272,Land,"Akoum Refuge enters the battlefield tapped.\nWhen Akoum Refuge enters the battlefield, you gain 1 life.
{T}: Add {B} or {R} to your mana pool.","ZEN,CMD,DDK,C13,DDP"
Arcane Sanctum,,Anthony Francisco,273,Land,"Arcane Sanctum enters the battlefield tapped.\n{T}: Add {W}, {U}, or {B} to your mana pool.","ALA,C13"
Azorius Chancery,,John Avon,274,Land,"Azorius Chancery enters the battlefield tapped.\nWhen Azorius Chancery enters the battlefield, return a land you control to its owner's hand.
{T}: Add {W}{U} to your mana pool.","DIS,CMD,DDI,C13,MM2"
Azorius Guildgate,,Drew Baker,275,Land — Gate,Azorius Guildgate enters the battlefield tapped.\n{T}: Add {W} or {U} to your mana pool.,"RTR,DGM,C13"
Bant Panorama,,Donato Giancola,276,Land,"{T}: Add {1} to your mana pool.\n{1}, {T}, Sacrifice Bant Panorama: Search your library for a basic Forest, Plains, or Island card and put it onto the battlefield tapped. Then shuffle your library.","ALA,C13"
Barren Moor,,Heather Hudson,277,Land,"Barren Moor enters the battlefield tapped.\n{T}: Add {B} to your mana pool.
Cycling {B} ({B}, Discard this card: Draw a card.)","ONS,DDC,ARC,CMD,DDJ,C13,VMA,C14,DD3_DVD,C15"
Bojuka Bog,,Howard Lyon,278,Land,"Bojuka Bog enters the battlefield tapped.\nWhen Bojuka Bog enters the battlefield, exile all cards from target player's graveyard.
{T}: Add {B} to your mana pool.","WWK,CMD,C13,C14"
Boros Garrison,,John Avon,279,Land,"Boros Garrison enters the battlefield tapped.\nWhen Boros Garrison enters the battlefield, return a land you control to its owner's hand.
{T}: Add {R}{W} to your mana pool.","RAV,HOP,CMD,C13,MM2,C15"
Boros Guildgate,,Noah Bradley,280,Land — Gate,Boros Guildgate enters the battlefield tapped.\n{T}: Add {R} or {W} to your mana pool.,"GTC,DGM,DDL,C13,C15"
Command Tower,,Ryan Yee,281,Land,{T}: Add to your mana pool one mana of any color in your commander's color identity.,"pJGP,CMD,CM1,C13,C15"
Contested Cliffs,,Anthony S. Waters,282,Land,"{T}: Add {1} to your mana pool.\n{R}{G}, {T}: Target Beast creature you control fights target creature an opponent controls. (Each deals damage equal to its power to the other.)","ONS,C13"
Crumbling Necropolis,,Dave Kendall,283,Land,"Crumbling Necropolis enters the battlefield tapped.\n{T}: Add {U}, {B}, or {R} to your mana pool.","ALA,DDH,C13"
Dimir Guildgate,,Cliff Childs,284,Land — Gate,Dimir Guildgate enters the battlefield tapped.\n{T}: Add {U} or {B} to your mana pool.,"GTC,DGM,C13"
Drifting Meadow,,Jonas De Ro,285,Land,"Drifting Meadow enters the battlefield tapped.\n{T}: Add {W} to your mana pool.
Cycling {2} ({2}, Discard this card: Draw a card.)","USG,ATH,BRB,C13,C14,C15"
Esper Panorama,,Franz Vohwinkel,286,Land,"{T}: Add {1} to your mana pool.\n{1}, {T}, Sacrifice Esper Panorama: Search your library for a basic Plains, Island, or Swamp card and put it onto the battlefield tapped. Then shuffle your library.","ALA,C13"
Evolving Wilds,,Steven Belledin,287,Land,"{T}, Sacrifice Evolving Wilds: Search your library for a basic land card and put it onto the battlefield tapped. Then shuffle your library.","pMEI,pFNM,ROE,CMD,DDH,DKA,M13,DDK,C13,M15,DDN,C14,DDO,DTK,MM2,ORI,DDP,BFZ,C15"
Faerie Conclave,,Stephan Martiniere,288,Land,Faerie Conclave enters the battlefield tapped.\n{T}: Add {U} to your mana pool.
{1}{U}: Faerie Conclave becomes a 2/1 blue Faerie creature with flying until end of turn. It's still a land.,"ULG,10E,pSUM,C13"
Forgotten Cave,,Tony Szczudlo,289,Land,"Forgotten Cave enters the battlefield tapped.\n{T}: Add {R} to your mana pool.
Cycling {R} ({R}, Discard this card: Draw a card.)","ONS,EVG,CMD,DDJ,C13,VMA,C14,DD3_EVG,C15"
Golgari Guildgate,,Eytan Zana,290,Land — Gate,Golgari Guildgate enters the battlefield tapped.\n{T}: Add {B} or {G} to your mana pool.,"RTR,DGM,C13,DDM,C15"
Golgari Rot Farm,,John Avon,291,Land,"Golgari Rot Farm enters the battlefield tapped.\nWhen Golgari Rot Farm enters the battlefield, return a land you control to its owner's hand.
{T}: Add {B}{G} to your mana pool.","RAV,CMD,DDJ,C13,MM2,C15"
Grim Backwoods,,Vincent Proce,292,Land,"{T}: Add {1} to your mana pool.\n{2}{B}{G}, {T}, Sacrifice a creature: Draw a card.","DKA,C13,C15"
Grixis Panorama,,Nils Hamm,293,Land,"{T}: Add {1} to your mana pool.\n{1}, {T}, Sacrifice Grixis Panorama: Search your library for a basic Island, Swamp, or Mountain card and put it onto the battlefield tapped. Then shuffle your library.","ALA,C13"
Gruul Guildgate,,Randy Gallegos,294,Land — Gate,Gruul Guildgate enters the battlefield tapped.\n{T}: Add {R} or {G} to your mana pool.,"GTC,DGM,C13"
Homeward Path,,Tomasz Jedruszek,295,Land,{T}: Add {1} to your mana pool.\n{T}: Each player gains control of all creatures he or she owns.,"CMD,C13"
Izzet Boilerworks,,John Avon,296,Land,"Izzet Boilerworks enters the battlefield tapped.\nWhen Izzet Boilerworks enters the battlefield, return a land you control to its owner's hand.
{T}: Add {U}{R} to your mana pool.","GPT,CMD,DDJ,C13,MM2,C15"
Izzet Guildgate,,Noah Bradley,297,Land — Gate,Izzet Guildgate enters the battlefield tapped.\n{T}: Add {U} or {R} to your mana pool.,"RTR,DGM,C13,C15"
Jund Panorama,,Jaime Jones,298,Land,"{T}: Add {1} to your mana pool.\n{1}, {T}, Sacrifice Jund Panorama: Search your library for a basic Swamp, Mountain, or Forest card and put it onto the battlefield tapped. Then shuffle your library.","ALA,C13"
Jungle Shrine,,Wayne Reynolds,299,Land,"Jungle Shrine enters the battlefield tapped.\n{T}: Add {R}, {G}, or {W} to your mana pool.","ALA,DDH,C13"
Jwar Isle Refuge,,Cyril Van Der Haegen,300,Land,"Jwar Isle Refuge enters the battlefield tapped.\nWhen Jwar Isle Refuge enters the battlefield, you gain 1 life.
{T}: Add {U} or {B} to your mana pool.","ZEN,CMD,PC2,C13"
Kazandu Refuge,,Franz Vohwinkel,301,Land,"Kazandu Refuge enters the battlefield tapped.\nWhen Kazandu Refuge enters the battlefield, you gain 1 life.
{T}: Add {R} or {G} to your mana pool.","ZEN,ARC,CMD,DDH,PC2,DDL,C13"
Khalni Garden,,Ryan Pancoast,302,Land,"Khalni Garden enters the battlefield tapped.\nWhen Khalni Garden enters the battlefield, put a 0/1 green Plant creature token onto the battlefield.
{T}: Add {G} to your mana pool.","WWK,ARC,PC2,C13"
Kher Keep,,Paolo Parente,303,Legendary Land,"{T}: Add {1} to your mana pool.\n{1}{R}, {T}: Put a 0/1 red Kobold creature token named Kobolds of Kher Keep onto the battlefield.","TSP,C13"
Llanowar Reborn,,Philip Straub,304,Land,"Llanowar Reborn enters the battlefield tapped.\n{T}: Add {G} to your mana pool.
Graft 1 (This land enters the battlefield with a +1/+1 counter on it. Whenever a creature enters the battlefield, you may move a +1/+1 counter from this land onto it.)","FUT,ARC,DDL,C13,C15"
Lonely Sandbar,,Heather Hudson,305,Land,"Lonely Sandbar enters the battlefield tapped.\n{T}: Add {U} to your mana pool.
Cycling {U} ({U}, Discard this card: Draw a card.)","ONS,CMD,DDJ,C13,VMA,C14"
Molten Slagheap,,Daren Bader,306,Land,"{T}: Add {1} to your mana pool.\n{1}, {T}: Put a storage counter on Molten Slagheap.
{1}, Remove X storage counters from Molten Slagheap: Add X mana in any combination of {B} and/or {R} to your mana pool.","TSP,CMD,C13"
Mosswort Bridge,,Jeremy Jarvis,307,Land,"Hideaway (This land enters the battlefield tapped. When it does, look at the top four cards of your library, exile one face down, then put the rest on the bottom of your library.)\n{T}: Add {G} to your mana pool.
{G}, {T}: You may play the exiled card without paying its mana cost if creatures you control have total power 10 or greater.","LRW,ARC,C13,C15"
Naya Panorama,,Hideaki Takamura,308,Land,"{T}: Add {1} to your mana pool.\n{1}, {T}, Sacrifice Naya Panorama: Search your library for a basic Mountain, Forest, or Plains card and put it onto the battlefield tapped. Then shuffle your library.","ALA,C13"
New Benalia,,Richard Wright,309,Land,"New Benalia enters the battlefield tapped.\nWhen New Benalia enters the battlefield, scry 1. (Look at the top card of your library. You may put that card on the bottom of your library.)
{T}: Add {W} to your mana pool.","FUT,DDI,DDL,C13,C15"
Opal Palace,,Andreas Rocha,310,Land,"{T}: Add {1} to your mana pool.\n{1}, {T}: Add to your mana pool one mana of any color in your commander's color identity. If you spend this mana to cast your commander, it enters the battlefield with a number of additional +1/+1 counters on it equal to the number of times it's been cast from the command zone this game.",C13
Orzhov Basilica,,John Avon,311,Land,"Orzhov Basilica enters the battlefield tapped.\nWhen Orzhov Basilica enters the battlefield, return a land you control to its owner's hand.
{T}: Add {W}{B} to your mana pool.","GPT,CMD,C13,MM2,C15"
Orzhov Guildgate,,John Avon,312,Land — Gate,Orzhov Guildgate enters the battlefield tapped.\n{T}: Add {W} or {B} to your mana pool.,"GTC,DGM,C13,C15"
Rakdos Carnarium,,John Avon,313,Land,"Rakdos Carnarium enters the battlefield tapped.\nWhen Rakdos Carnarium enters the battlefield, return a land you control to its owner's hand.
{T}: Add {B}{R} to your mana pool.","DIS,ARC,CMD,DDK,C13,MM2"
Rakdos Guildgate,,Eytan Zana,314,Land — Gate,Rakdos Guildgate enters the battlefield tapped.\n{T}: Add {B} or {R} to your mana pool.,"RTR,DGM,C13"
Rupture Spire,,Jaime Jones,315,Land,"Rupture Spire enters the battlefield tapped.\nWhen Rupture Spire enters the battlefield, sacrifice it unless you pay {1}.
{T}: Add one mana of any color to your mana pool.","CON,H09,CMD,DDH,PC2,C13"
Saltcrusted Steppe,,Greg Staples,316,Land,"{T}: Add {1} to your mana pool.\n{1}, {T}: Put a storage counter on Saltcrusted Steppe.
{1}, Remove X storage counters from Saltcrusted Steppe: Add X mana in any combination of {G} and/or {W} to your mana pool.","TSP,C13"
Savage Lands,,Vance Kovacs,317,Land,"Savage Lands enters the battlefield tapped.\n{T}: Add {B}, {R}, or {G} to your mana pool.","pFNM,ALA,C13"
Seaside Citadel,,Volkan Baga,318,Land,"Seaside Citadel enters the battlefield tapped.\n{T}: Add {G}, {W}, or {U} to your mana pool.","ALA,C13"
Secluded Steppe,,Heather Hudson,319,Land,"Secluded Steppe enters the battlefield tapped.\n{T}: Add {W} to your mana pool.
Cycling {W} ({W}, Discard this card: Draw a card.)","ONS,DDC,ARC,CMD,C13,VMA,C14,DD3_DVD,DDO,C15"
Sejiri Refuge,,Ryan Pancoast,320,Land,"Sejiri Refuge enters the battlefield tapped.\nWhen Sejiri Refuge enters the battlefield, you gain 1 life.
{T}: Add {W} or {U} to your mana pool.","ZEN,DDI,C13"
Selesnya Guildgate,,Howard Lyon,321,Land — Gate,Selesnya Guildgate enters the battlefield tapped.\n{T}: Add {G} or {W} to your mana pool.,"RTR,DGM,C13"
Selesnya Sanctuary,,John Avon,322,Land,"Selesnya Sanctuary enters the battlefield tapped.\nWhen Selesnya Sanctuary enters the battlefield, return a land you control to its owner's hand.
{T}: Add {G}{W} to your mana pool.","RAV,DDG,CMD,PC2,C13,MM2"
Simic Guildgate,,Svetlin Velinov,323,Land — Gate,Simic Guildgate enters the battlefield tapped.\n{T}: Add {G} or {U} to your mana pool.,"GTC,DGM,C13,C15"
Slippery Karst,,Stephen Daniele,324,Land,"Slippery Karst enters the battlefield tapped.\n{T}: Add {G} to your mana pool.
Cycling {2} ({2}, Discard this card: Draw a card.)","USG,ATH,BRB,BTD,DDD,C13,C14,DD3_GVL,C15"
Smoldering Crater,,Mark Tedin,325,Land,"Smoldering Crater enters the battlefield tapped.\n{T}: Add {R} to your mana pool.
Cycling {2} ({2}, Discard this card: Draw a card.)","USG,ATH,BTD,C13,C14,C15"
Springjack Pasture,,Terese Nielsen,326,Land,"{T}: Add {1} to your mana pool.\n{4}, {T}: Put a 0/1 white Goat creature token onto the battlefield.
{T}, Sacrifice X Goats: Add X mana of any one color to your mana pool. You gain X life.","EVE,C13"
Temple of the False God,,Brian Snõddy,327,Land,{T}: Add {2} to your mana pool. Activate this ability only if you control five or more lands.,"SCG,CMD,C13,C14,DDO,C15"
Terramorphic Expanse,,Dan Scott,328,Land,"{T}, Sacrifice Terramorphic Expanse: Search your library for a basic land card and put it onto the battlefield tapped. Then shuffle your library.","TSP,10E,M10,HOP,H09,DDE,ARC,M11,CMD,DDH,PC2,MMA,C13,DDN,C14,C15"
Tranquil Thicket,,Heather Hudson,329,Land,"Tranquil Thicket enters the battlefield tapped.\n{T}: Add {G} to your mana pool.
Cycling {G} ({G}, Discard this card: Draw a card.)","ONS,EVG,ARC,CMD,DDJ,C13,VMA,C14,DD3_EVG"
Transguild Promenade,,Noah Bradley,330,Land,"Transguild Promenade enters the battlefield tapped.\nWhen Transguild Promenade enters the battlefield, sacrifice it unless you pay {1}.
{T}: Add one mana of any color to your mana pool.","RTR,C13"
Urza's Factory,,Mark Tedin,331,Land — Urza’s,"{T}: Add {1} to your mana pool.\n{7}, {T}: Put a 2/2 colorless Assembly-Worker artifact creature token onto the battlefield.","pCMP,TSP,C13"
"Vitu-Ghazi, the City-Tree",,Martina Pilcerova,332,Land,"{T}: Add {1} to your mana pool.\n{2}{G}{W}, {T}: Put a 1/1 green Saproling creature token onto the battlefield.","RAV,ARC,DDH,PC2,C13"
Vivid Crag,,Martina Pilcerova,333,Land,"Vivid Crag enters the battlefield tapped with two charge counters on it.\n{T}: Add {R} to your mana pool.
{T}, Remove a charge counter from Vivid Crag: Add one mana of any color to your mana pool.","LRW,CMD,MMA,C13,C15"
Vivid Creek,,Fred Fields,334,Land,"Vivid Creek enters the battlefield tapped with two charge counters on it.\n{T}: Add {U} to your mana pool.
{T}, Remove a charge counter from Vivid Creek: Add one mana of any color to your mana pool.","LRW,H09,CMD,PC2,MMA,C13,C15"
Vivid Grove,,Howard Lyon,335,Land,"Vivid Grove enters the battlefield tapped with two charge counters on it.\n{T}: Add {G} to your mana pool.
{T}, Remove a charge counter from Vivid Grove: Add one mana of any color to your mana pool.","LRW,H09,CMD,MMA,C13,C15"
Vivid Marsh,,John Avon,336,Land,"Vivid Marsh enters the battlefield tapped with two charge counters on it.\n{T}: Add {B} to your mana pool.
{T}, Remove a charge counter from Vivid Marsh: Add one mana of any color to your mana pool.","LRW,CMD,MMA,C13,C15"
Plains,,John Avon,337,Basic Land — Plains,,"LEA,LEB,2ED,CED,CEI,3ED,4ED,ICE,RQS,pARL,MIR,ITP,5ED,POR,pPRE,TMP,pJGP,PO2,UGL,pALP,USG,ATH,6ED,PTK,S99,pGRU,MMQ,BRB,pELP,S00,INV,7ED,ODY,ONS,8ED,MRD,CHK,UNH,9ED,RAV,CST,TSP,10E,MED,LRW,SHM,ALA,DDC,M10,HOP,ME3,ZEN,H09,DDE,ROE,ARC,M11,DDF,SOM,MBS,DDG,NPH,CMD,M12,DDH,ISD,DDI,AVR,PC2,M13,RTR,DDK,M14,DDL,THS,C13,MD1,M15,DDN,KTK,C14,DD3_DVD,FRF,DDO,DTK,TPR,ORI,DDP,BFZ,C15"
Plains,,Michael Komarck,338,Basic Land — Plains,,"LEA,LEB,2ED,CED,CEI,3ED,4ED,ICE,RQS,pARL,MIR,ITP,5ED,POR,pPRE,TMP,pJGP,PO2,UGL,pALP,USG,ATH,6ED,PTK,S99,pGRU,MMQ,BRB,pELP,S00,INV,7ED,ODY,ONS,8ED,MRD,CHK,UNH,9ED,RAV,CST,TSP,10E,MED,LRW,SHM,ALA,DDC,M10,HOP,ME3,ZEN,H09,DDE,ROE,ARC,M11,DDF,SOM,MBS,DDG,NPH,CMD,M12,DDH,ISD,DDI,AVR,PC2,M13,RTR,DDK,M14,DDL,THS,C13,MD1,M15,DDN,KTK,C14,DD3_DVD,FRF,DDO,DTK,TPR,ORI,DDP,BFZ,C15"
Plains,,Jung Park,339,Basic Land — Plains,,"LEA,LEB,2ED,CED,CEI,3ED,4ED,ICE,RQS,pARL,MIR,ITP,5ED,POR,pPRE,TMP,pJGP,PO2,UGL,pALP,USG,ATH,6ED,PTK,S99,pGRU,MMQ,BRB,pELP,S00,INV,7ED,ODY,ONS,8ED,MRD,CHK,UNH,9ED,RAV,CST,TSP,10E,MED,LRW,SHM,ALA,DDC,M10,HOP,ME3,ZEN,H09,DDE,ROE,ARC,M11,DDF,SOM,MBS,DDG,NPH,CMD,M12,DDH,ISD,DDI,AVR,PC2,M13,RTR,DDK,M14,DDL,THS,C13,MD1,M15,DDN,KTK,C14,DD3_DVD,FRF,DDO,DTK,TPR,ORI,DDP,BFZ,C15"
Plains,,Andreas Rocha,340,Basic Land — Plains,,"LEA,LEB,2ED,CED,CEI,3ED,4ED,ICE,RQS,pARL,MIR,ITP,5ED,POR,pPRE,TMP,pJGP,PO2,UGL,pALP,USG,ATH,6ED,PTK,S99,pGRU,MMQ,BRB,pELP,S00,INV,7ED,ODY,ONS,8ED,MRD,CHK,UNH,9ED,RAV,CST,TSP,10E,MED,LRW,SHM,ALA,DDC,M10,HOP,ME3,ZEN,H09,DDE,ROE,ARC,M11,DDF,SOM,MBS,DDG,NPH,CMD,M12,DDH,ISD,DDI,AVR,PC2,M13,RTR,DDK,M14,DDL,THS,C13,MD1,M15,DDN,KTK,C14,DD3_DVD,FRF,DDO,DTK,TPR,ORI,DDP,BFZ,C15"
Island,,Noah Bradley,341,Basic Land — Island,,"LEA,LEB,2ED,CED,CEI,3ED,4ED,ICE,RQS,pARL,MIR,ITP,5ED,POR,TMP,pJGP,PO2,UGL,pALP,USG,6ED,PTK,S99,pGRU,MMQ,BRB,pELP,S00,BTD,INV,7ED,ODY,ONS,8ED,MRD,CHK,UNH,9ED,RAV,CST,TSP,10E,MED,LRW,SHM,ALA,DD2,M10,HOP,ME3,ZEN,H09,DDE,ROE,DPA,ARC,M11,DDF,SOM,MBS,NPH,CMD,M12,DDH,ISD,DDI,AVR,PC2,M13,DDJ,RTR,M14,THS,C13,DDM,M15,DDN,KTK,C14,DD3_JVC,FRF,DDO,DTK,TPR,ORI,BFZ,C15"
Island,,Cliff Childs,342,Basic Land — Island,,"LEA,LEB,2ED,CED,CEI,3ED,4ED,ICE,RQS,pARL,MIR,ITP,5ED,POR,TMP,pJGP,PO2,UGL,pALP,USG,6ED,PTK,S99,pGRU,MMQ,BRB,pELP,S00,BTD,INV,7ED,ODY,ONS,8ED,MRD,CHK,UNH,9ED,RAV,CST,TSP,10E,MED,LRW,SHM,ALA,DD2,M10,HOP,ME3,ZEN,H09,DDE,ROE,DPA,ARC,M11,DDF,SOM,MBS,NPH,CMD,M12,DDH,ISD,DDI,AVR,PC2,M13,DDJ,RTR,M14,THS,C13,DDM,M15,DDN,KTK,C14,DD3_JVC,FRF,DDO,DTK,TPR,ORI,BFZ,C15"
Island,,Michael Komarck,343,Basic Land — Island,,"LEA,LEB,2ED,CED,CEI,3ED,4ED,ICE,RQS,pARL,MIR,ITP,5ED,POR,TMP,pJGP,PO2,UGL,pALP,USG,6ED,PTK,S99,pGRU,MMQ,BRB,pELP,S00,BTD,INV,7ED,ODY,ONS,8ED,MRD,CHK,UNH,9ED,RAV,CST,TSP,10E,MED,LRW,SHM,ALA,DD2,M10,HOP,ME3,ZEN,H09,DDE,ROE,DPA,ARC,M11,DDF,SOM,MBS,NPH,CMD,M12,DDH,ISD,DDI,AVR,PC2,M13,DDJ,RTR,M14,THS,C13,DDM,M15,DDN,KTK,C14,DD3_JVC,FRF,DDO,DTK,TPR,ORI,BFZ,C15"
Island,,Jung Park,344,Basic Land — Island,,"LEA,LEB,2ED,CED,CEI,3ED,4ED,ICE,RQS,pARL,MIR,ITP,5ED,POR,TMP,pJGP,PO2,UGL,pALP,USG,6ED,PTK,S99,pGRU,MMQ,BRB,pELP,S00,BTD,INV,7ED,ODY,ONS,8ED,MRD,CHK,UNH,9ED,RAV,CST,TSP,10E,MED,LRW,SHM,ALA,DD2,M10,HOP,ME3,ZEN,H09,DDE,ROE,DPA,ARC,M11,DDF,SOM,MBS,NPH,CMD,M12,DDH,ISD,DDI,AVR,PC2,M13,DDJ,RTR,M14,THS,C13,DDM,M15,DDN,KTK,C14,DD3_JVC,FRF,DDO,DTK,TPR,ORI,BFZ,C15"
Swamp,,Mike Bierek,345,Basic Land — Swamp,,"LEA,LEB,2ED,CED,CEI,3ED,4ED,ICE,RQS,pARL,MIR,ITP,5ED,POR,TMP,pJGP,PO2,UGL,pALP,USG,ATH,6ED,PTK,S99,pGRU,MMQ,BRB,pELP,S00,BTD,INV,7ED,ODY,DKM,ONS,8ED,MRD,CHK,UNH,9ED,RAV,CST,TSP,10E,MED,LRW,SHM,ALA,DDC,M10,HOP,ME3,ZEN,DDD,H09,DDE,ROE,DPA,ARC,M11,SOM,MBS,NPH,CMD,M12,DDH,ISD,PD3,AVR,PC2,M13,DDJ,RTR,DDK,M14,THS,C13,DDM,MD1,M15,DDN,KTK,C14,DD3_DVD,DD3_GVL,FRF,DTK,TPR,ORI,DDP,BFZ,C15"
Swamp,,Jonas De Ro,346,Basic Land — Swamp,,"LEA,LEB,2ED,CED,CEI,3ED,4ED,ICE,RQS,pARL,MIR,ITP,5ED,POR,TMP,pJGP,PO2,UGL,pALP,USG,ATH,6ED,PTK,S99,pGRU,MMQ,BRB,pELP,S00,BTD,INV,7ED,ODY,DKM,ONS,8ED,MRD,CHK,UNH,9ED,RAV,CST,TSP,10E,MED,LRW,SHM,ALA,DDC,M10,HOP,ME3,ZEN,DDD,H09,DDE,ROE,DPA,ARC,M11,SOM,MBS,NPH,CMD,M12,DDH,ISD,PD3,AVR,PC2,M13,DDJ,RTR,DDK,M14,THS,C13,DDM,MD1,M15,DDN,KTK,C14,DD3_DVD,DD3_GVL,FRF,DTK,TPR,ORI,DDP,BFZ,C15"
Swamp,,Jung Park,347,Basic Land — Swamp,,"LEA,LEB,2ED,CED,CEI,3ED,4ED,ICE,RQS,pARL,MIR,ITP,5ED,POR,TMP,pJGP,PO2,UGL,pALP,USG,ATH,6ED,PTK,S99,pGRU,MMQ,BRB,pELP,S00,BTD,INV,7ED,ODY,DKM,ONS,8ED,MRD,CHK,UNH,9ED,RAV,CST,TSP,10E,MED,LRW,SHM,ALA,DDC,M10,HOP,ME3,ZEN,DDD,H09,DDE,ROE,DPA,ARC,M11,SOM,MBS,NPH,CMD,M12,DDH,ISD,PD3,AVR,PC2,M13,DDJ,RTR,DDK,M14,THS,C13,DDM,MD1,M15,DDN,KTK,C14,DD3_DVD,DD3_GVL,FRF,DTK,TPR,ORI,DDP,BFZ,C15"
