name,cost,artist,number,type,text,printings
Hibernation's End,,Steven Belledin,110,Enchantment,"Cumulative upkeep {1} (At the beginning of your upkeep, put an age counter on this permanent, then sacrifice it unless you pay its upkeep cost for each age counter on it.)\nWhenever you pay Hibernation's End's cumulative upkeep, you may search your library for a creature card with converted mana cost equal to the number of age counters on Hibernation's End and put it onto the battlefield. If you do, shuffle your library.",CSP
Into the North,,Richard Sardinha,111,Sorcery,Search your library for a snow land card and put it onto the battlefield tapped. Then shuffle your library.,CSP
Karplusan Strider,,Dan Scott,112,Creature — Yeti,Karplusan Strider can't be the target of blue or black spells.,"CSP,10E,MM2"
Martyr of Spores,,Dan Scott,113,Creature — Human Shaman,"{1}, Reveal X green cards from your hand, Sacrifice Martyr of Spores: Target creature gets +X/+X until end of turn.",CSP
Mystic Melting,,Chippy,114,Instant,Destroy target artifact or enchantment.\nDraw a card at the beginning of the next turn's upkeep.,CSP
Ohran Viper,,Kev Walker,115,Snow Creature — Snake,"Whenever Ohran Viper deals combat damage to a creature, destroy that creature at end of combat.\nWhenever Ohran Viper deals combat damage to a player, you may draw a card.","CSP,DDM,C15"
Panglacial Wurm,,Jim Pavelec,116,Creature — Wurm,"Trample\nWhile you're searching your library, you may cast Panglacial Wurm from your library.",CSP
Resize,,Daren Bader,117,Instant,"Target creature gets +3/+3 until end of turn.\nRecover {1}{G} (When a creature is put into your graveyard from the battlefield, you may pay {1}{G}. If you do, return this card from your graveyard to your hand. Otherwise, exile this card.)",CSP
Rimehorn Aurochs,,Brian Despain,118,Snow Creature — Aurochs,"Trample\nWhenever Rimehorn Aurochs attacks, it gets +1/+0 until end of turn for each other attacking Aurochs.
{2}{S}: Target creature blocks target creature this turn if able. ({S} can be paid with one mana from a snow permanent.)",CSP
Ronom Hulk,,Zoltan Boros & Gabor Szikszai,119,Creature — Beast,"Protection from snow\nCumulative upkeep {1} (At the beginning of your upkeep, put an age counter on this permanent, then sacrifice it unless you pay its upkeep cost for each age counter on it.)",CSP
Shape of the Wiitigo,,Ron Spencer,120,Enchantment — Aura,"Enchant creature\nWhen Shape of the Wiitigo enters the battlefield, put six +1/+1 counters on enchanted creature.
At the beginning of your upkeep, put a +1/+1 counter on enchanted creature if it attacked or blocked since your last upkeep. Otherwise, remove a +1/+1 counter from it.",CSP
Sheltering Ancient,,Pete Venters,121,Creature — Treefolk,"Trample\nCumulative upkeep—Put a +1/+1 counter on a creature an opponent controls. (At the beginning of your upkeep, put an age counter on this permanent, then sacrifice it unless you pay its upkeep cost for each age counter on it.)",CSP
Simian Brawler,,Warren Mahy,122,Creature — Ape Warrior,Discard a land card: Simian Brawler gets +1/+1 until end of turn.,CSP
Sound the Call,,Jim Nelson,123,Sorcery,Put a 1/1 green Wolf creature token onto the battlefield. It has "This creature gets +1/+1 for each card named Sound the Call in each graveyard.",CSP
Steam Spitter,,Christopher Rush,124,Creature — Spider,Reach (This creature can block creatures with flying.)\n{R}: Steam Spitter gets +1/+0 until end of turn.,CSP
Surging Might,,Luca Zontini,125,Enchantment — Aura,"Enchant creature\nEnchanted creature gets +2/+2.
Ripple 4 (When you cast this spell, you may reveal the top four cards of your library. You may cast any revealed cards with the same name as this spell without paying their mana costs. Put the rest on the bottom of your library.)",CSP
Blizzard Specter,,Hideaki Takamura,126,Snow Creature — Specter,"Flying\nWhenever Blizzard Specter deals combat damage to a player, choose one —
• That player returns a permanent he or she controls to its owner's hand.
• That player discards a card.",CSP
Deepfire Elemental,,Joel Thomas,127,Creature — Elemental,{X}{X}{1}: Destroy target artifact or creature with converted mana cost X.,"CSP,C13"
Diamond Faerie,,Heather Hudson,128,Snow Creature — Faerie,Flying\n{1}{S}: Snow creatures you control get +1/+1 until end of turn. ({S} can be paid with one mana from a snow permanent.),CSP
"Garza Zol, Plague Queen",,Darrell Riche,129,Legendary Creature — Vampire,"Flying, haste\nWhenever a creature dealt damage by Garza Zol, Plague Queen this turn dies, put a +1/+1 counter on Garza Zol.
Whenever Garza Zol deals combat damage to a player, you may draw a card.",CSP
Juniper Order Ranger,,Greg Hildebrandt,130,Creature — Human Knight,"Whenever another creature enters the battlefield under your control, put a +1/+1 counter on that creature and a +1/+1 counter on Juniper Order Ranger.","CSP,DDG"
"Sek'Kuar, Deathkeeper",,Jeff Miracola,131,Legendary Creature — Orc Shaman,"Whenever another nontoken creature you control dies, put a 3/1 black and red Graveborn creature token with haste onto the battlefield.","CSP,C13"
Tamanoa,,rk post,132,Creature — Spirit,"Whenever a noncreature source you control deals damage, you gain that much life.",CSP
Vanish into Memory,,Rebekah Lynn,133,Instant,"Exile target creature. You draw cards equal to that creature's power. At the beginning of your next upkeep, return that card to the battlefield under its owner's control. If you do, discard cards equal to that creature's toughness.","CSP,DDI"
Wilderness Elemental,,Anthony S. Waters,134,Creature — Elemental,Trample\nWilderness Elemental's power is equal to the number of nonbasic lands your opponents control.,CSP
Zur the Enchanter,,Pete Venters,135,Legendary Creature — Human Wizard,"Flying\nWhenever Zur the Enchanter attacks, you may search your library for an enchantment card with converted mana cost 3 or less and put it onto the battlefield. If you do, shuffle your library.",CSP
Coldsteel Heart,,Mark Romanoski,136,Snow Artifact,"Coldsteel Heart enters the battlefield tapped.\nAs Coldsteel Heart enters the battlefield, choose a color.
{T}: Add one mana of the chosen color to your mana pool.","CSP,C15"
Jester's Scepter,,Matt Cavotta,137,Artifact,"When Jester's Scepter enters the battlefield, exile the top five cards of target player's library face down. You may look at those cards for as long as they remain exiled.\n{2}, {T}, Put a card exiled with Jester's Scepter into its owner's graveyard: Counter target spell if it has the same name as that card.",CSP
Mishra's Bauble,,Chippy,138,Artifact,"{T}, Sacrifice Mishra's Bauble: Look at the top card of target player's library. Draw a card at the beginning of the next turn's upkeep.",CSP
Phyrexian Ironfoot,,Stephan Martiniere,139,Snow Artifact Creature — Construct,Phyrexian Ironfoot doesn't untap during your untap step.\n{1}{S}: Untap Phyrexian Ironfoot. ({S} can be paid with one mana from a snow permanent.),CSP
Phyrexian Snowcrusher,,Dave Allsop,140,Snow Artifact Creature — Juggernaut,Phyrexian Snowcrusher attacks each turn if able.\n{1}{S}: Phyrexian Snowcrusher gets +1/+0 until end of turn. ({S} can be paid with one mana from a snow permanent.),CSP
Phyrexian Soulgorger,,Brian Snõddy,141,Snow Artifact Creature — Construct,"Cumulative upkeep—Sacrifice a creature. (At the beginning of your upkeep, put an age counter on this permanent, then sacrifice it unless you pay its upkeep cost for each age counter on it.)",CSP
Thrumming Stone,,Rob Alexander,142,Legendary Artifact,"Spells you cast have ripple 4. (Whenever you cast a spell, you may reveal the top four cards of your library. You may cast any revealed cards with the same name as the spell without paying their mana costs. Put the rest on the bottom of your library.)",CSP
Arctic Flats,,John Avon,143,Snow Land,Arctic Flats enters the battlefield tapped.\n{T}: Add {G} or {W} to your mana pool.,CSP
Boreal Shelf,,Heather Hudson,144,Snow Land,Boreal Shelf enters the battlefield tapped.\n{T}: Add {W} or {U} to your mana pool.,CSP
Dark Depths,,Stephan Martiniere,145,Legendary Snow Land,"Dark Depths enters the battlefield with ten ice counters on it.\n{3}: Remove an ice counter from Dark Depths.
When Dark Depths has no ice counters on it, sacrifice it. If you do, put a legendary 20/20 black Avatar creature token with flying and indestructible named Marit Lage onto the battlefield.",CSP
Frost Marsh,,Jim Pavelec,146,Snow Land,Frost Marsh enters the battlefield tapped.\n{T}: Add {U} or {B} to your mana pool.,CSP
Highland Weald,,John Avon,147,Snow Land,Highland Weald enters the battlefield tapped.\n{T}: Add {R} or {G} to your mana pool.,CSP
Mouth of Ronom,,Daren Bader,148,Snow Land,"{T}: Add {1} to your mana pool.\n{4}{S}, {T}, Sacrifice Mouth of Ronom: Mouth of Ronom deals 4 damage to target creature. ({S} can be paid with one mana from a snow permanent.)",CSP
Scrying Sheets,,Thomas M. Baxa,149,Snow Land,"{T}: Add {1} to your mana pool.\n{1}{S}, {T}: Look at the top card of your library. If that card is snow, you may reveal it and put it into your hand. ({S} can be paid with one mana from a snow permanent.)",CSP
Tresserhorn Sinks,,Darrell Riche,150,Snow Land,Tresserhorn Sinks enters the battlefield tapped.\n{T}: Add {B} or {R} to your mana pool.,CSP
Snow-Covered Plains,,Mark Romanoski,151,Basic Snow Land — Plains,,"ICE,CSP,ME2"
Snow-Covered Island,,Franz Vohwinkel,152,Basic Snow Land — Island,,"ICE,CSP,ME2"
Snow-Covered Swamp,,Rob Alexander,153,Basic Snow Land — Swamp,,"ICE,CSP,ME2"
Snow-Covered Mountain,,John Zeleznik,154,Basic Snow Land — Mountain,,"ICE,CSP,ME2"
Snow-Covered Forest,,Jim Nelson,155,Basic Snow Land — Forest,,"ICE,CSP,ME2"
