name,manaCost,cmc,colorIdentity,artist,number,type,text,printings,flavor,layout,multiverseid,power,toughness,rarity,subtypes,types
"Venser, the Sojourner",{3}{W}{U},5,"W,U",Eric Deschamps,1,Planeswalker — Venser,"+2: Exile target permanent you own. Return it to the battlefield under your control at the beginning of the next end step.\n−1: Creatures can't be blocked this turn.\n−8: You get an emblem with ""Whenever you cast a spell, exile target permanent.""","SOM,DDI",,normal,266078,,,Mythic Rare,Venser,Planeswalker
Whitemane Lion,{1}{W},2,W,Zoltan Boros & Gabor Szikszai,2,Creature — Cat,"Flash (You may cast this spell any time you could cast an instant.)\nWhen Whitemane Lion enters the battlefield, return a creature you control to its owner's hand.","PLC,DDI,C14,EMA","Saltfield nomads call a sudden storm a ""whitemane.""",normal,270859,2,2,Common,Cat,Creature
Augury Owl,{1}{U},2,U,Jim Nelson,3,Creature — Bird,"Flying\nWhen Augury Owl enters the battlefield, scry 3. (Look at the top three cards of your library, then put any number of them on the bottom of your library and the rest on top in any order.)","M11,DDI,PC2",,normal,270841,1,1,Common,Bird,Creature
Coral Fighters,{1}{U},2,U,Steve Luke,4,Creature — Merfolk Soldier,"Whenever Coral Fighters attacks and isn't blocked, look at the top card of defending player's library. You may put that card on the bottom of that player's library.","MIR,DDI",,normal,282600,1,1,Uncommon,"Merfolk,Soldier",Creature
Minamo Sightbender,{1}{U},2,U,Luca Zontini,5,Creature — Human Wizard,"{X}, {T}: Target creature with power X or less can't be blocked this turn.","BOK,DDI","Woven from threads of the spirit world, the mistcloak rendered its wearer invisible, but quickly fell to tatters.",normal,282602,1,2,Uncommon,"Human,Wizard",Creature
Mistmeadow Witch,{1}{W/U},2,"W,U",Greg Staples,6,Creature — Kithkin Wizard,{2}{W}{U}: Exile target creature. Return that card to the battlefield under its owner's control at the beginning of the next end step.,"SHM,DDI,C13","Olka collected the evening mist for years, studying its secrets. Once she learned its essence, she could vanish with a thought.",normal,282603,1,1,Uncommon,"Kithkin,Wizard",Creature
Scroll Thief,{2}{U},3,U,Alex Horley-Orlandelli,7,Creature — Merfolk Rogue,"Whenever Scroll Thief deals combat damage to a player, draw a card.","M11,DDI,M13,M14","I've learned how to disable wards, pick locks, and decode the Agaran language—all before even reading the scroll!",normal,270845,1,3,Common,"Merfolk,Rogue",Creature
Neurok Invisimancer,{1}{U}{U},3,U,Izzy,8,Creature — Human Wizard,"Neurok Invisimancer can't be blocked.\nWhen Neurok Invisimancer enters the battlefield, target creature can't be blocked this turn.","SOM,DDI","""They won't see your shadow or hear your breath, but they will feel your blade.""",normal,270868,2,1,Common,"Human,Wizard",Creature
Slith Strider,{1}{U}{U},3,U,Justin Sweet,9,Creature — Slith,"Whenever Slith Strider becomes blocked, draw a card.\nWhenever Slith Strider deals combat damage to a player, put a +1/+1 counter on it.","MRD,DDI",A slith's form and function are determined by the color of the sun under which it's born.,normal,270851,1,1,Uncommon,Slith,Creature
Sky Spirit,{1}{W}{U},3,"W,U",Rebecca Guay,10,Creature — Spirit,"Flying, first strike","TMP,DDI,CNS","""Like a strain of music: easy to remember but impossible to catch.""\n—Mirri of the Weatherlight",normal,284485,2,2,Uncommon,Spirit,Creature
Wall of Denial,{1}{W}{U},3,"W,U",Howard Lyon,11,Creature — Wall,"Defender, flying\nShroud (This creature can't be the target of spells or abilities.)","ARB,CMD,DDI",It provides what every discerning mage requires—time to think.,normal,270829,0,8,Uncommon,Wall,Creature
Galepowder Mage,{3}{W},4,W,Jeremy Jarvis,12,Creature — Kithkin Wizard,"Flying\nWhenever Galepowder Mage attacks, exile another target creature. Return that card to the battlefield under its owner's control at the beginning of the next end step.","LRW,DDI",,normal,270839,3,3,Rare,"Kithkin,Wizard",Creature
Kor Cartographer,{3}{W},4,W,Ryan Pancoast,13,Creature — Kor Scout,"When Kor Cartographer enters the battlefield, you may search your library for a Plains card, put it onto the battlefield tapped, then shuffle your library.","ZEN,DDI",Kor have no concept of exploration. They return to homelands forgotten.,normal,270875,2,2,Common,"Kor,Scout",Creature
Clone,{3}{U},4,U,Kev Walker,14,Creature — Shapeshifter,You may have Clone enter the battlefield as a copy of any creature on the battlefield.,"LEA,LEB,2ED,CED,CEI,3ED,ONS,9ED,10E,M10,M11,DDI,M13,M14",The shapeshifter mimics with a twin's esteem and a mirror's cruelty.,normal,270842,0,0,Rare,Shapeshifter,Creature
Cryptic Annelid,{3}{U},4,U,Anthony S. Waters,15,Creature — Worm Beast,"When Cryptic Annelid enters the battlefield, scry 1, then scry 2, then scry 3. (To scry X, look at the top X cards of your library, then put any number of them on the bottom of your library and the rest on top in any order.)","FUT,DDI",,normal,270836,1,4,Uncommon,"Worm,Beast",Creature
Primal Plasma,{3}{U},4,U,Luca Zontini,16,Creature — Elemental Shapeshifter,"As Primal Plasma enters the battlefield, it becomes your choice of a 3/3 creature, a 2/2 creature with flying, or a 1/6 creature with defender.","PLC,DDI,PC2","Tocasia brushed the gears and cogs from the table. There, before two wide-eyed brothers, she began a lesson on raw elemental magic.",normal,270857,*,*,Common,"Elemental,Shapeshifter",Creature
Sawtooth Loon,{2}{W}{U},4,"W,U",Heather Hudson,17,Creature — Bird,"Flying\nWhen Sawtooth Loon enters the battlefield, return a white or blue creature you control to its owner's hand.\nWhen Sawtooth Loon enters the battlefield, draw two cards, then put two cards from your hand on the bottom of your library.","PLS,DDI",,normal,270861,2,2,Uncommon,Bird,Creature
Cache Raiders,{3}{U}{U},5,U,Pete Venters,18,Creature — Merfolk Rogue,"At the beginning of your upkeep, return a permanent you control to its owner's hand.","EVE,DDI","What the current doesn't take, they do.",normal,282599,4,4,Uncommon,"Merfolk,Rogue",Creature
Windreaver,{3}{W}{U},5,"W,U",Aleksi Briclot,19,Creature — Elemental,Flying\n{W}: Windreaver gains vigilance until end of turn.\n{W}: Windreaver gets +0/+1 until end of turn.\n{U}: Switch Windreaver's power and toughness until end of turn.\n{U}: Return Windreaver to its owner's hand.,"DIS,DDI",,normal,270835,1,3,Rare,Elemental,Creature
Jedit's Dragoons,{5}{W},6,W,John Matson,20,Creature — Cat Soldier,"Vigilance\nWhen Jedit's Dragoons enters the battlefield, you gain 4 life.","TSP,DDI","After Efrava was destroyed, the cat warriors scattered across Dominaria. Those who followed Jedit's example were strong enough to survive the ravages of apocalypse.",normal,282601,2,5,Common,"Cat,Soldier",Creature
Sunblast Angel,{4}{W}{W},6,W,Jason Chan,21,Creature — Angel,"Flying\nWhen Sunblast Angel enters the battlefield, destroy all tapped creatures.","pMEI,SOM,DDI,C14",There may exist powers even greater than Phyrexia.,normal,284489,4,5,Rare,Angel,Creature
Sphinx of Uthuun,{5}{U}{U},7,U,Kekai Kotaki,22,Creature — Sphinx,"Flying\nWhen Sphinx of Uthuun enters the battlefield, reveal the top five cards of your library. An opponent separates those cards into two piles. Put one pile into your hand and the other into your graveyard.","M12,DDI,M13,DDN,C14",,normal,284486,5,6,Rare,Sphinx,Creature
Path to Exile,{W},1,W,Erica Yang,23,Instant,"Exile target creature. Its controller may search his or her library for a basic land card, put that card onto the battlefield tapped, then shuffle his or her library.","pWPN,CON,ARC,CMD,DDI,MMA,MD1",,normal,266017,,,Uncommon,,Instant
Preordain,{U},1,U,Scott Chou,24,Sorcery,"Scry 2, then draw a card. (To scry 2, look at the top two cards of your library, then put any number of them on the bottom of your library and the rest on top in any order.)","M11,DDI,C15",,normal,265979,,,Common,,Sorcery
Sigil of Sleep,{U},1,U,Greg & Tim Hildebrandt,25,Enchantment — Aura,"Enchant creature\nWhenever enchanted creature deals damage to a player, return target creature that player controls to its owner's hand.","UDS,DDI",Arrows are only one way to remove an enemy.,normal,270813,,,Common,Aura,Enchantment
Revoke Existence,{1}{W},2,W,Allen Williams,26,Sorcery,Exile target artifact or enchantment.,"SOM,DDI,BNG","""No half measures, no regrets. We'll tell no stories of this day. It will be as if it never existed at all.""\n—Ganedor, loxodon mystic",normal,284488,,,Common,,Sorcery
Angelic Shield,{W}{U},2,"W,U",Adam Rex,27,Enchantment,Creatures you control get +0/+1.\nSacrifice Angelic Shield: Return target creature to its owner's hand.,"INV,DDI","""If only an angel's wings could shelter us all.""\n—Barrin, master wizard",normal,284487,,,Uncommon,,Enchantment
Oblivion Ring,{2}{W},3,W,Franz Vohwinkel,28,Enchantment,"When Oblivion Ring enters the battlefield, exile another target nonland permanent.\nWhen Oblivion Ring leaves the battlefield, return the exiled card to the battlefield under its owner's control.","pFNM,LRW,ALA,HOP,ARC,DDG,CMD,M12,DDI,M13,MM2",,normal,270848,,,Uncommon,,Enchantment
Safe Passage,{2}{W},3,W,Christopher Moeller,29,Instant,Prevent all damage that would be dealt to you and creatures you control this turn.,"M10,M11,DDI,M13","With one flap of her wings, the angel beat back the fires of war.",normal,270844,,,Common,,Instant
Steel of the Godhead,{2}{W/U},3,"W,U",Jason Chan,30,Enchantment — Aura,"Enchant creature\nAs long as enchanted creature is white, it gets +1/+1 and has lifelink. (Damage dealt by the creature also causes its controller to gain that much life.)\nAs long as enchanted creature is blue, it gets +1/+1 and can't be blocked.","SHM,DDI",,normal,270866,,,Common,Aura,Enchantment
Vanish into Memory,{2}{W}{U},4,"W,U",Rebekah Lynn,31,Instant,"Exile target creature. You draw cards equal to that creature's power. At the beginning of your next upkeep, return that card to the battlefield under its owner's control. If you do, discard cards equal to that creature's toughness.","CSP,DDI","Out of sight, into mind.",normal,270831,,,Uncommon,,Instant
Overrule,{X}{W}{U},2,"W,U",Alan Pollack,32,Instant,Counter target spell unless its controller pays {X}. You gain X life.,"DIS,DDI","With one commanding word, the spell was put down and a fine collected for its casting.",normal,270834,,,Common,,Instant
Azorius Chancery,,,"W,U",John Avon,33,Land,"Azorius Chancery enters the battlefield tapped.\nWhen Azorius Chancery enters the battlefield, return a land you control to its owner's hand.\n{T}: Add {W}{U} to your mana pool.","DIS,CMD,DDI,C13,MM2",,normal,270826,,,Common,,Land
Flood Plain,,,,Pat Morrissey,34,Land,"Flood Plain enters the battlefield tapped.\n{T}, Sacrifice Flood Plain: Search your library for a Plains or Island card and put it onto the battlefield. Then shuffle your library.","MIR,DDI,VMA",,normal,270849,,,Uncommon,,Land
New Benalia,,,W,Richard Wright,35,Land,"New Benalia enters the battlefield tapped.\nWhen New Benalia enters the battlefield, scry 1. (Look at the top card of your library. You may put that card on the bottom of your library.)\n{T}: Add {W} to your mana pool.","FUT,DDI,DDL,C13,C15",,normal,270837,,,Uncommon,,Land
Sejiri Refuge,,,"W,U",Ryan Pancoast,36,Land,"Sejiri Refuge enters the battlefield tapped.\nWhen Sejiri Refuge enters the battlefield, you gain 1 life.\n{T}: Add {W} or {U} to your mana pool.","ZEN,DDI,C13",,normal,270876,,,Uncommon,,Land
Soaring Seacliff,,,U,Izzy,37,Land,"Soaring Seacliff enters the battlefield tapped.\nWhen Soaring Seacliff enters the battlefield, target creature gains flying until end of turn.\n{T}: Add {U} to your mana pool.","ZEN,DDI",,normal,270877,,,Common,,Land
Plains,,,W,John Avon,38,Basic Land — Plains,,"LEA,LEB,2ED,CED,CEI,3ED,4ED,ICE,RQS,pARL,MIR,ITP,5ED,POR,pPRE,TMP,pJGP,PO2,UGL,pALP,USG,ATH,6ED,PTK,S99,pGRU,MMQ,BRB,pELP,S00,INV,7ED,ODY,ONS,8ED,MRD,CHK,UNH,9ED,RAV,CST,TSP,10E,MED,LRW,SHM,ALA,DDC,M10,HOP,ME3,ZEN,H09,DDE,ROE,ARC,M11,DDF,SOM,MBS,DDG,NPH,CMD,M12,DDH,ISD,DDI,AVR,PC2,M13,RTR,DDK,M14,DDL,THS,C13,MD1,M15,DDN,KTK,C14,DD3_DVD,FRF,DDO,DTK,TPR,ORI,DDP,BFZ,C15,DDQ,SOI",,normal,284497,,,Basic Land,Plains,Land
Plains,,,W,James Paick,39,Basic Land — Plains,,"LEA,LEB,2ED,CED,CEI,3ED,4ED,ICE,RQS,pARL,MIR,ITP,5ED,POR,pPRE,TMP,pJGP,PO2,UGL,pALP,USG,ATH,6ED,PTK,S99,pGRU,MMQ,BRB,pELP,S00,INV,7ED,ODY,ONS,8ED,MRD,CHK,UNH,9ED,RAV,CST,TSP,10E,MED,LRW,SHM,ALA,DDC,M10,HOP,ME3,ZEN,H09,DDE,ROE,ARC,M11,DDF,SOM,MBS,DDG,NPH,CMD,M12,DDH,ISD,DDI,AVR,PC2,M13,RTR,DDK,M14,DDL,THS,C13,MD1,M15,DDN,KTK,C14,DD3_DVD,FRF,DDO,DTK,TPR,ORI,DDP,BFZ,C15,DDQ,SOI",,normal,284499,,,Basic Land,Plains,Land
Plains,,,W,Martina Pilcerova,40,Basic Land — Plains,,"LEA,LEB,2ED,CED,CEI,3ED,4ED,ICE,RQS,pARL,MIR,ITP,5ED,POR,pPRE,TMP,pJGP,PO2,UGL,pALP,USG,ATH,6ED,PTK,S99,pGRU,MMQ,BRB,pELP,S00,INV,7ED,ODY,ONS,8ED,MRD,CHK,UNH,9ED,RAV,CST,TSP,10E,MED,LRW,SHM,ALA,DDC,M10,HOP,ME3,ZEN,H09,DDE,ROE,ARC,M11,DDF,SOM,MBS,DDG,NPH,CMD,M12,DDH,ISD,DDI,AVR,PC2,M13,RTR,DDK,M14,DDL,THS,C13,MD1,M15,DDN,KTK,C14,DD3_DVD,FRF,DDO,DTK,TPR,ORI,DDP,BFZ,C15,DDQ,SOI",,normal,284498,,,Basic Land,Plains,Land
Island,,,U,Rob Alexander,41,Basic Land — Island,,"LEA,LEB,2ED,CED,CEI,3ED,4ED,ICE,RQS,pARL,MIR,ITP,5ED,POR,TMP,pJGP,PO2,UGL,pALP,USG,6ED,PTK,S99,pGRU,MMQ,BRB,pELP,S00,BTD,INV,7ED,ODY,ONS,8ED,MRD,CHK,UNH,9ED,RAV,CST,TSP,10E,MED,LRW,SHM,ALA,DD2,M10,HOP,ME3,ZEN,H09,DDE,ROE,DPA,ARC,M11,DDF,SOM,MBS,NPH,CMD,M12,DDH,ISD,DDI,AVR,PC2,M13,DDJ,RTR,M14,THS,C13,DDM,M15,DDN,KTK,C14,DD3_JVC,FRF,DDO,DTK,TPR,ORI,BFZ,C15,DDQ,SOI",,normal,284491,,,Basic Land,Island,Land
Island,,,U,Jung Park,42,Basic Land — Island,,"LEA,LEB,2ED,CED,CEI,3ED,4ED,ICE,RQS,pARL,MIR,ITP,5ED,POR,TMP,pJGP,PO2,UGL,pALP,USG,6ED,PTK,S99,pGRU,MMQ,BRB,pELP,S00,BTD,INV,7ED,ODY,ONS,8ED,MRD,CHK,UNH,9ED,RAV,CST,TSP,10E,MED,LRW,SHM,ALA,DD2,M10,HOP,ME3,ZEN,H09,DDE,ROE,DPA,ARC,M11,DDF,SOM,MBS,NPH,CMD,M12,DDH,ISD,DDI,AVR,PC2,M13,DDJ,RTR,M14,THS,C13,DDM,M15,DDN,KTK,C14,DD3_JVC,FRF,DDO,DTK,TPR,ORI,BFZ,C15,DDQ,SOI",,normal,284490,,,Basic Land,Island,Land
Island,,,U,Martina Pilcerova,43,Basic Land — Island,,"LEA,LEB,2ED,CED,CEI,3ED,4ED,ICE,RQS,pARL,MIR,ITP,5ED,POR,TMP,pJGP,PO2,UGL,pALP,USG,6ED,PTK,S99,pGRU,MMQ,BRB,pELP,S00,BTD,INV,7ED,ODY,ONS,8ED,MRD,CHK,UNH,9ED,RAV,CST,TSP,10E,MED,LRW,SHM,ALA,DD2,M10,HOP,ME3,ZEN,H09,DDE,ROE,DPA,ARC,M11,DDF,SOM,MBS,NPH,CMD,M12,DDH,ISD,DDI,AVR,PC2,M13,DDJ,RTR,M14,THS,C13,DDM,M15,DDN,KTK,C14,DD3_JVC,FRF,DDO,DTK,TPR,ORI,BFZ,C15,DDQ,SOI",,normal,284492,,,Basic Land,Island,Land
Koth of the Hammer,{2}{R}{R},4,R,Eric Deschamps,44,Planeswalker — Koth,"+1: Untap target Mountain. It becomes a 4/4 red Elemental creature until end of turn. It's still a land.\n−2: Add {R} to your mana pool for each Mountain you control.\n−5: You get an emblem with ""Mountains you control have ‘{T}: This land deals 1 damage to target creature or player.'""","SOM,DDI",,normal,266362,,,Mythic Rare,Koth,Planeswalker
Plated Geopede,{1}{R},2,R,Johann Bodin,45,Creature — Insect,"First strike\nLandfall — Whenever a land enters the battlefield under your control, Plated Geopede gets +2/+2 until end of turn.","ZEN,DDI","It prefers a cooked meal, so it will eat you now and lava-bask later.",normal,266210,1,1,Common,Insect,Creature
Pygmy Pyrosaur,{1}{R},2,R,Dan Frazier,46,Creature — Lizard,Pygmy Pyrosaur can't block.\n{R}: Pygmy Pyrosaur gets +1/+0 until end of turn.,"ULG,7ED,DDI",Do not judge a lizard by its size.\n—Ghitu proverb,normal,279859,1,1,Common,Lizard,Creature
Pilgrim's Eye,{3},3,,Dan Scott,47,Artifact Creature — Thopter,"Flying\nWhen Pilgrim's Eye enters the battlefield, you may search your library for a basic land card, reveal it, put it into your hand, then shuffle your library.","WWK,DDI,C13,C14,BFZ,EMA",The kor send their thopter kites to see if the land is in a welcoming mood.,normal,270872,1,1,Common,Thopter,"Artifact,Creature"
Æther Membrane,{1}{R}{R},3,R,Zoltan Boros & Gabor Szikszai,48,Creature — Wall,"Defender; reach (This creature can block creatures with flying.)\nWhenever Æther Membrane blocks a creature, return that creature to its owner's hand at end of combat.","PLC,DDI",,normal,270856,0,5,Uncommon,Wall,Creature
Fiery Hellhound,{1}{R}{R},3,R,Ted Galaday,49,Creature — Elemental Hound,{R}: Fiery Hellhound gets +1/+0 until end of turn.,"M10,M11,M12,DDI,ORI","""I had hoped to instill in it the loyalty of a guard dog, but with fire's power comes its unpredictability.""\n—Maggath, Sardian elementalist",normal,279855,2,2,Common,"Elemental,Hound",Creature
Vulshok Sorcerer,{1}{R}{R},3,R,rk post,50,Creature — Human Shaman,Haste\n{T}: Vulshok Sorcerer deals 1 damage to target creature or player.,"5DN,PD2,DDI","Vulshok sorcerers train by leaping into electrified storm clouds. Dead or alive, they come back down with smiles on their faces.",normal,270806,1,1,Common,"Human,Shaman",Creature
Anger,{3}{R},4,R,Svetlin Velinov,51,Creature — Incarnation,"Haste\nAs long as Anger is in your graveyard and you control a Mountain, creatures you control have haste.","JUD,CMD,DDI","""Molten earth has no anger of its own. Only by infusing it with your own rage can the magma seethe and take shape.""\n—Koth of the Hammer",normal,266061,2,2,Uncommon,Incarnation,Creature
Cosi's Ravager,{3}{R},4,R,Zoltan Boros & Gabor Szikszai,52,Creature — Elemental,"Landfall — Whenever a land enters the battlefield under your control, you may have Cosi's Ravager deal 1 damage to target player.","WWK,DDI","""Cosi has many followers. Even the volcano finds a way to do his bidding.""\n—Zakken, Enclave cleric",normal,270871,2,2,Common,Elemental,Creature
Vulshok Berserker,{3}{R},4,R,Pete Venters,53,Creature — Human Berserker,Haste (This creature can attack and {T} as soon as it comes under your control.),"MRD,M11,DDI",He experiences every emotion with passion and repays every slight with vengeance.,normal,270846,3,2,Common,"Human,Berserker",Creature
Bloodfire Kavu,{2}{R}{R},4,R,Greg Staples,54,Creature — Kavu,"{R}, Sacrifice Bloodfire Kavu: Bloodfire Kavu deals 2 damage to each creature.","APC,DDI","Heart of fire, blood of lava, teeth of stone.",normal,270812,2,2,Uncommon,Kavu,Creature
Stone Giant,{2}{R}{R},4,R,Warren Mahy,55,Creature — Giant,{T}: Target creature you control with toughness less than Stone Giant's power gains flying until end of turn. Destroy that creature at the beginning of the next end step.,"LEA,LEB,2ED,CED,CEI,3ED,4ED,5ED,MED,M10,DDI",A typical day for a giant. A momentous event for a goat.,normal,279856,3,4,Uncommon,Giant,Creature
Geyser Glider,{3}{R}{R},5,R,Warren Mahy,56,Creature — Elemental Beast,"Landfall — Whenever a land enters the battlefield under your control, Geyser Glider gains flying until end of turn.","ZEN,DDI","""Quit pontificating, mage. The last thing we want to do is give it more hot air.""\n—Tala Vertan, Makindi shieldmate",normal,270874,4,4,Uncommon,"Elemental,Beast",Creature
Lithophage,{3}{R}{R},5,R,Mike Ploog,57,Creature — Insect,"At the beginning of your upkeep, sacrifice Lithophage unless you sacrifice a Mountain.","MMQ,DDI","It's viciously territorial, destroying every creature on the mountain it has chosen to consume.",normal,270850,7,7,Rare,Insect,Creature
Torchling,{3}{R}{R},5,R,rk post,58,Creature — Shapeshifter,{R}: Untap Torchling.\n{R}: Target creature blocks Torchling this turn if able.\n{R}: Change the target of target spell that targets only Torchling.\n{1}: Torchling gets +1/-1 until end of turn.\n{1}: Torchling gets -1/+1 until end of turn.,"PLC,DDI",,normal,270858,3,3,Rare,Shapeshifter,Creature
Chartooth Cougar,{5}{R},6,R,Chase Stone,59,Creature — Cat Beast,"{R}: Chartooth Cougar gets +1/+0 until end of turn.\nMountaincycling {2} ({2}, Discard this card: Search your library for a Mountain card, reveal it, and put it into your hand. Then shuffle your library.)","SCG,DD2,CMD,DDI,CNS,VMA,DD3_JVC",,normal,270828,4,4,Common,"Cat,Beast",Creature
Earth Servant,{5}{R},6,R,Lucas Graciano,60,Creature — Elemental,Earth Servant gets +0/+1 for each Mountain you control.,"M11,DDI","""Fire. Air. Water. These elements spread, filling in the spaces they are not. But earth is implacable like a sullen child.""\n—Jestus Dreya, Of Elements and Eternity",normal,270843,4,4,Uncommon,Elemental,Creature
Greater Stone Spirit,{4}{R}{R},6,R,Yokota Katsumi,61,Creature — Elemental Spirit,"Greater Stone Spirit can't be blocked by creatures with flying.\n{2}{R}: Until end of turn, target creature gets +0/+2 and gains ""{R}: This creature gets +1/+0 until end of turn.""","CSP,DDI","Having charted their way up the difficult face, the two mountaineers had to contend with the mountain's decision to stand up.",normal,279857,4,4,Uncommon,"Elemental,Spirit",Creature
Bloodfire Colossus,{6}{R}{R},8,R,Greg Staples,62,Creature — Giant,"{R}, Sacrifice Bloodfire Colossus: Bloodfire Colossus deals 6 damage to each creature and each player.","APC,9ED,10E,DDI",It took all its strength to contain the fire within.,normal,270805,6,6,Rare,Giant,Creature
Wayfarer's Bauble,{1},1,,Darrell Riche,63,Artifact,"{2}, {T}, Sacrifice Wayfarer's Bauble: Search your library for a basic land card and put that card onto the battlefield tapped. Then shuffle your library.","5DN,DDI,C13,C14,MM2,C15","It is the forest beyond the horizon, the mountain waiting to be climbed, the new land across the endless sea.",normal,270807,,,Common,,Artifact
Armillary Sphere,{2},2,,Franz Vohwinkel,64,Artifact,"{2}, {T}, Sacrifice Armillary Sphere: Search your library for up to two basic land cards, reveal them, and put them into your hand. Then shuffle your library.","CON,DDG,CMD,DDI,PC2,C13",The mysterious purpose of two of the rings had eluded Esper mages—until now.,normal,270825,,,Common,,Artifact
Journeyer's Kite,{2},2,,Hiro Izawa,65,Artifact,"{3}, {T}: Search your library for a basic land card, reveal it, and put it into your hand. Then shuffle your library.","CHK,DDI","""From the clouds, you can see as far as the distant horizon. It's a reminder of the infinite possibilities of everyday life.""\n—Noboru, master kitemaker",normal,282591,,,Rare,,Artifact
Vulshok Morningstar,{2},2,,David Martin,66,Artifact — Equipment,Equipped creature gets +2/+2.\nEquip {2} ({2}: Attach to target creature you control. Equip only as a sorcery.),"DST,9ED,DDI",,normal,270810,,,Uncommon,Equipment,Artifact
Searing Blaze,{R}{R},2,R,James Paick,67,Instant,"Searing Blaze deals 1 damage to target player and 1 damage to target creature that player controls.\nLandfall — If you had a land enter the battlefield under your control this turn, Searing Blaze deals 3 damage to that player and 3 damage to that creature instead.","pMPR,WWK,DDI",,normal,270873,,,Common,,Instant
Vulshok Battlegear,{3},3,,Kevin Dobler,68,Artifact — Equipment,Equipped creature gets +3/+3.\nEquip {3} ({3}: Attach to target creature you control. Equip only as a sorcery. This card enters the battlefield unattached and stays on the battlefield if the creature leaves.),"MRD,DDI",,normal,270852,,,Uncommon,Equipment,Artifact
Downhill Charge,{2}{R},3,R,Greg & Tim Hildebrandt,69,Instant,"You may sacrifice a Mountain rather than pay Downhill Charge's mana cost.\nTarget creature gets +X/+0 until end of turn, where X is the number of Mountains you control.","NMS,DDI",,normal,270854,,,Common,,Instant
Seismic Strike,{2}{R},3,R,Christopher Moeller,70,Instant,Seismic Strike deals damage to target creature equal to the number of Mountains you control.,"M10,DDG,DDI,M15","""Life up here is simple. Adapt to the ways of the mountains and they will reward you. Fight them and they will end you.""\n—Kezim, prodigal pyromancer",normal,270840,,,Common,,Instant
Spire Barrage,{4}{R},5,R,Ryan Pancoast,71,Sorcery,Spire Barrage deals damage to target creature or player equal to the number of Mountains you control.,"ZEN,DDI","Goblin lessons include the 2,071 tips for survival. Frek only remembered 2,070.",normal,270878,,,Common,,Sorcery
Jaws of Stone,{5}{R},6,R,Zoltan Boros & Gabor Szikszai,72,Sorcery,"Jaws of Stone deals X damage divided as you choose among any number of target creatures and/or players, where X is the number of Mountains you control as you cast Jaws of Stone.","SHM,DDG,DDI","When giants find their mountain homes infested, they have a whole range of solutions.",normal,270833,,,Uncommon,,Sorcery
Volley of Boulders,{8}{R},9,R,Tony Szczudlo,73,Sorcery,Volley of Boulders deals 6 damage divided as you choose among any number of target creatures and/or players.\nFlashback {R}{R}{R}{R}{R}{R} (You may cast this card from your graveyard for its flashback cost. Then exile it.),"ODY,DDI",,normal,270855,,,Rare,,Sorcery
Mountain,,,R,Tomasz Jedruszek,74,Basic Land — Mountain,,"LEA,LEB,2ED,ARN,CED,CEI,3ED,4ED,ICE,RQS,pARL,MIR,ITP,5ED,POR,TMP,pJGP,PO2,UGL,pALP,USG,ATH,6ED,PTK,S99,pGRU,MMQ,BRB,pELP,S00,BTD,INV,7ED,ODY,DKM,ONS,8ED,MRD,CHK,UNH,9ED,RAV,CST,TSP,10E,MED,LRW,EVG,SHM,ALA,DD2,M10,HOP,ME3,ZEN,H09,DDE,ROE,DPA,ARC,M11,SOM,PD2,MBS,DDG,NPH,CMD,M12,DDH,ISD,DDI,AVR,PC2,M13,DDJ,RTR,DDK,M14,DDL,THS,C13,M15,DDN,KTK,C14,DD3_EVG,DD3_JVC,FRF,DTK,TPR,ORI,DDP,BFZ,C15,SOI",,normal,284494,,,Basic Land,Mountain,Land
Mountain,,,R,Tomasz Jedruszek,75,Basic Land — Mountain,,"LEA,LEB,2ED,ARN,CED,CEI,3ED,4ED,ICE,RQS,pARL,MIR,ITP,5ED,POR,TMP,pJGP,PO2,UGL,pALP,USG,ATH,6ED,PTK,S99,pGRU,MMQ,BRB,pELP,S00,BTD,INV,7ED,ODY,DKM,ONS,8ED,MRD,CHK,UNH,9ED,RAV,CST,TSP,10E,MED,LRW,EVG,SHM,ALA,DD2,M10,HOP,ME3,ZEN,H09,DDE,ROE,DPA,ARC,M11,SOM,PD2,MBS,DDG,NPH,CMD,M12,DDH,ISD,DDI,AVR,PC2,M13,DDJ,RTR,DDK,M14,DDL,THS,C13,M15,DDN,KTK,C14,DD3_EVG,DD3_JVC,FRF,DTK,TPR,ORI,DDP,BFZ,C15,SOI",,normal,284496,,,Basic Land,Mountain,Land
