name,cost,artist,number,type,text,printings
Predator Ooze,,Ryan Yee,124,Creature — Ooze,"Indestructible\nWhenever Predator Ooze attacks, put a +1/+1 counter on it.
Whenever a creature dealt damage by Predator Ooze this turn dies, put a +1/+1 counter on Predator Ooze.",DKA
Scorned Villager,,Cynthia Sheppard,125a,Creature — Human Werewolf,"{T}: Add {G} to your mana pool.\nAt the beginning of each upkeep, if no spells were cast last turn, transform Scorned Villager.",DKA
Moonscarred Werewolf,,Cynthia Sheppard,125b,Creature — Werewolf,"Vigilance\n{T}: Add {G}{G} to your mana pool.
At the beginning of each upkeep, if a player cast two or more spells last turn, transform Moonscarred Werewolf.",DKA
Somberwald Dryad,,Jaime Jones,126,Creature — Dryad,Forestwalk (This creature can't be blocked as long as defending player controls a Forest.),DKA
Strangleroot Geist,,Jason Chan,127,Creature — Spirit,"Haste\nUndying (When this creature dies, if it had no +1/+1 counters on it, return it to the battlefield under its owner's control with a +1/+1 counter on it.)","pMGD,DKA"
Tracker's Instincts,,Jung Park,128,Sorcery,Reveal the top four cards of your library. Put a creature card from among them into your hand and the rest into your graveyard.\nFlashback {2}{U} (You may cast this card from your graveyard for its flashback cost. Then exile it.),DKA
Ulvenwald Bear,,Jason A. Engle,129,Creature — Bear,"Morbid — When Ulvenwald Bear enters the battlefield, if a creature died this turn, put two +1/+1 counters on target creature.",DKA
Village Survivors,,David Rapoza,130,Creature — Human,"Vigilance\nFateful hour — As long as you have 5 or less life, other creatures you control have vigilance.",DKA
Vorapede,,Slawomir Maniak,131,Creature — Insect,"Vigilance, trample\nUndying (When this creature dies, if it had no +1/+1 counters on it, return it to the battlefield under its owner's control with a +1/+1 counter on it.)",DKA
Wild Hunger,,Karl Kopinski,132,Instant,Target creature gets +3/+1 and gains trample until end of turn.\nFlashback {3}{R} (You may cast this card from your graveyard for its flashback cost. Then exile it.),DKA
Wolfbitten Captive,,Zoltan Boros,133a,Creature — Human Werewolf,"{1}{G}: Wolfbitten Captive gets +2/+2 until end of turn. Activate this ability only once each turn.\nAt the beginning of each upkeep, if no spells were cast last turn, transform Wolfbitten Captive.",DKA
Krallenhorde Killer,,Zoltan Boros,133b,Creature — Werewolf,"{3}{G}: Krallenhorde Killer gets +4/+4 until end of turn. Activate this ability only once each turn.\nAt the beginning of each upkeep, if a player cast two or more spells last turn, transform Krallenhorde Killer.",DKA
Young Wolf,,Ryan Pancoast,134,Creature — Wolf,"Undying (When this creature dies, if it had no +1/+1 counters on it, return it to the battlefield under its owner's control with a +1/+1 counter on it.)",DKA
Diregraf Captain,,Slawomir Maniak,135,Creature — Zombie Soldier,"Deathtouch\nOther Zombie creatures you control get +1/+1.
Whenever another Zombie you control dies, target opponent loses 1 life.",DKA
Drogskol Captain,,Peter Mohrbacher,136,Creature — Spirit Soldier,Flying\nOther Spirit creatures you control get +1/+1 and have hexproof. (They can't be the targets of spells or abilities your opponents control.),DKA
Drogskol Reaver,,Vincent Proce,137,Creature — Spirit,"Flying, double strike, lifelink\nWhenever you gain life, draw a card.",DKA
Falkenrath Aristocrat,,Igor Kieryluk,138,Creature — Vampire,"Flying, haste\nSacrifice a creature: Falkenrath Aristocrat gains indestructible until end of turn. If the sacrificed creature was a Human, put a +1/+1 counter on Falkenrath Aristocrat.",DKA
Havengul Lich,,James Ryman,139,Creature — Zombie Wizard,"{1}: You may cast target creature card in a graveyard this turn. When you cast that card this turn, Havengul Lich gains all activated abilities of that card until end of turn.",DKA
Huntmaster of the Fells,,Chris Rahn,140a,Creature — Human Werewolf,"Whenever this creature enters the battlefield or transforms into Huntmaster of the Fells, put a 2/2 green Wolf creature token onto the battlefield and you gain 2 life.\nAt the beginning of each upkeep, if no spells were cast last turn, transform Huntmaster of the Fells.",DKA
Ravager of the Fells,,Chris Rahn,140b,Creature — Werewolf,"Trample\nWhenever this creature transforms into Ravager of the Fells, it deals 2 damage to target opponent and 2 damage to up to one target creature that player controls.
At the beginning of each upkeep, if a player cast two or more spells last turn, transform Ravager of the Fells.",DKA
Immerwolf,,Terese Nielsen,141,Creature — Wolf,Intimidate (This creature can't be blocked except by artifact creatures and/or creatures that share a color with it.)\nEach other creature you control that's a Wolf or a Werewolf gets +1/+1.
Non-Human Werewolves you control can't transform.,DKA
"Sorin, Lord of Innistrad",,Michael Komarck,142,Planeswalker — Sorin,+1: Put a 1/1 black Vampire creature token with lifelink onto the battlefield.\n−2: You get an emblem with "Creatures you control get +1/+0."
−6: Destroy up to three target creatures and/or other planeswalkers. Return each card put into a graveyard this way to the battlefield under your control.,"DKA,DDK"
Stromkirk Captain,,Jana Schirmer & Johannes Voss,143,Creature — Vampire Soldier,First strike\nOther Vampire creatures you control get +1/+1 and have first strike.,DKA
Altar of the Lost,,Daarken,144,Artifact,Altar of the Lost enters the battlefield tapped.\n{T}: Add two mana in any combination of colors to your mana pool. Spend this mana only to cast spells with flashback from a graveyard.,DKA
Avacyn's Collar,,James Paick,145,Artifact — Equipment,"Equipped creature gets +1/+0 and has vigilance.\nWhenever equipped creature dies, if it was a Human, put a 1/1 white Spirit creature token with flying onto the battlefield.
Equip {2}",DKA
Chalice of Life,,Ryan Yee,146a,Artifact,"{T}: You gain 1 life. Then if you have at least 10 life more than your starting life total, transform Chalice of Life.",DKA
Chalice of Death,,Ryan Yee,146b,Artifact,{T}: Target player loses 5 life.,DKA
"Elbrus, the Binding Blade",,Eric Deschamps,147a,Legendary Artifact — Equipment,"Equipped creature gets +1/+0.\nWhen equipped creature deals combat damage to a player, unattach Elbrus, the Binding Blade, then transform it.
Equip {1}",DKA
Withengar Unbound,,Eric Deschamps,147b,Legendary Creature — Demon,"Flying, intimidate, trample (A creature with intimidate can't be blocked except by artifact creatures and/or creatures that share a color with it.)\nWhenever a player loses the game, put thirteen +1/+1 counters on Withengar Unbound.",DKA
Executioner's Hood,,Anthony Palumbo,148,Artifact — Equipment,Equipped creature has intimidate. (This creature can't be blocked except by artifact creatures and/or creatures that share a color with it.)\nEquip {2} ({2}: Attach to target creature you control. Equip only as a sorcery.),DKA
Grafdigger's Cage,,Daniel Ljunggren,149,Artifact,Creature cards can't enter the battlefield from graveyards or libraries.\nPlayers can't cast cards in graveyards or libraries.,DKA
Heavy Mattock,,Winona Nelson,150,Artifact — Equipment,"Equipped creature gets +1/+1.\nAs long as equipped creature is a Human, it gets an additional +1/+1.
Equip {2} ({2}: Attach to target creature you control. Equip only as a sorcery.)",DKA
Helvault,,Jaime Jones,151,Legendary Artifact,"{1}, {T}: Exile target creature you control.\n{7}, {T}: Exile target creature you don't control.
When Helvault is put into a graveyard from the battlefield, return all cards exiled with it to the battlefield under their owners' control.",DKA
Jar of Eyeballs,,Jaime Jones,152,Artifact,"Whenever a creature you control dies, put two eyeball counters on Jar of Eyeballs.\n{3}, {T}, Remove all eyeball counters from Jar of Eyeballs: Look at the top X cards of your library, where X is the number of eyeball counters removed this way. Put one of them into your hand and the rest on the bottom of your library in any order.","DKA,C13"
Warden of the Wall,,Daniel Ljunggren,153,Artifact,"Warden of the Wall enters the battlefield tapped.\n{T}: Add {1} to your mana pool.
As long as it's not your turn, Warden of the Wall is a 2/3 Gargoyle artifact creature with flying.",DKA
Wolfhunter's Quiver,,Daniel Ljunggren,154,Artifact — Equipment,Equipped creature has "{T}: This creature deals 1 damage to target creature or player" and "{T}: This creature deals 3 damage to target Werewolf creature."\nEquip {5},DKA
Evolving Wilds,,Cliff Childs,155,Land,"{T}, Sacrifice Evolving Wilds: Search your library for a basic land card and put it onto the battlefield tapped. Then shuffle your library.","pMEI,pFNM,ROE,CMD,DDH,DKA,M13,DDK,C13,M15,DDN,C14,DDO,DTK,MM2,ORI,DDP,BFZ,C15"
Grim Backwoods,,Vincent Proce,156,Land,"{T}: Add {1} to your mana pool.\n{2}{B}{G}, {T}, Sacrifice a creature: Draw a card.","DKA,C13,C15"
Haunted Fengraf,,Adam Paquette,157,Land,"{T}: Add {1} to your mana pool.\n{3}, {T}, Sacrifice Haunted Fengraf: Return a creature card at random from your graveyard to your hand.","DKA,C14"
Vault of the Archangel,,John Avon,158,Land,"{T}: Add {1} to your mana pool.\n{2}{W}{B}, {T}: Creatures you control gain deathtouch and lifelink until end of turn.","DKA,MD1"
