name,cost,artist,number,type,text,printings
Archangel's Light,,Volkan Baga,1,Sorcery,"You gain 2 life for each card in your graveyard, then shuffle your graveyard into your library.",DKA
Bar the Door,,Ryan Pancoast,2,Instant,Creatures you control get +0/+4 until end of turn.,DKA
Break of Day,,Karl Kopinski,3,Instant,"Creatures you control get +1/+1 until end of turn.\nFateful hour — If you have 5 or less life, those creatures gain indestructible until end of turn. (Damage and effects that say "destroy" don't destroy them.)",DKA
Burden of Guilt,,John Stanko,4,Enchantment — Aura,Enchant creature\n{1}: Tap enchanted creature.,DKA
Curse of Exhaustion,,Slawomir Maniak,5,Enchantment — Aura Curse,Enchant player\nEnchanted player can't cast more than one spell each turn.,DKA
Elgaud Inquisitor,,Slawomir Maniak,6,Creature — Human Cleric,"Lifelink (Damage dealt by this creature also causes you to gain that much life.)\nWhen Elgaud Inquisitor dies, put a 1/1 white Spirit creature token with flying onto the battlefield.",DKA
Faith's Shield,,Svetlin Velinov,7,Instant,"Target permanent you control gains protection from the color of your choice until end of turn.\nFateful hour — If you have 5 or less life, instead you and each permanent you control gain protection from the color of your choice until end of turn.",DKA
Gather the Townsfolk,,Dan Scott,8,Sorcery,"Put two 1/1 white Human creature tokens onto the battlefield.\nFateful hour — If you have 5 or less life, put five of those tokens onto the battlefield instead.","pWPN,DKA"
Gavony Ironwright,,Karl Kopinski,9,Creature — Human Soldier,"Fateful hour — As long as you have 5 or less life, other creatures you control get +1/+4.",DKA
Hollowhenge Spirit,,Lars Grant-West,10,Creature — Spirit,"Flash (You may cast this spell any time you could cast an instant.)\nFlying
When Hollowhenge Spirit enters the battlefield, remove target attacking or blocking creature from combat.",DKA
Increasing Devotion,,Daniel Ljunggren,11,Sorcery,"Put five 1/1 white Human creature tokens onto the battlefield. If Increasing Devotion was cast from a graveyard, put ten of those tokens onto the battlefield instead.\nFlashback {7}{W}{W} (You may cast this card from your graveyard for its flashback cost. Then exile it.)",DKA
Lingering Souls,,Bud Cook,12,Sorcery,Put two 1/1 white Spirit creature tokens with flying onto the battlefield.\nFlashback {1}{B} (You may cast this card from your graveyard for its flashback cost. Then exile it.),"pFNM,DKA,DDK,MD1"
Loyal Cathar,,Ryan Pancoast,13a,Creature — Human Soldier,"Vigilance\nWhen Loyal Cathar dies, return it to the battlefield transformed under your control at the beginning of the next end step.",DKA
Unhallowed Cathar,,Ryan Pancoast,13b,Creature — Zombie Soldier,Unhallowed Cathar can't block.,DKA
Midnight Guard,,Jason A. Engle,14,Creature — Human Soldier,"Whenever another creature enters the battlefield, untap Midnight Guard.","DKA,M15"
Niblis of the Mist,,Igor Kieryluk,15,Creature — Spirit,"Flying\nWhen Niblis of the Mist enters the battlefield, you may tap target creature.",DKA
Niblis of the Urn,,Igor Kieryluk,16,Creature — Spirit,"Flying\nWhenever Niblis of the Urn attacks, you may tap target creature.",DKA
Ray of Revelation,,Cliff Childs,17,Instant,Destroy target enchantment.\nFlashback {G} (You may cast this card from your graveyard for its flashback cost. Then exile it.),"JUD,DKA"
Requiem Angel,,Eric Deschamps,18,Creature — Angel,"Flying\nWhenever another non-Spirit creature you control dies, put a 1/1 white Spirit creature token with flying onto the battlefield.","DKA,C14"
Sanctuary Cat,,David Palumbo,19,Creature — Cat,,DKA
Séance,,David Rapoza,20,Enchantment,"At the beginning of each upkeep, you may exile target creature card from your graveyard. If you do, put a token onto the battlefield that's a copy of that card except it's a Spirit in addition to its other types. Exile it at the beginning of the next end step.",DKA
Silverclaw Griffin,,Daniel Ljunggren,21,Creature — Griffin,"Flying, first strike",DKA
Skillful Lunge,,Jason Felix,22,Instant,Target creature gets +2/+0 and gains first strike until end of turn.,DKA
Sudden Disappearance,,Cliff Childs,23,Sorcery,Exile all nonland permanents target player controls. Return the exiled cards to the battlefield under their owner's control at the beginning of the next end step.,DKA
"Thalia, Guardian of Thraben",,Jana Schirmer & Johannes Voss,24,Legendary Creature — Human Soldier,First strike\nNoncreature spells cost {1} more to cast.,DKA
Thraben Doomsayer,,John Stanko,25,Creature — Human Cleric,"{T}: Put a 1/1 white Human creature token onto the battlefield.\nFateful hour — As long as you have 5 or less life, other creatures you control get +2/+2.",DKA
Thraben Heretic,,James Ryman,26,Creature — Human Wizard,{T}: Exile target creature card from a graveyard.,DKA
Artful Dodge,,Tomasz Jedruszek,27,Sorcery,Target creature can't be blocked this turn.\nFlashback {U} (You may cast this card from your graveyard for its flashback cost. Then exile it.),DKA
Beguiler of Wills,,Eric Deschamps,28,Creature — Human Wizard,{T}: Gain control of target creature with power less than or equal to the number of creatures you control.,DKA
Bone to Ash,,Clint Cearley,29,Instant,Counter target creature spell.\nDraw a card.,"DKA,ORI"
Call to the Kindred,,Jason A. Engle,30,Enchantment — Aura,"Enchant creature\nAt the beginning of your upkeep, you may look at the top five cards of your library. If you do, you may put a creature card that shares a creature type with enchanted creature from among them onto the battlefield, then you put the rest of those cards on the bottom of your library in any order.",DKA
Chant of the Skifsang,,Nils Hamm,31,Enchantment — Aura,Enchant creature\nEnchanted creature gets -13/-0.,DKA
Chill of Foreboding,,Terese Nielsen,32,Sorcery,Each player puts the top five cards of his or her library into his or her graveyard.\nFlashback {7}{U} (You may cast this card from your graveyard for its flashback cost. Then exile it.),DKA
Counterlash,,Austin Hsu,33,Instant,Counter target spell. You may cast a nonland card in your hand that shares a card type with that spell without paying its mana cost.,DKA
Curse of Echoes,,Slawomir Maniak,34,Enchantment — Aura Curse,"Enchant player\nWhenever enchanted player casts an instant or sorcery spell, each other player may copy that spell and may choose new targets for the copy he or she controls.",DKA
Divination,,Scott Chou,35,Sorcery,Draw two cards.,"M10,M12,DKA,M13,M14,BNG,M15"
Dungeon Geists,,Nils Hamm,36,Creature — Spirit,"Flying\nWhen Dungeon Geists enters the battlefield, tap target creature an opponent controls. That creature doesn't untap during its controller's untap step for as long as you control Dungeon Geists.","DKA,C13"
Geralf's Mindcrusher,,Steven Belledin,37,Creature — Zombie Horror,"When Geralf's Mindcrusher enters the battlefield, target player puts the top five cards of his or her library into his or her graveyard.\nUndying (When this creature dies, if it had no +1/+1 counters on it, return it to the battlefield under its owner's control with a +1/+1 counter on it.)",DKA
Griptide,,Igor Kieryluk,38,Instant,Put target creature on top of its owner's library.,"DKA,THS,DDM"
Havengul Runebinder,,Bud Cook,39,Creature — Human Wizard,"{2}{U}, {T}, Exile a creature card from your graveyard: Put a 2/2 black Zombie creature token onto the battlefield, then put a +1/+1 counter on each Zombie creature you control.",DKA
Headless Skaab,,Johann Bodin,40,Creature — Zombie Warrior,"As an additional cost to cast Headless Skaab, exile a creature card from your graveyard.\nHeadless Skaab enters the battlefield tapped.",DKA
Increasing Confusion,,Dan Scott,41,Sorcery,"Target player puts the top X cards of his or her library into his or her graveyard. If Increasing Confusion was cast from a graveyard, that player puts twice that many cards into his or her graveyard instead.\nFlashback {X}{U} (You may cast this card from your graveyard for its flashback cost. Then exile it.)",DKA
Mystic Retrieval,,Scott Chou,42,Sorcery,Return target instant or sorcery card from your graveyard to your hand.\nFlashback {2}{R} (You may cast this card from your graveyard for its flashback cost. Then exile it.),"DKA,C15"
Nephalia Seakite,,Wayne England,43,Creature — Bird,Flash (You may cast this spell any time you could cast an instant.)\nFlying,"DKA,M14"
Niblis of the Breath,,Igor Kieryluk,44,Creature — Spirit,"Flying\n{U}, {T}: You may tap or untap target creature.",DKA
Relentless Skaabs,,Karl Kopinski,45,Creature — Zombie,"As an additional cost to cast Relentless Skaabs, exile a creature card from your graveyard.\nUndying (When this creature dies, if it had no +1/+1 counters on it, return it to the battlefield under its owner's control with a +1/+1 counter on it.)",DKA
Saving Grasp,,Matt Stewart,46,Instant,Return target creature you own to your hand.\nFlashback {W} (You may cast this card from your graveyard for its flashback cost. Then exile it.),DKA
Screeching Skaab,,Clint Cearley,47,Creature — Zombie,"When Screeching Skaab enters the battlefield, put the top two cards of your library into your graveyard.","DKA,ORI"
Secrets of the Dead,,Eytan Zana,48,Enchantment,"Whenever you cast a spell from your graveyard, draw a card.",DKA
Shriekgeist,,Raymond Swanland,49,Creature — Spirit,"Flying\nWhenever Shriekgeist deals combat damage to a player, that player puts the top two cards of his or her library into his or her graveyard.",DKA
Soul Seizer,,Lucas Graciano,50a,Creature — Spirit,"Flying\nWhen Soul Seizer deals combat damage to a player, you may transform it. If you do, attach it to target creature that player controls.",DKA
Ghastly Haunting,,Lucas Graciano,50b,Enchantment — Aura,Enchant creature\nYou control enchanted creature.,DKA
Stormbound Geist,,Dan Scott,51,Creature — Spirit,"Flying\nStormbound Geist can block only creatures with flying.
Undying (When this creature dies, if it had no +1/+1 counters on it, return it to the battlefield under its owner's control with a +1/+1 counter on it.)",DKA
Thought Scour,,David Rapoza,52,Instant,Target player puts the top two cards of his or her library into his or her graveyard.\nDraw a card.,"DKA,DDM"
Tower Geist,,Izzy,53,Creature — Spirit,"Flying\nWhen Tower Geist enters the battlefield, look at the top two cards of your library. Put one of them into your hand and the other into your graveyard.","DKA,ORI"
Black Cat,,David Palumbo,54,Creature — Zombie Cat,"When Black Cat dies, target opponent discards a card at random.","DKA,M15"
Chosen of Markov,,Steve Argyle,55a,Creature — Human,"{T}, Tap an untapped Vampire you control: Transform Chosen of Markov.",DKA
Markov's Servant,,Steve Argyle,55b,Creature — Vampire,,DKA
Curse of Misfortunes,,Terese Nielsen,56,Enchantment — Aura Curse,"Enchant player\nAt the beginning of your upkeep, you may search your library for a Curse card that doesn't have the same name as a Curse attached to enchanted player, put it onto the battlefield attached to that player, then shuffle your library.",DKA
Curse of Thirst,,Christopher Moeller,57,Enchantment — Aura Curse,"Enchant player\nAt the beginning of enchanted player's upkeep, Curse of Thirst deals damage to that player equal to the number of Curses attached to him or her.","pWPN,DKA"
Deadly Allure,,Steve Argyle,58,Sorcery,Target creature gains deathtouch until end of turn and must be blocked this turn if able.\nFlashback {G} (You may cast this card from your graveyard for its flashback cost. Then exile it.),DKA
Death's Caress,,James Ryman,59,Sorcery,"Destroy target creature. If that creature was a Human, you gain life equal to its toughness.",DKA
Falkenrath Torturer,,Steve Argyle,60,Creature — Vampire,"Sacrifice a creature: Falkenrath Torturer gains flying until end of turn. If the sacrificed creature was a Human, put a +1/+1 counter on Falkenrath Torturer.",DKA
Farbog Boneflinger,,Tomasz Jedruszek,61,Creature — Zombie,"When Farbog Boneflinger enters the battlefield, target creature gets -2/-2 until end of turn.",DKA
Fiend of the Shadows,,Igor Kieryluk,62,Creature — Vampire Wizard,"Flying\nWhenever Fiend of the Shadows deals combat damage to a player, that player exiles a card from his or her hand. You may play that card for as long as it remains exiled.
Sacrifice a Human: Regenerate Fiend of the Shadows.",DKA
Geralf's Messenger,,Kev Walker,63,Creature — Zombie,"Geralf's Messenger enters the battlefield tapped.\nWhen Geralf's Messenger enters the battlefield, target opponent loses 2 life.
Undying (When this creature dies, if it had no +1/+1 counters on it, return it to the battlefield under its owner's control with a +1/+1 counter on it.)",DKA
Gravecrawler,,Steven Belledin,64,Creature — Zombie,Gravecrawler can't block.\nYou may cast Gravecrawler from your graveyard as long as you control a Zombie.,"pMEI,DKA"
Gravepurge,,Zoltan Boros,65,Instant,Put any number of target creature cards from your graveyard on top of your library.\nDraw a card.,"DKA,DTK"
Gruesome Discovery,,John Stanko,66,Sorcery,"Target player discards two cards.\nMorbid — If a creature died this turn, instead that player reveals his or her hand, you choose two cards from it, then that player discards those cards.",DKA
Harrowing Journey,,James Paick,67,Sorcery,Target player draws three cards and loses 3 life.,DKA
Highborn Ghoul,,Volkan Baga,68,Creature — Zombie,Intimidate (This creature can't be blocked except by artifact creatures and/or creatures that share a color with it.),DKA
Increasing Ambition,,Volkan Baga,69,Sorcery,"Search your library for a card and put that card into your hand. If Increasing Ambition was cast from a graveyard, instead search your library for two cards and put those cards into your hand. Then shuffle your library.\nFlashback {7}{B} (You may cast this card from your graveyard for its flashback cost. Then exile it.)",DKA
"Mikaeus, the Unhallowed",,Chris Rahn,70,Legendary Creature — Zombie Cleric,"Intimidate (This creature can't be blocked except by artifact creatures and/or creatures that share a color with it.)\nWhenever a Human deals damage to you, destroy it.
Other non-Human creatures you control get +1/+1 and have undying. (When a creature with undying dies, if it had no +1/+1 counters on it, return it to the battlefield under its owner's control with a +1/+1 counter on it.)",DKA
Ravenous Demon,,Igor Kieryluk,71a,Creature — Demon,Sacrifice a Human: Transform Ravenous Demon. Activate this ability only any time you could cast a sorcery.,"pPRE,DKA"
Archdemon of Greed,,Igor Kieryluk,71b,Creature — Demon,"Flying, trample\nAt the beginning of your upkeep, sacrifice a Human. If you can't, tap Archdemon of Greed and it deals 9 damage to you.","pPRE,DKA"
Reap the Seagraf,,James Ryman,72,Sorcery,Put a 2/2 black Zombie creature token onto the battlefield.\nFlashback {4}{U} (You may cast this card from your graveyard for its flashback cost. Then exile it.),DKA
Sightless Ghoul,,Svetlin Velinov,73,Creature — Zombie Soldier,"Sightless Ghoul can't block.\nUndying (When this creature dies, if it had no +1/+1 counters on it, return it to the battlefield under its owner's control with a +1/+1 counter on it.)",DKA
Skirsdag Flayer,,Austin Hsu,74,Creature — Human Cleric,"{3}{B}, {T}, Sacrifice a Human: Destroy target creature.",DKA
Spiteful Shadows,,John Stanko,75,Enchantment — Aura,"Enchant creature\nWhenever enchanted creature is dealt damage, it deals that much damage to its controller.",DKA
Tragic Slip,,Christopher Moeller,76,Instant,Target creature gets -1/-1 until end of turn.\nMorbid — That creature gets -13/-13 until end of turn instead if a creature died this turn.,"DKA,DDM,CNS,C14"
Undying Evil,,Kev Walker,77,Instant,"Target creature gains undying until end of turn. (When it dies, if it had no +1/+1 counters on it, return it to the battlefield under its owner's control with a +1/+1 counter on it.)",DKA
Vengeful Vampire,,Lucas Graciano,78,Creature — Vampire,"Flying\nUndying (When this creature dies, if it had no +1/+1 counters on it, return it to the battlefield under its owner's control with a +1/+1 counter on it.)",DKA
Wakedancer,,Austin Hsu,79,Creature — Human Shaman,"Morbid — When Wakedancer enters the battlefield, if a creature died this turn, put a 2/2 black Zombie creature token onto the battlefield.","DKA,CNS"
Zombie Apocalypse,,Peter Mohrbacher,80,Sorcery,"Return all Zombie creature cards from your graveyard to the battlefield tapped, then destroy all Humans.","pMGD,DKA"
Afflicted Deserter,,David Palumbo,81a,Creature — Human Werewolf,"At the beginning of each upkeep, if no spells were cast last turn, transform Afflicted Deserter.",DKA
Werewolf Ransacker,,David Palumbo,81b,Creature — Werewolf,"Whenever this creature transforms into Werewolf Ransacker, you may destroy target artifact. If that artifact is put into a graveyard this way, Werewolf Ransacker deals 3 damage to that artifact's controller.\nAt the beginning of each upkeep, if a player cast two or more spells last turn, transform Werewolf Ransacker.",DKA
Alpha Brawl,,Randy Gallegos,82,Sorcery,"Target creature an opponent controls deals damage equal to its power to each other creature that player controls, then each of those creatures deals damage equal to its power to that creature.",DKA
Blood Feud,,Winona Nelson,83,Sorcery,Target creature fights another target creature. (Each deals damage equal to its power to the other.),DKA
Burning Oil,,Trevor Claxton,84,Instant,Burning Oil deals 3 damage to target attacking or blocking creature.\nFlashback {3}{W} (You may cast this card from your graveyard for its flashback cost. Then exile it.),DKA
Curse of Bloodletting,,Michael C. Hayes,85,Enchantment — Aura Curse,"Enchant player\nIf a source would deal damage to enchanted player, it deals double that damage to that player instead.",DKA
Erdwal Ripper,,Kev Walker,86,Creature — Vampire,"Haste\nWhenever Erdwal Ripper deals combat damage to a player, put a +1/+1 counter on it.",DKA
Faithless Looting,,Gabor Szikszai,87,Sorcery,"Draw two cards, then discard two cards.\nFlashback {2}{R} (You may cast this card from your graveyard for its flashback cost. Then exile it.)","pMEI,DKA,DDK,C14,C15"
Fires of Undeath,,Jason Chan,88,Instant,Fires of Undeath deals 2 damage to target creature or player.\nFlashback {5}{B} (You may cast this card from your graveyard for its flashback cost. Then exile it.),DKA
Flayer of the Hatebound,,Jana Schirmer & Johannes Voss,89,Creature — Devil,"Undying (When this creature dies, if it had no +1/+1 counters on it, return it to the battlefield under its owner's control with a +1/+1 counter on it.)\nWhenever Flayer of the Hatebound or another creature enters the battlefield from your graveyard, that creature deals damage equal to its power to target creature or player.",DKA
Fling,,Izzy,90,Instant,"As an additional cost to cast Fling, sacrifice a creature.\nFling deals damage equal to the sacrificed creature's power to target creature or player.","pARL,STH,pWPN,M11,M12,DKA,PC2"
Forge Devil,,Austin Hsu,91,Creature — Devil,"When Forge Devil enters the battlefield, it deals 1 damage to target creature and 1 damage to you.","DKA,M15"
Heckling Fiends,,Clint Cearley,92,Creature — Devil,{2}{R}: Target creature attacks this turn if able.,"DKA,CNS"
Hellrider,,Svetlin Velinov,93,Creature — Devil,"Haste\nWhenever a creature you control attacks, Hellrider deals 1 damage to defending player.","DKA,DDK"
Hinterland Hermit,,Steven Belledin,94a,Creature — Human Werewolf,"At the beginning of each upkeep, if no spells were cast last turn, transform Hinterland Hermit.",DKA
Hinterland Scourge,,Steven Belledin,94b,Creature — Werewolf,"Hinterland Scourge must be blocked if able.\nAt the beginning of each upkeep, if a player cast two or more spells last turn, transform Hinterland Scourge.",DKA
Increasing Vengeance,,Anthony Francisco,95,Instant,"Copy target instant or sorcery spell you control. If Increasing Vengeance was cast from a graveyard, copy that spell twice instead. You may choose new targets for the copies.\nFlashback {3}{R}{R} (You may cast this card from your graveyard for its flashback cost. Then exile it.)",DKA
Markov Blademaster,,Jana Schirmer & Johannes Voss,96,Creature — Vampire Warrior,"Double strike\nWhenever Markov Blademaster deals combat damage to a player, put a +1/+1 counter on it.",DKA
Markov Warlord,,Cynthia Sheppard,97,Creature — Vampire Warrior,"Haste\nWhen Markov Warlord enters the battlefield, up to two target creatures can't block this turn.",DKA
Mondronen Shaman,,Mike Sass,98a,Creature — Human Werewolf Shaman,"At the beginning of each upkeep, if no spells were cast last turn, transform Mondronen Shaman.","pLPA,DKA"
Tovolar's Magehunter,,Mike Sass,98b,Creature — Werewolf,"Whenever an opponent casts a spell, Tovolar's Magehunter deals 2 damage to that player.\nAt the beginning of each upkeep, if a player cast two or more spells last turn, transform Tovolar's Magehunter.","pLPA,DKA"
Moonveil Dragon,,Todd Lockwood,99,Creature — Dragon,Flying\n{R}: Each creature you control gets +1/+0 until end of turn.,DKA
Nearheath Stalker,,Michael C. Hayes,100,Creature — Vampire Rogue,"Undying (When this creature dies, if it had no +1/+1 counters on it, return it to the battlefield under its owner's control with a +1/+1 counter on it.)","pWPN,DKA"
Pyreheart Wolf,,Lars Grant-West,101,Creature — Wolf,"Whenever Pyreheart Wolf attacks, creatures you control gain menace until end of turn. (They can't be blocked except by two or more creatures.)\nUndying (When this creature dies, if it had no +1/+1 counters on it, return it to the battlefield under its owner's control with a +1/+1 counter on it.)",DKA
Russet Wolves,,Christopher Moeller,102,Creature — Wolf,,DKA
Scorch the Fields,,Jaime Jones,103,Sorcery,Destroy target land. Scorch the Fields deals 1 damage to each Human creature.,DKA
Shattered Perception,,Terese Nielsen,104,Sorcery,"Discard all the cards in your hand, then draw that many cards.\nFlashback {5}{R} (You may cast this card from your graveyard for its flashback cost. Then exile it.)",DKA
Talons of Falkenrath,,Svetlin Velinov,105,Enchantment — Aura,Flash (You may cast this spell any time you could cast an instant.)\nEnchant creature
Enchanted creature has "{1}{R}: This creature gets +2/+0 until end of turn.",DKA
Torch Fiend,,Winona Nelson,106,Creature — Devil,"{R}, Sacrifice Torch Fiend: Destroy target artifact.","DKA,M13,CNS,M15"
Wrack with Madness,,Todd Lockwood,107,Sorcery,Target creature deals damage to itself equal to its power.,DKA
Briarpack Alpha,,Daarken,108,Creature — Wolf,"Flash (You may cast this spell any time you could cast an instant.)\nWhen Briarpack Alpha enters the battlefield, target creature gets +2/+2 until end of turn.","DKA,M14"
Clinging Mists,,Anthony Francisco,109,Instant,"Prevent all combat damage that would be dealt this turn.\nFateful hour — If you have 5 or less life, tap all attacking creatures. Those creatures don't untap during their controller's next untap step.",DKA
Crushing Vines,,Scott Chou,110,Instant,Choose one —\n• Destroy target creature with flying.
• Destroy target artifact.,DKA
Dawntreader Elk,,John Avon,111,Creature — Elk,"{G}, Sacrifice Dawntreader Elk: Search your library for a basic land card, put it onto the battlefield tapped, then shuffle your library.",DKA
Deranged Outcast,,Nils Hamm,112,Creature — Human Rogue,"{1}{G}, Sacrifice a Human: Put two +1/+1 counters on target creature.",DKA
Favor of the Woods,,Tomasz Jedruszek,113,Enchantment — Aura,"Enchant creature\nWhenever enchanted creature blocks, you gain 3 life.",DKA
Feed the Pack,,Steve Prescott,114,Enchantment,"At the beginning of your end step, you may sacrifice a nontoken creature. If you do, put X 2/2 green Wolf creature tokens onto the battlefield, where X is the sacrificed creature's toughness.",DKA
Ghoultree,,Volkan Baga,115,Creature — Zombie Treefolk,Ghoultree costs {1} less to cast for each creature card in your graveyard.,DKA
Gravetiller Wurm,,Slawomir Maniak,116,Creature — Wurm,Trample\nMorbid — Gravetiller Wurm enters the battlefield with four +1/+1 counters on it if a creature died this turn.,DKA
Grim Flowering,,Adam Paquette,117,Sorcery,Draw a card for each creature card in your graveyard.,"DKA,DDJ,C14"
Hollowhenge Beast,,Dave Kendall,118,Creature — Beast,,DKA
Hunger of the Howlpack,,Nils Hamm,119,Instant,Put a +1/+1 counter on target creature.\nMorbid — Put three +1/+1 counters on that creature instead if a creature died this turn.,"DKA,CNS"
Increasing Savagery,,Steve Prescott,120,Sorcery,"Put five +1/+1 counters on target creature. If Increasing Savagery was cast from a graveyard, put ten +1/+1 counters on that creature instead.\nFlashback {5}{G}{G} (You may cast this card from your graveyard for its flashback cost. Then exile it.)",DKA
Kessig Recluse,,Vincent Proce,121,Creature — Spider,Reach (This creature can block creatures with flying.)\nDeathtouch (Any amount of damage this deals to a creature is enough to destroy it.),DKA
Lambholt Elder,,Matt Stewart,122a,Creature — Human Werewolf,"At the beginning of each upkeep, if no spells were cast last turn, transform Lambholt Elder.",DKA
Silverpelt Werewolf,,Matt Stewart,122b,Creature — Werewolf,"Whenever Silverpelt Werewolf deals combat damage to a player, draw a card.\nAt the beginning of each upkeep, if a player cast two or more spells last turn, transform Silverpelt Werewolf.",DKA
Lost in the Woods,,Matt Stewart,123,Enchantment,"Whenever a creature attacks you or a planeswalker you control, reveal the top card of your library. If it's a Forest card, remove that creature from combat. Then put the revealed card on the bottom of your library.",DKA
