name,manaCost,cmc,colorIdentity,artist,number,type,text,printings,flavor,layout,multiverseid,power,toughness,rarity,subtypes,types
Runesword,{6},6,,Christopher Rush,,Artifact,"{3}, {T}: Target attacking creature gets +2/+0 until end of turn. When that creature leaves the battlefield this turn, sacrifice Runesword. If the creature deals damage to a creature this turn, the creature dealt damage can't be regenerated this turn. If a creature dealt damage by the targeted creature would die this turn, exile that creature instead.","DRK,CHR",,normal,1719,,,Uncommon,,Artifact
Safe Haven,,,,Christopher Rush,,Land,"{2}, {T}: Exile target creature you control.\nAt the beginning of your upkeep, you may sacrifice Safe Haven. If you do, return each card exiled with Safe Haven to the battlefield under its owner's control.","DRK,CHR,TSB",,normal,1825,,,Rare,,Land
Savaen Elves,{G},1,G,Ron Spencer,,Creature — Elf,"{G}{G}, {T}: Destroy target Aura attached to a land.",DRK,"""Purity of magic can only come from purity of the land. How can a meal nourish if the ingredients are spoiled?"" —Sidaine of Savaen",normal,1774,1,1,Common,Elf,Creature
Scarecrow,{5},5,,Anson Maddocks,,Artifact Creature — Scarecrow,"{6}, {T}: Prevent all damage that would be dealt to you this turn by creatures with flying.","DRK,ME4",There was more malice in its button eyes than should have been possible in something that had never known life.,normal,1720,2,2,Uncommon,Scarecrow,"Artifact,Creature"
Scarwood Bandits,{2}{G}{G},4,G,Mark Poole,,Creature — Human Rogue,"Forestwalk (This creature can't be blocked as long as defending player controls a Forest.)\n{2}{G}, {T}: Unless an opponent pays {2}, gain control of target artifact for as long as Scarwood Bandits remains on the battlefield.","DRK,ME4",,normal,1775,2,2,Rare,"Human,Rogue",Creature
Scarwood Goblins,{R}{G},2,"R,G",Ron Spencer,,Creature — Goblin,,DRK,"Larger and more cunning than most Goblins, Scarwood Goblins are thankfully found only in isolated pockets.",normal,1822,2,2,Common,Goblin,Creature
Scarwood Hag,{1}{G},2,G,Anson Maddocks,,Creature — Hag,"{G}{G}{G}{G}, {T}: Target creature gains forestwalk until end of turn. (It can't be blocked as long as defending player controls a Forest.)\n{T}: Target creature loses forestwalk until end of turn.",DRK,,normal,1776,1,1,Uncommon,Hag,Creature
Scavenger Folk,{G},1,G,Dennis Detwiller,,Creature — Human,"{G}, {T}, Sacrifice Scavenger Folk: Destroy target artifact.","DRK,CHR,5ED,ATH,7ED,ME4","String, weapons, wax, or jewels—it makes no difference. Leave nothing unguarded in Scarwood.",normal,1777,1,1,Common,Human,Creature
Season of the Witch,{B}{B}{B},3,B,Jesper Myrfors,,Enchantment,"At the beginning of your upkeep, sacrifice Season of the Witch unless you pay 2 life.\nAt the beginning of the end step, destroy all untapped creatures that didn't attack this turn, except for creatures that couldn't attack.",DRK,,normal,1741,,,Rare,,Enchantment
Sisters of the Flame,{1}{R}{R},3,R,Jesper Myrfors,,Creature — Human Shaman,{T}: Add {R} to your mana pool.,"DRK,4ED",We are many wicks sharing a common tallow; we feed the skies with the ashes of our prey.,normal,1800,2,2,Uncommon,"Human,Shaman",Creature
Skull of Orm,{3},3,,Tom Wänerstrand,,Artifact,"{5}, {T}: Return target enchantment card from your graveyard to your hand.","DRK,8ED","Though lifeless, the Skull still possessed a strange power over the flow of magic.",normal,1721,,,Uncommon,,Artifact
Sorrow's Path,,,,Randy Asplund-Faith,,Land,"{T}: Choose two target blocking creatures an opponent controls. If each of those creatures could block all creatures that the other is blocking, remove both of them from combat. Each one then blocks all creatures the other was blocking.\nWhenever Sorrow's Path becomes tapped, it deals 2 damage to you and each creature you control.","DRK,ME3",,normal,1826,,,Rare,,Land
Spitting Slug,{1}{G}{G},3,G,Anson Maddocks,,Creature — Slug,"Whenever Spitting Slug blocks or becomes blocked, you may pay {1}{G}. If you do, Spitting Slug gains first strike until end of turn. Otherwise, each creature blocking or blocked by Spitting Slug gains first strike until end of turn.","DRK,TSB",,normal,1778,2,4,Uncommon,Slug,Creature
Squire,{1}{W},2,W,Dennis Detwiller,,Creature — Human Soldier,,"DRK,TSB","""Of twenty yeer of age he was, I gesse. Of his stature he was of even lengthe. And wonderly deliver, and greete of strengthe."" —Geoffrey Chaucer, The Canterbury Tales",normal,1817,1,2,Common,"Human,Soldier",Creature
Standing Stones,{3},3,,Sandra Everingham,,Artifact,"{1}, {T}, Pay 1 life: Add one mana of any color to your mana pool.",DRK,,normal,1722,,,Uncommon,,Artifact
Stone Calendar,{5},5,,Amy Weber,,Artifact,Spells you cast cost up to {1} less to cast.,"DRK,MED",The Pretender Mairsil ordered a great Calendar drawn up to show when the paths to the Dark Lands were strongest.,normal,1723,,,Rare,,Artifact
Sunken City,{U}{U},2,U,Jesper Myrfors,,Enchantment,"At the beginning of your upkeep, sacrifice Sunken City unless you pay {U}{U}.\nBlue creatures get +1/+1.","DRK,4ED,MED",,normal,1762,,,Common,,Enchantment
Tangle Kelp,{U},1,U,Rob Alexander,,Enchantment — Aura,"Enchant creature\nWhen Tangle Kelp enters the battlefield, tap enchanted creature.\nEnchanted creature doesn't untap during its controller's untap step if it attacked during its controller's last turn.",DRK,,normal,1763,,,Uncommon,Aura,Enchantment
The Fallen,{1}{B}{B}{B},4,B,Jesper Myrfors,,Creature — Zombie,"At the beginning of your upkeep, The Fallen deals 1 damage to each opponent it has dealt damage to this game.","DRK,CHR,MED",Magic often masters those who cannot master it.,normal,1742,2,3,Uncommon,Zombie,Creature
Tivadar's Crusade,{1}{W}{W},3,W,Dennis Detwiller,,Sorcery,Destroy all Goblins.,"DRK,MED",,normal,1818,,,Uncommon,,Sorcery
Tormod's Crypt,{0},,,Christopher Rush,,Artifact,"{T}, Sacrifice Tormod's Crypt: Exile all cards from target player's graveyard.","DRK,CHR,pFNM,TSB,M13,M15,C14","The dark opening seemed to breathe the cold, damp air of the dead earth in a steady rhythm.",normal,1724,,,Uncommon,,Artifact
Tower of Coireall,{2},2,,Dan Frazier,,Artifact,{T}: Target creature can't be blocked by Walls this turn.,DRK,,normal,1725,,,Uncommon,,Artifact
Tracker,{2}{G},3,G,Jeff A. Menges,,Creature — Human,"{G}{G}, {T}: Tracker deals damage equal to its power to target creature. That creature deals damage equal to its power to Tracker.","DRK,ME3",,normal,1779,2,2,Rare,Human,Creature
Uncle Istvan,{1}{B}{B}{B},4,B,Daniel Gelon,,Creature — Human,Prevent all damage that would be dealt to Uncle Istvan by creatures.,"DRK,4ED,TSB",Solitude drove the old hermit insane. Now he only keeps company with those he can catch.,normal,1743,1,3,Uncommon,Human,Creature
Venom,{1}{G}{G},3,G,Tom Wänerstrand,,Enchantment — Aura,"Enchant creature\nWhenever enchanted creature blocks or becomes blocked by a non-Wall creature, destroy the other creature at end of combat.","DRK,4ED,5ED","""I told him it was just a flesh wound, a wee scratch, but the next time I looked at him, poor Tadhg was dead and gone."" —Maeveen O'Donagh, Memoirs of a Soldier",normal,1780,,,Common,Aura,Enchantment
Wand of Ith,{4},4,,Quinton Hoover,,Artifact,"{3}, {T}: Target player reveals a card at random from his or her hand. If it's a land card, that player discards it unless he or she pays 1 life. If it isn't a land card, the player discards it unless he or she pays life equal to its converted mana cost. Activate this ability only during your turn.",DRK,,normal,1726,,,Uncommon,,Artifact
War Barge,{4},4,,Tom Wänerstrand,,Artifact,"{3}: Target creature gains islandwalk until end of turn. When War Barge leaves the battlefield this turn, destroy that creature. A creature destroyed this way can't be regenerated. (A creature with islandwalk can't be blocked as long as defending player controls an Island.)","DRK,TSB",,normal,1727,,,Uncommon,,Artifact
Water Wurm,{U},1,U,Ron Spencer,,Creature — Wurm,Water Wurm gets +0/+1 as long as an opponent controls an Island.,DRK,,normal,1764,1,1,Common,Wurm,Creature
Whippoorwill,{G},1,G,Douglas Shuler,,Creature — Bird,"{G}{G}, {T}: Target creature can't be regenerated this turn. Damage that would be dealt to that creature this turn can't be prevented or dealt instead to another creature or player. When the creature dies this turn, exile the creature.",DRK,"If the Whippoorwill remains silent, the soul has not reached its reward.",normal,1781,1,1,Uncommon,Bird,Creature
Witch Hunter,{2}{W}{W},4,W,Jesper Myrfors,,Creature — Human Cleric,"{T}: Witch Hunter deals 1 damage to target player.\n{1}{W}{W}, {T}: Return target creature an opponent controls to its owner's hand.","DRK,CHR,TSB",,normal,1819,1,1,Rare,"Human,Cleric",Creature
Word of Binding,{X}{B}{B},2,B,Ron Spencer,,Sorcery,Tap X target creatures.,"DRK,4ED","""That was the worst experience of my days, standing there helpless as they killed my whole troop."" —Maeveen O'Donagh, Memoirs of a Soldier",normal,1744,,,Common,,Sorcery
Worms of the Earth,{2}{B}{B}{B},5,B,Anson Maddocks,,Enchantment,"Players can't play lands.\nLands can't enter the battlefield.\nAt the beginning of each upkeep, any player may sacrifice two lands or have Worms of the Earth deal 5 damage to him or her. If a player does either, destroy Worms of the Earth.",DRK,"The ground collapsed, leaving nothing but the great Worms' mucous residues.",normal,1745,,,Rare,,Enchantment
Wormwood Treefolk,{3}{G}{G},5,"G,B",Jesper Myrfors,,Creature — Treefolk,{G}{G}: Wormwood Treefolk gains forestwalk until end of turn and deals 2 damage to you. (It can't be blocked as long as defending player controls a Forest.)\n{B}{B}: Wormwood Treefolk gains swampwalk until end of turn and deals 2 damage to you. (It can't be blocked as long as defending player controls a Swamp.),"DRK,ME3",,normal,1782,4,4,Rare,Treefolk,Creature
