name,manaCost,cmc,colorIdentity,artist,number,type,text,printings,flavor,layout,multiverseid,power,toughness,rarity,subtypes,types
Amnesia,{3}{U}{U}{U},6,U,Mark Poole,,Sorcery,Target player reveals his or her hand and discards all nonland cards.,"DRK,MED","""When one has witnessed the unspeakable, 'tis sometimes better to forget."" —Vervamon the Elder",normal,1746,,,Uncommon,,Sorcery
Angry Mob,{2}{W}{W},4,W,Drew Tucker,,Creature — Human,"Trample\nAs long as it's your turn, Angry Mob's power and toughness are each equal to 2 plus the number of Swamps your opponents control. As long as it's not your turn, Angry Mob's power and toughness are each 2.","DRK,4ED,5ED,MED",,normal,1801,2+*,2+*,Uncommon,Human,Creature
Apprentice Wizard,{1}{U}{U},3,U,Dan Frazier,,Creature — Human Wizard,"{U}, {T}: Add {C}{C}{C} to your mana pool.","DRK,4ED,MED",,normal,1747,0,1,Rare,"Human,Wizard",Creature
Ashes to Ashes,{1}{B}{B},3,B,Drew Tucker,,Sorcery,Exile two target nonartifact creatures. Ashes to Ashes deals 5 damage to you.,"DRK,4ED,5ED,ME3","""All rivers eventually run to the sea. My job is to sort out who goes first.""\n—Maeveen O'Donagh, Memoirs of a Soldier",normal,1728,,,Common,,Sorcery
Ball Lightning,{R}{R}{R},3,R,Quinton Hoover,,Creature — Elemental,"Trample (This creature can deal excess combat damage to defending player or planeswalker while attacking.)\nHaste (This creature can attack and {T} as soon as it comes under your control.)\nAt the beginning of the end step, sacrifice Ball Lightning.","DRK,4ED,5ED,pJGP,BTD,MED,M10,PD2",,normal,1783,6,1,Rare,Elemental,Creature
Banshee,{2}{B}{B},4,B,Jesper Myrfors,,Creature — Spirit,"{X}, {T}: Banshee deals half X damage, rounded down, to target creature or player, and half X damage, rounded up, to you.","DRK,CHR,ME3","Some say Banshees are the hounds of Death, baying to herd their prey into the arms of their master.",normal,1729,0,1,Uncommon,Spirit,Creature
Barl's Cage,{4},4,,Tom Wänerstrand,,Artifact,{3}: Target creature doesn't untap during its controller's next untap step.,"DRK,CHR,5ED,ME3","For a dozen years the Cage had held Lord Ith, but as the Pretender Mairsil's power weakened, so did the bars.",normal,1708,,,Rare,,Artifact
Blood Moon,{2}{R},3,R,Tom Wänerstrand,,Enchantment,Nonbasic lands are Mountains.,"DRK,CHR,8ED,9ED,MMA","Heavy light flooded across the landscape, cloaking everything in deep crimson.",normal,1784,,,Rare,,Enchantment
Blood of the Martyr,{W}{W}{W},3,W,Christopher Rush,,Instant,"Until end of turn, if damage would be dealt to any creature, you may have that damage dealt to you instead.","DRK,CHR",The willow knows what the storm does not: that the power to endure harm outlives the power to inflict it.,normal,1802,,,Uncommon,,Instant
Bog Imp,{1}{B},2,B,Ron Spencer,,Creature — Imp,Flying (This creature can't be blocked except by creatures with flying or reach.),"DRK,4ED,RQS,ITP,5ED,POR,6ED,S99,S00,7ED,8ED,9ED","On guard for larger dangers, we underestimated the power and speed of the Imp's muck-crusted claws.",normal,1730,1,1,Common,Imp,Creature
Bog Rats,{B},1,B,Ron Spencer,,Creature — Rat,Bog Rats can't be blocked by Walls.,"DRK,CHR,5ED,6ED","Their stench was vile and strong enough, but not nearly as powerful as their hunger.",normal,1731,1,1,Common,Rat,Creature
Bone Flute,{3},3,,Christopher Rush,,Artifact,"{2}, {T}: All creatures get -1/-0 until end of turn.","DRK,ME3","After the Battle of Pitdown, Lady Ursnell fashioned the first such instrument out of Lord Ursnell's left leg.",normal,1709,,,Uncommon,,Artifact
Book of Rass,{6},6,,Sandra Everingham,,Artifact,"{2}, Pay 2 life: Draw a card.","DRK,CHR,ME4",,normal,1710,,,Uncommon,,Artifact
Brainwash,{W},1,W,Pete Venters,,Enchantment — Aura,Enchant creature\nEnchanted creature can't attack unless its controller pays {3}.,"DRK,4ED,5ED","""They're not your friends; they despise you. I'm the only one you can count on. Trust me.""",normal,1803,,,Common,Aura,Enchantment
Brothers of Fire,{1}{R}{R},3,R,Mark Tedin,,Creature — Human Shaman,{1}{R}{R}: Brothers of Fire deals 1 damage to target creature or player and 1 damage to you.,"DRK,4ED,5ED,MED",Fire is never a gentle master.,normal,1785,2,2,Uncommon,"Human,Shaman",Creature
Carnivorous Plant,{3}{G},4,G,Quinton Hoover,,Creature — Plant Wall,Defender,"DRK,4ED,ATH,MED","""It had a mouth like that of a great beast, and gnashed its teeth as it strained to reach us. I am thankful it possessed no means of locomotion."" —Vervamon the Elder",normal,1765,4,5,Common,"Plant,Wall",Creature
Cave People,{1}{R}{R},3,R,Drew Tucker,,Creature — Human,"Whenever Cave People attacks, it gets +1/-2 until end of turn.\n{1}{R}{R}, {T}: Target creature gains mountainwalk until end of turn. (It can't be blocked as long as defending player controls a Mountain.)","DRK,4ED,5ED",,normal,1786,1,4,Uncommon,Human,Creature
City of Shadows,,,,Tom Wänerstrand,,Land,"{T}, Exile a creature you control: Put a storage counter on City of Shadows.\n{T}: Add {C} to your mana pool for each storage counter on City of Shadows.","DRK,ME3",,normal,1823,,,Rare,,Land
Cleansing,{W}{W}{W},3,W,Pete Venters,,Sorcery,"For each land, destroy that land unless any player pays 1 life.",DRK,,normal,1804,,,Rare,,Sorcery
Coal Golem,{5},5,R,Christopher Rush,,Artifact Creature — Golem,"{3}, Sacrifice Coal Golem: Add {R}{R}{R} to your mana pool.","DRK,ME3","""Three such creatures stood burning at the crest of the hill. Only seconds later, the Fireball struck our front line."" —Lydia, Countess Brellis",normal,1711,3,3,Uncommon,Golem,"Artifact,Creature"
Curse Artifact,{2}{B}{B},4,B,Mark Tedin,,Enchantment — Aura,"Enchant artifact\nAt the beginning of the upkeep of enchanted artifact's controller, Curse Artifact deals 2 damage to that player unless he or she sacrifices that artifact.",DRK,Voska feared the artifact had come too easily.,normal,1732,,,Uncommon,Aura,Enchantment
Dance of Many,{U}{U},2,U,Sandra Everingham,,Enchantment,"When Dance of Many enters the battlefield, put a token that's a copy of target nontoken creature onto the battlefield.\nWhen Dance of Many leaves the battlefield, exile the token.\nWhen the token leaves the battlefield, sacrifice Dance of Many.\nAt the beginning of your upkeep, sacrifice Dance of Many unless you pay {U}{U}.","DRK,CHR,5ED,ME3",,normal,1748,,,Rare,,Enchantment
Dark Heart of the Wood,{B}{G},2,"B,G",Christopher Rush,,Enchantment,Sacrifice a Forest: You gain 3 life.,"DRK,RAV","Even the Goblins shun this haunted place, where the tree limbs twist in agony and the ground seems to scuttle under your feet.",normal,1820,,,Common,,Enchantment
Dark Sphere,{0},,,Mark Tedin,,Artifact,"{T}, Sacrifice Dark Sphere: The next time a source of your choice would deal damage to you this turn, prevent half that damage, rounded down.",DRK,"""I was struck senseless for a moment, but revived when the strange curiosity I carried fell to the ground, screaming like a dying animal."" —Barl, Lord Ith",normal,1712,,,Uncommon,,Artifact
Deep Water,{U}{U},2,U,Jeff A. Menges,,Enchantment,"{U}: Until end of turn, if you tap a land you control for mana, it produces {U} instead of any other type.",DRK,,normal,1749,,,Common,,Enchantment
Diabolic Machine,{7},7,,Anson Maddocks,,Artifact Creature — Construct,{3}: Regenerate Diabolic Machine.,"DRK,4ED,5ED,ME4","""The bolts of our ballistae smashed into the monstrous thing, but our hopes died in our chests as its gears continued turning."" —Sevti Mukul, The Fall of Alsoor",normal,1713,4,4,Uncommon,Construct,"Artifact,Creature"
Drowned,{1}{U},2,"U,B",Quinton Hoover,,Creature — Zombie,{B}: Regenerate Drowned.,"DRK,ME4","We asked Captain Soll what became of the Serafina, but all he said was, ""Ships that go down shouldn't come back up.""",normal,1750,1,1,Common,Zombie,Creature
Dust to Dust,{1}{W}{W},3,W,Drew Tucker,,Sorcery,Exile two target artifacts.,"DRK,5ED,MED,ME4","Tervish never noticed that the amulet had vanished. It had disappeared not only from his possession, but from his memory as well.",normal,1805,,,Common,,Sorcery
Eater of the Dead,{4}{B},5,B,Jesper Myrfors,,Creature — Horror,"{0}: If Eater of the Dead is tapped, exile target creature card from a graveyard and untap Eater of the Dead.","DRK,MED",Even the putrid muscles of the dead can provide strength to those loathsome enough to consume them.,normal,1733,3,4,Uncommon,Horror,Creature
Electric Eel,{U},1,"U,R",Anson Maddocks,,Creature — Fish,"When Electric Eel enters the battlefield, it deals 1 damage to you.\n{R}{R}: Electric Eel gets +2/+0 until end of turn and deals 1 damage to you.",DRK,,normal,1751,1,1,Uncommon,Fish,Creature
Elves of Deep Shadow,{G},1,"G,B",Jesper Myrfors,,Creature — Elf Druid,{T}: Add {B} to your mana pool. Elves of Deep Shadow deals 1 damage to you.,"DRK,pFNM,RAV,ME3,DDJ","""They are aberrations who have turned on everything we hold sacred. Let them be cast out."" —Ailheen, Speaker of the Council",normal,1766,1,1,Uncommon,"Elf,Druid",Creature
Erosion,{U}{U}{U},3,U,Pete Venters,,Enchantment — Aura,"Enchant land\nAt the beginning of the upkeep of enchanted land's controller, destroy that land unless that player pays {1} or 1 life.","DRK,4ED",,normal,1752,,,Common,Aura,Enchantment
Eternal Flame,{2}{R}{R},4,R,Mark Poole,,Sorcery,"Eternal Flame deals X damage to target opponent, where X is the number of Mountains you control. It deals half X damage, rounded up, to you.",DRK,,normal,1787,,,Rare,,Sorcery
Exorcist,{W}{W},2,W,Drew Tucker,,Creature — Human Cleric,"{1}{W}, {T}: Destroy target black creature.","DRK,ME3","Though they often bore little greater charm than the demons they battled, exorcists were always welcome in Scarwood.",normal,1806,1,1,Rare,"Human,Cleric",Creature
Fasting,{W},1,W,Douglas Shuler,,Enchantment,"At the beginning of your upkeep, put a hunger counter on Fasting. Then destroy Fasting if it has five or more hunger counters on it.\nIf you would begin your draw step, you may skip that step instead. If you do, you gain 2 life.\nWhen you draw a card, destroy Fasting.",DRK,,normal,1807,,,Uncommon,,Enchantment
Fellwar Stone,{2},2,,Quinton Hoover,,Artifact,{T}: Add to your mana pool one mana of any color that a land an opponent controls could produce.,"DRK,4ED,5ED,9ED,ME3,CMD,C15","""What do you have that I cannot obtain?""\n—Mairsil, called the Pretender",normal,1714,,,Uncommon,,Artifact
Festival,{W},1,W,Mark Poole,,Instant,Cast Festival only during an opponent's upkeep.\nCreatures can't attack this turn.,DRK,Only after the townsfolk had drawn us into their merry celebration did we discover that their holiday rituals held a deeper purpose.,normal,1808,,,Common,,Instant
Fire and Brimstone,{3}{W}{W},5,W,Jeff A. Menges,,Instant,Fire and Brimstone deals 4 damage to target player who declared an attacking creature this turn and 4 damage to you.,DRK,,normal,1809,,,Uncommon,,Instant
Fire Drake,{1}{R}{R},3,R,Christopher Rush,,Creature — Drake,Flying\n{R}: Fire Drake gets +1/+0 until end of turn. Activate this ability only once each turn.,"DRK,CHR,5ED,ME3",,normal,1788,1,2,Uncommon,Drake,Creature
Fissure,{3}{R}{R},5,R,Douglas Shuler,,Instant,Destroy target creature or land. It can't be regenerated.,"DRK,4ED,MED","""Must not all things at the last be swallowed up in death?"" —Plato",normal,1789,,,Common,,Instant
Flood,{U},1,U,Dennis Detwiller,,Enchantment,{U}{U}: Tap target creature without flying.,"DRK,4ED,5ED,BRB","""A dash of cool water does wonders to clear a cluttered battlefield.""\n—Vibekke Ragnild, Witches and War",normal,1753,,,Uncommon,,Enchantment
Fountain of Youth,{0},,,Daniel Gelon,,Artifact,"{2}, {T}: You gain 1 life.","DRK,CHR,5ED,6ED,10E","The Fountain had stood in the town square for centuries, but only the pigeons knew its secret.",normal,1715,,,Uncommon,,Artifact
Frankenstein's Monster,{X}{B}{B},2,B,Anson Maddocks,,Creature — Zombie,"As Frankenstein's Monster enters the battlefield, exile X creature cards from your graveyard. If you can't, put Frankenstein's Monster into its owner's graveyard instead of onto the battlefield. For each creature card exiled this way, Frankenstein's Monster enters the battlefield with a +2/+0, +1/+1, or +0/+2 counter on it.",DRK,,normal,1734,0,1,Rare,Zombie,Creature
Gaea's Touch,{G}{G},2,G,Mark Poole,,Enchantment,{0}: You may put a basic Forest card from your hand onto the battlefield. Activate this ability only any time you could cast a sorcery and only once each turn.\nSacrifice Gaea's Touch: Add {G}{G} to your mana pool.,"DRK,ME3",,normal,1767,,,Common,,Enchantment
Ghost Ship,{2}{U}{U},4,U,Tom Wänerstrand,,Creature — Spirit,Flying\n{U}{U}{U}: Regenerate Ghost Ship.,"DRK,4ED,TSB","""That phantom prow split the storm as lightning cast its long shadow on the battlefield below."" —Mireille Gaetane, The Valeriad",normal,1754,2,4,Common,Spirit,Creature
Giant Shark,{5}{U},6,U,Tom Wänerstrand,,Creature — Fish,"Giant Shark can't attack unless defending player controls an Island.\nWhenever Giant Shark blocks or becomes blocked by a creature that has been dealt damage this turn, Giant Shark gets +2/+0 and gains trample until end of turn.\nWhen you control no Islands, sacrifice Giant Shark.",DRK,,normal,1755,4,4,Common,Fish,Creature
Goblin Caves,{1}{R}{R},3,R,Drew Tucker,,Enchantment — Aura,"Enchant land\nAs long as enchanted land is a basic Mountain, Goblin creatures get +0/+2.","DRK,ME4",The stench of countless generations of unspeakable activities was enough to loosen both our footing and our stomachs.,normal,1790,,,Common,Aura,Enchantment
Goblin Digging Team,{R},1,R,Ron Spencer,,Creature — Goblin,"{T}, Sacrifice Goblin Digging Team: Destroy target Wall.","DRK,CHR,5ED,ATH,6ED,7ED","""From down here we can make the whole wall collapse!"" ""Uh, yeah, boss, but how do we get out?""",normal,1791,1,1,Common,Goblin,Creature
Goblin Hero,{2}{R},3,R,Mark Tedin,,Creature — Goblin,,"DRK,5ED,ATH,6ED,S99,S00","They attacked in an orgy of rage and madness, but only one seemed as focused on killing us as on the sheer joy of battle.",normal,1792,2,2,Common,Goblin,Creature
Goblin Rock Sled,{1}{R},2,R,Dennis Detwiller,,Creature — Goblin,Trample\nGoblin Rock Sled doesn't untap during your untap step if it attacked during your last turn.\nGoblin Rock Sled can't attack unless defending player controls a Mountain.,"DRK,4ED",,normal,1793,3,1,Common,Goblin,Creature
Goblin Shrine,{1}{R}{R},3,R,Ron Spencer,,Enchantment — Aura,"Enchant land\nAs long as enchanted land is a basic Mountain, Goblin creatures get +1/+0.\nWhen Goblin Shrine leaves the battlefield, it deals 1 damage to each Goblin creature.","DRK,CHR,ME4","""I knew it weren't no ordinary pile of—you know."" —Norin the Wary",normal,1794,,,Common,Aura,Enchantment
Goblin Wizard,{2}{R}{R},4,R,Daniel Gelon,,Creature — Goblin Wizard,{T}: You may put a Goblin permanent card from your hand onto the battlefield.\n{R}: Target Goblin gains protection from white until end of turn.,"DRK,MED",,normal,1795,1,1,Rare,"Goblin,Wizard",Creature
Goblins of the Flarg,{R},1,R,Tom Wänerstrand,,Creature — Goblin Warrior,"Mountainwalk (This creature can't be blocked as long as defending player controls a Mountain.)\nWhen you control a Dwarf, sacrifice Goblins of the Flarg.","DRK,CHR,MED",,normal,1796,1,1,Common,"Goblin,Warrior",Creature
Grave Robbers,{1}{B}{B},3,B,Quinton Hoover,,Creature — Human Rogue,"{B}, {T}: Exile target artifact card from a graveyard. You gain 2 life.",DRK,"""If you don't have your health, you don't have anything."" —Proverb",normal,1735,1,1,Rare,"Human,Rogue",Creature
Hidden Path,{2}{G}{G}{G}{G},6,G,Rob Alexander,,Enchantment,Green creatures have forestwalk. (They can't be blocked as long as defending player controls a Forest.),DRK,"""Where moments before we were lost beyond hope, the strange, floating lights showed us the way and restored our morale."" —Vervamon the Elder",normal,1768,,,Rare,,Enchantment
Holy Light,{2}{W},3,W,Drew Tucker,,Instant,Nonwhite creatures get -1/-1 until end of turn.,"DRK,MED","""Bathed in hallowed light, the infidels looked upon the impurities of their souls and despaired."" —The Book of Tal",normal,1810,,,Common,,Instant
Inferno,{5}{R}{R},7,R,Randy Asplund-Faith,,Instant,Inferno deals 6 damage to each creature and each player.,"DRK,4ED,5ED,6ED,7ED,8ED","""Any scrap of compassion that still existed in my soul was permanently snuffed out when they cast me out into the flames."" —Mairsil, called the Pretender",normal,1797,,,Rare,,Instant
Inquisition,{2}{B},3,B,Anson Maddocks,,Sorcery,Target player reveals his or her hand. Inquisition deals damage to that player equal to the number of white cards in his or her hand.,DRK,Many of those entrusted to Primata Delphine's care tended to express themselves with screams.,normal,1736,,,Common,,Sorcery
Knights of Thorn,{3}{W},4,W,Christopher Rush,,Creature — Human Knight,"Protection from red; banding (Any creatures with banding, and up to one without, can attack in a band. Bands are blocked as a group. If any creatures with banding you control are blocking or being blocked by a creature, you divide that creature's combat damage, not its controller, among any of the creatures it's being blocked by or is blocking.)","DRK,MED","""With a great cry, the Goblin host broke and ran as the first wave of Knights penetrated its ranks."" —Tivadar of Thorn, History of the Goblin Wars",normal,1811,2,2,Rare,"Human,Knight",Creature
Land Leeches,{1}{G}{G},3,G,Quinton Hoover,,Creature — Leech,First strike,"DRK,4ED","""The standard cure for leeches requires the application of burning embers. Alternative methods must be devised should an ember of sufficient size prove more harmful than the leech."" —Vervamon the Elder",normal,1769,2,2,Common,Leech,Creature
Leviathan,{5}{U}{U}{U}{U},9,U,Mark Tedin,,Creature — Leviathan,"Trample\nLeviathan enters the battlefield tapped and doesn't untap during your untap step.\nAt the beginning of your upkeep, you may sacrifice two Islands. If you do, untap Leviathan.\nLeviathan can't attack unless you sacrifice two Islands. (This cost is paid as attackers are declared.)","DRK,4ED,5ED,BTD,TSB",,normal,1756,10,10,Rare,Leviathan,Creature
Living Armor,{4},4,,Anson Maddocks,,Artifact,"{T}, Sacrifice Living Armor: Put X +0/+1 counters on target creature, where X is that creature's converted mana cost.","DRK,CHR","Though it affords excellent protection, few don this armor. The process is uncomfortable and not easily reversed.",normal,1716,,,Uncommon,,Artifact
Lurker,{2}{G},3,G,Anson Maddocks,,Creature — Beast,Lurker can't be the target of spells unless it attacked or blocked this turn.,DRK,"""Each night we felt it watching us from the darkness beyond our fire. We only had one pack horse left.""\n—Maeveen O'Donagh, Memoirs of a Soldier",normal,1770,2,3,Rare,Beast,Creature
Mana Clash,{R},1,R,Mark Tedin,,Sorcery,You and target opponent each flip a coin. Mana Clash deals 1 damage to each player whose coin comes up tails. Repeat this process until both players' coins come up heads on the same flip.,"DRK,4ED,5ED,7ED,8ED,9ED",,normal,1798,,,Rare,,Sorcery
Mana Vortex,{1}{U}{U},3,U,Douglas Shuler,,Enchantment,"When you cast Mana Vortex, counter it unless you sacrifice a land.\nAt the beginning of each player's upkeep, that player sacrifices a land.\nWhen there are no lands on the battlefield, sacrifice Mana Vortex.","DRK,ME3",,normal,1757,,,Rare,,Enchantment
Marsh Gas,{B},1,B,Douglas Shuler,,Instant,All creatures get -2/-0 until end of turn.,"DRK,4ED","""Comes right outta th' ground. If ya can smell it, it's too late."" —Keevy Bogsbury",normal,1737,,,Common,,Instant
Marsh Goblins,{B}{R},2,"B,R",Quinton Hoover,,Creature — Goblin,Swampwalk (This creature can't be blocked as long as defending player controls a Swamp.),DRK,"Even the other Goblin races shun the Marsh Goblins, thanks to certain unwholesome customs they practice.",normal,1821,1,1,Common,Goblin,Creature
Marsh Viper,{3}{G},4,G,Ron Spencer,,Creature — Snake,"Whenever Marsh Viper deals damage to a player, that player gets two poison counters. (A player with ten or more poison counters loses the game.)","DRK,4ED,5ED","""All we had left were their black and bloated bodies."" —Maeveen O'Donagh, Memoirs of a Soldier",normal,1771,1,2,Common,Snake,Creature
Martyr's Cry,{W}{W},2,W,Jeff A. Menges,,Sorcery,"Exile all white creatures. For each creature exiled this way, its controller draws a card.","DRK,ME4","""It is only fitting that one such as I should die in pursuit of knowledge."" —Vervamon the Elder",normal,1812,,,Rare,,Sorcery
Maze of Ith,,,,Anson Maddocks,,Land,{T}: Untap target attacking creature. Prevent all combat damage that would be dealt to and dealt by that creature this turn.,"DRK,pJGP,ME4,V12,EMA",,normal,1824,,,Uncommon,,Land
Merfolk Assassin,{U}{U},2,U,Dennis Detwiller,,Creature — Merfolk Assassin,{T}: Destroy target creature with islandwalk.,"DRK,TSB",,normal,1758,1,2,Uncommon,"Merfolk,Assassin",Creature
Mind Bomb,{U},1,U,Mark Tedin,,Sorcery,Each player may discard up to three cards. Mind Bomb deals damage to each player equal to 3 minus the number of cards he or she discarded this way.,"DRK,4ED,5ED",,normal,1759,,,Rare,,Sorcery
Miracle Worker,{W},1,W,Ron Spencer,,Creature — Human Cleric,{T}: Destroy target Aura attached to a creature you control.,DRK,"""Those blessed hands could bring surcease to even the most tainted soul."" —Sister Betje, Miracles of the Saints",normal,1813,1,1,Common,"Human,Cleric",Creature
Morale,{1}{W}{W},3,W,Mark Poole,,Instant,Attacking creatures get +1/+1 until end of turn.,"DRK,4ED","""After Lacjsi's speech, the Knights grew determined to crush their ancient enemies clan by clan."" —Tivadar of Thorn, History of the Goblin Wars",normal,1814,,,Common,,Instant
Murk Dwellers,{3}{B},4,B,Drew Tucker,,Creature — Zombie,"Whenever Murk Dwellers attacks and isn't blocked, it gets +2/+0 until end of combat.","DRK,4ED,RQS,ITP,5ED","When Raganorn unsealed the catacombs, he found more than the dead and their treasures.",normal,1738,2,2,Common,Zombie,Creature
Nameless Race,{3}{B},4,B,Quinton Hoover,,Creature,"Trample\nAs Nameless Race enters the battlefield, pay any amount of life. The amount you pay can't be more than the total number of white nontoken permanents your opponents control plus the total number of white cards in their graveyards.\nNameless Race's power and toughness are each equal to the life paid as it entered the battlefield.",DRK,,normal,1739,*,*,Rare,,Creature
Necropolis,{5},5,,NéNé Thomas,,Artifact Creature — Wall,"Defender (This creature can't attack.)\nExile a creature card from your graveyard: Put X +0/+1 counters on Necropolis, where X is the exiled card's converted mana cost.",DRK,,normal,1717,0,1,Uncommon,Wall,"Artifact,Creature"
Niall Silvain,{G}{G}{G},3,G,Christopher Rush,,Creature — Ouphe,"{G}{G}{G}{G}, {T}: Regenerate target creature.",DRK,"This is his domain, and while you remain here you must value all life as you value your own.",normal,1772,2,2,Rare,Ouphe,Creature
Orc General,{2}{R},3,R,Jesper Myrfors,,Creature — Orc Warrior,"{T}, Sacrifice another Orc or Goblin: Other Orc creatures get +1/+1 until end of turn.","DRK,ME2","""Your army must fear you more than the enemy. Only then will you triumph."" —Malga Phlegmtooth",normal,1799,2,2,Uncommon,"Orc,Warrior",Creature
People of the Woods,{G}{G},2,G,Drew Tucker,,Creature — Human,People of the Woods's toughness is equal to the number of Forests you control.,DRK,"""Their rain of arrows left only myself alive, cowering within a tree hollow. They did not even come out to loot the bodies."" —Vervamon the Elder",normal,1773,1,*,Uncommon,Human,Creature
Pikemen,{1}{W},2,W,Dennis Detwiller,,Creature — Human Soldier,"First strike; banding (Any creatures with banding, and up to one without, can attack in a band. Bands are blocked as a group. If any creatures with banding you control are blocking or being blocked by a creature, you divide that creature's combat damage, not its controller, among any of the creatures it's being blocked by or is blocking.)","DRK,4ED,5ED","""As the cavalry bore down, we faced them with swords drawn and pikes hidden in the grass at our feet. ‘Don't lift your pikes 'til I give the word,' I said."" —Maeveen O'Donagh, Memoirs of a Soldier",normal,1815,1,1,Common,"Human,Soldier",Creature
Preacher,{1}{W}{W},3,W,Quinton Hoover,,Creature — Human Cleric,"You may choose not to untap Preacher during your untap step.\n{T}: For as long as Preacher remains tapped, gain control of target creature of an opponent's choice he or she controls.","DRK,MED",,normal,1816,1,1,Rare,"Human,Cleric",Creature
Psychic Allergy,{3}{U}{U},5,U,Mark Tedin,,Enchantment,"As Psychic Allergy enters the battlefield, choose a color.\nAt the beginning of each opponent's upkeep, Psychic Allergy deals X damage to that player, where X is the number of nontoken permanents of the chosen color he or she controls.\nAt the beginning of your upkeep, destroy Psychic Allergy unless you sacrifice two Islands.",DRK,,normal,1760,,,Rare,,Enchantment
Rag Man,{2}{B}{B},4,B,Daniel Gelon,,Creature — Human Minion,"{B}{B}{B}, {T}: Target opponent reveals his or her hand and discards a creature card at random. Activate this ability only during your turn.","DRK,4ED,5ED,6ED,7ED","""Aw, he's just a silly, dirty little man. What's to be afraid of?""",normal,1740,2,1,Rare,"Human,Minion",Creature
Reflecting Mirror,{4},4,,Mark Poole,,Artifact,"{X}, {T}: Change the target of target spell with a single target if that target is you. The new target must be a player. X is twice the converted mana cost of that spell.",DRK,,normal,1718,,,Uncommon,,Artifact
Riptide,{U},1,U,Randy Asplund-Faith,,Instant,Tap all blue creatures.,DRK,,normal,1761,,,Common,,Instant
