name,manaCost,cmc,colorIdentity,artist,number,type,text,printings,flavor,layout,multiverseid,power,toughness,rarity,subtypes,types
Rakish Heir,{2}{R},3,R,Winona Nelson,158,Creature — Vampire,"Whenever a Vampire you control deals combat damage to a player, put a +1/+1 counter on it.",ISD,"""If you're not having fun, what's the point of living forever?""",normal,234441,2,2,Uncommon,Vampire,Creature
Reckless Waif,{R},1,R,Michael C. Hayes,159a,Creature — Human Rogue Werewolf,"At the beginning of each upkeep, if no spells were cast last turn, transform Reckless Waif.",ISD,"""Yes, I'm alone. No, I'm not worried.""",double-faced,222111,1,1,Uncommon,"Human,Rogue,Werewolf",Creature
Merciless Predator,,1,R,Michael C. Hayes,159b,Creature — Werewolf,"At the beginning of each upkeep, if a player cast two or more spells last turn, transform Merciless Predator.",ISD,Before she just wanted to snatch your purse; now she'll take the whole arm.,double-faced,222115,3,2,Uncommon,Werewolf,Creature
Riot Devils,{2}{R},3,R,Svetlin Velinov,160,Creature — Devil,,ISD,"Devils are demons' unearthly desires made flesh. Let loose on the world, they satisfy their mad craving for destruction in a whirlwind of chaos.",normal,220648,2,3,Common,Devil,Creature
Rolling Temblor,{2}{R},3,R,Cliff Childs,161,Sorcery,Rolling Temblor deals 2 damage to each creature without flying.\nFlashback {4}{R}{R} (You may cast this card from your graveyard for its flashback cost. Then exile it.),ISD,"When demons open a path to your front door, it's time to move.",normal,249660,,,Uncommon,,Sorcery
Scourge of Geier Reach,{3}{R}{R},5,R,Jung Park,162,Creature — Elemental,Scourge of Geier Reach gets +1/+1 for each creature your opponents control.,ISD,Stensian villagers mourned the loss of human life. Thraben vampire slayers mourned the loss of living wood.,normal,227077,3,3,Uncommon,Elemental,Creature
Skirsdag Cultist,{2}{R}{R},4,R,Slawomir Maniak,163,Creature — Human Shaman,"{R}, {T}, Sacrifice a creature: Skirsdag Cultist deals 2 damage to target creature or player.","ISD,DDK","""Within blood is life. Within life is fire. Within fire is the path to our masters' glory!""",normal,220638,2,2,Uncommon,"Human,Shaman",Creature
Stromkirk Noble,{R},1,R,James Ryman,164,Creature — Vampire,"Stromkirk Noble can't be blocked by Humans.\nWhenever Stromkirk Noble deals combat damage to a player, put a +1/+1 counter on it.",ISD,"""A responsible king walks among his subjects.""",normal,230783,1,1,Rare,Vampire,Creature
Tormented Pariah,{3}{R},4,R,Bud Cook,165a,Creature — Human Warrior Werewolf,"At the beginning of each upkeep, if no spells were cast last turn, transform Tormented Pariah.",ISD,"""Hey lads, the moon's rising. All the better to watch him beg for mercy.""",double-faced,222186,3,2,Common,"Human,Warrior,Werewolf",Creature
Rampaging Werewolf,,4,R,Bud Cook,165b,Creature — Werewolf,"At the beginning of each upkeep, if a player cast two or more spells last turn, transform Rampaging Werewolf.",ISD,"""Just look at him, groveling on all fours! What a pathetic—uh-oh.""",double-faced,222117,6,4,Common,Werewolf,Creature
Traitorous Blood,{1}{R}{R},3,R,Raymond Swanland,166,Sorcery,Gain control of target creature until end of turn. Untap it. It gains trample and haste until end of turn.,ISD,"""I can make you dance to my tune like a puppet, your very blood eager to obey.""\n—Olivia Voldaren",normal,234438,,,Common,,Sorcery
Vampiric Fury,{1}{R},2,R,Matt Stewart,167,Instant,Vampire creatures you control get +2/+0 and gain first strike until end of turn.,ISD,Many peasants secretly admire vampires' glamour and elegance—until they witness a moment of pure bloodlust.,normal,247424,,,Common,,Instant
Village Ironsmith,{1}{R},2,R,Christopher Moeller,168a,Creature — Human Werewolf,"First strike\nAt the beginning of each upkeep, if no spells were cast last turn, transform Village Ironsmith.",ISD,"Each night, he abandons the trappings of civilization.",double-faced,222112,1,1,Common,"Human,Werewolf",Creature
Ironfang,,2,R,Christopher Moeller,168b,Creature — Werewolf,"First strike\nAt the beginning of each upkeep, if a player cast two or more spells last turn, transform Ironfang.",ISD,"Each morning, he repairs the front door.",double-faced,222107,3,1,Common,Werewolf,Creature
Ambush Viper,{1}{G},2,G,Alan Pollack,169,Creature — Snake,Flash (You may cast this spell any time you could cast an instant.)\nDeathtouch (Any amount of damage this deals to a creature is enough to destroy it.),ISD,"""Living creatures seldom impress me. But I like this one.""\n—Uta Falkenrath",normal,220644,2,1,Common,Snake,Creature
Avacyn's Pilgrim,{G},1,"G,W",Jana Schirmer & Johannes Voss,170,Creature — Human Monk,{T}: Add {W} to your mana pool.,"pFNM,ISD","""Avacyn's protection is everywhere. From the holy church to the sacred glade, all that we see is under her blessed watch.""",normal,243212,1,1,Common,"Human,Monk",Creature
Boneyard Wurm,{1}{G},2,G,Jaime Jones,171,Creature — Wurm,Boneyard Wurm's power and toughness are each equal to the number of creature cards in your graveyard.,"pWPN,ISD,DDJ",The only thing it likes more than discovering a pit of bones is adding to it.,normal,220050,*,*,Uncommon,Wurm,Creature
Bramblecrush,{2}{G}{G},4,G,Drew Baker,172,Sorcery,Destroy target noncreature permanent.,"ISD,M14","""Civilization is fertilizer.""\n—Garruk Wildspeaker",normal,227095,,,Uncommon,,Sorcery
Caravan Vigil,{G},1,G,Drew Baker,173,Sorcery,"Search your library for a basic land card, reveal it, put it into your hand, then shuffle your library.\nMorbid — You may put that card onto the battlefield instead of putting it into your hand if a creature died this turn.",ISD,,normal,234444,,,Common,,Sorcery
Creeping Renaissance,{3}{G}{G},5,G,Tomasz Jedruszek,174,Sorcery,Choose a permanent type. Return all cards of the chosen type from your graveyard to your hand.\nFlashback {5}{G}{G} (You may cast this card from your graveyard for its flashback cost. Then exile it.),ISD,,normal,245198,,,Rare,,Sorcery
Darkthicket Wolf,{1}{G},2,G,Wayne England,175,Creature — Wolf,{2}{G}: Darkthicket Wolf gets +2/+2 until end of turn. Activate this ability only once each turn.,ISD,"Werewolf slayers don't know for certain how werewolves are created. So they kill all the wolves, just to be safe.",normal,241986,2,2,Common,Wolf,Creature
Daybreak Ranger,{2}{G},3,"G,R",Steve Prescott,176a,Creature — Human Archer Werewolf,"{T}: Daybreak Ranger deals 2 damage to target creature with flying.\nAt the beginning of each upkeep, if no spells were cast last turn, transform Daybreak Ranger.",ISD,,double-faced,222118,2,2,Rare,"Human,Archer,Werewolf",Creature
Nightfall Predator,,3,"G,R",Steve Prescott,176b,Creature — Werewolf,"{R}, {T}: Nightfall Predator fights target creature. (Each deals damage equal to its power to the other.)\nAt the beginning of each upkeep, if a player cast two or more spells last turn, transform Nightfall Predator.",ISD,,double-faced,222114,4,4,Rare,Werewolf,Creature
Elder of Laurels,{2}{G},3,G,Terese Nielsen,177,Creature — Human Advisor,"{3}{G}: Target creature gets +X/+X until end of turn, where X is the number of creatures you control.",ISD,Hopes and prayers can carry the same force as swords and torches.,normal,247418,2,3,Rare,"Human,Advisor",Creature
Essence of the Wild,{3}{G}{G}{G},6,G,Terese Nielsen,178,Creature — Avatar,Creatures you control enter the battlefield as a copy of Essence of the Wild.,ISD,Wander too far into the wild and it may take you for its own.,normal,254133,6,6,Mythic Rare,Avatar,Creature
Festerhide Boar,{3}{G},4,G,Nils Hamm,179,Creature — Boar,Trample\nMorbid — Festerhide Boar enters the battlefield with two +1/+1 counters on it if a creature died this turn.,"ISD,DDM","""Bury your dead deep. The boars are hungriest while the corpse is still warm.""\n—Paulin, trapper of Somberwald",normal,233250,3,3,Common,Boar,Creature
Full Moon's Rise,{1}{G},2,G,Terese Nielsen,180,Enchantment,Werewolf creatures you control get +1/+0 and have trample.\nSacrifice Full Moon's Rise: Regenerate all Werewolf creatures you control.,ISD,Some lycanthropes wish they could abandon their weak human shapes and revel in the power of the wolf.,normal,241981,,,Uncommon,,Enchantment
Garruk Relentless,{3}{G},4,"B,G",Eric Deschamps,181a,Planeswalker — Garruk,"When Garruk Relentless has two or fewer loyalty counters on him, transform him.\n0: Garruk Relentless deals 3 damage to target creature. That creature deals damage equal to its power to him.\n0: Put a 2/2 green Wolf creature token onto the battlefield.",ISD,,double-faced,245250,,,Mythic Rare,Garruk,Planeswalker
"Garruk, the Veil-Cursed",,4,"B,G",Eric Deschamps,181b,Planeswalker — Garruk,"+1: Put a 1/1 black Wolf creature token with deathtouch onto the battlefield.\n−1: Sacrifice a creature. If you do, search your library for a creature card, reveal it, put it into your hand, then shuffle your library.\n−3: Creatures you control gain trample and get +X/+X until end of turn, where X is the number of creature cards in your graveyard.",ISD,,double-faced,245251,,,Mythic Rare,Garruk,Planeswalker
Gatstaf Shepherd,{1}{G},2,G,Mark Evans,182a,Creature — Human Werewolf,"At the beginning of each upkeep, if no spells were cast last turn, transform Gatstaf Shepherd.",ISD,"""What is worse than a wolf in sheep's clothing?""\n—Wolfhunter's riddle",double-faced,227409,2,2,Uncommon,"Human,Werewolf",Creature
Gatstaf Howler,,2,G,Mark Evans,182b,Creature — Werewolf,"Intimidate (This creature can't be blocked except by artifact creatures and/or creatures that share a color with it.)\nAt the beginning of each upkeep, if a player cast two or more spells last turn, transform Gatstaf Howler.",ISD,,double-faced,227290,3,3,Uncommon,Werewolf,Creature
Gnaw to the Bone,{2}{G},3,G,Scott Chou,183,Instant,You gain 2 life for each creature card in your graveyard.\nFlashback {2}{G} (You may cast this card from your graveyard for its flashback cost. Then exile it.),ISD,,normal,247420,,,Common,,Instant
Grave Bramble,{1}{G}{G},3,G,Anthony Jones,184,Creature — Plant,"Defender, protection from Zombies",ISD,Nature abhors a zombie.,normal,229964,3,4,Common,Plant,Creature
Grizzled Outcasts,{4}{G},5,G,Randy Gallegos,185a,Creature — Human Werewolf,"At the beginning of each upkeep, if no spells were cast last turn, transform Grizzled Outcasts.",ISD,"Seen as unsavory, the hunters were never allowed in town—until one night they vanished.",double-faced,222124,4,4,Common,"Human,Werewolf",Creature
Krallenhorde Wantons,,5,G,Randy Gallegos,185b,Creature — Werewolf,"At the beginning of each upkeep, if a player cast two or more spells last turn, transform Krallenhorde Wantons.",ISD,"The boot prints became paw prints, and they led right back into town.",double-faced,222123,7,7,Common,Werewolf,Creature
Gutter Grime,{4}{G},5,G,Erica Yang,186,Enchantment,"Whenever a nontoken creature you control dies, put a slime counter on Gutter Grime, then put a green Ooze creature token onto the battlefield with ""This creature's power and toughness are each equal to the number of slime counters on Gutter Grime.""",ISD,,normal,234849,,,Rare,,Enchantment
Hamlet Captain,{1}{G},2,G,Wayne Reynolds,187,Creature — Human Warrior,"Whenever Hamlet Captain attacks or blocks, other Human creatures you control get +1/+1 until end of turn.",ISD,"""I would fear this fight, bloodsucker, were I alone.""",normal,234446,2,2,Uncommon,"Human,Warrior",Creature
Hollowhenge Scavenger,{3}{G}{G},5,G,Slawomir Maniak,188,Creature — Elemental,"Morbid — When Hollowhenge Scavenger enters the battlefield, if a creature died this turn, you gain 5 life.",ISD,"After werewolves slaughtered the citizenry of Hollowhenge, other creatures moved in.",normal,226883,4,5,Uncommon,Elemental,Creature
Kessig Cagebreakers,{4}{G},5,G,Wayne England,189,Creature — Human Rogue,"Whenever Kessig Cagebreakers attacks, put a 2/2 green Wolf creature token onto the battlefield tapped and attacking for each creature card in your graveyard.","ISD,C15","""They put bars on these noble beasts and then wonder why werewolves target our towns.""",normal,249868,3,4,Rare,"Human,Rogue",Creature
Kindercatch,{3}{G}{G}{G},6,G,Terese Nielsen,190,Creature — Spirit,,ISD,"In the forest villages of Kessig, parents feed their children wormwood and other bitter herbs, hoping to make them less palatable to things that roam the night.",normal,227088,6,6,Common,Spirit,Creature
Lumberknot,{2}{G}{G},4,G,Jason A. Engle,191,Creature — Treefolk,"Hexproof (This creature can't be the target of spells or abilities your opponents control.)\nWhenever a creature dies, put a +1/+1 counter on Lumberknot.","ISD,PC2","Animated by geists fused in its oak, it hungers for more life to add to its core.",normal,230624,1,1,Uncommon,Treefolk,Creature
Make a Wish,{3}{G},4,G,Howard Lyon,192,Sorcery,Return two cards at random from your graveyard to your hand.,ISD,"In Gavony wishing is taken as a sign of weakness, yet the wells usually brim with silver.",normal,222193,,,Uncommon,,Sorcery
Mayor of Avabruck,{1}{G},2,G,Svetlin Velinov,193a,Creature — Human Advisor Werewolf,"Other Human creatures you control get +1/+1.\nAt the beginning of each upkeep, if no spells were cast last turn, transform Mayor of Avabruck.","pPRE,ISD",He can deny his true nature for only so long.,double-faced,222189,1,1,Rare,"Human,Advisor,Werewolf",Creature
Howlpack Alpha,,2,G,Svetlin Velinov,193b,Creature — Werewolf,"Each other creature you control that's a Werewolf or a Wolf gets +1/+1.\nAt the beginning of your end step, put a 2/2 green Wolf creature token onto the battlefield.\nAt the beginning of each upkeep, if a player cast two or more spells last turn, transform Howlpack Alpha.","pPRE,ISD",,double-faced,222183,3,3,Rare,Werewolf,Creature
Moldgraf Monstrosity,{4}{G}{G}{G},7,G,Tomasz Jedruszek,194,Creature — Insect,"Trample\nWhen Moldgraf Monstrosity dies, exile it, then return two creature cards at random from your graveyard to the battlefield.",ISD,The border between life and death is as thin as a layer of topsoil.,normal,249664,8,8,Rare,Insect,Creature
Moonmist,{1}{G},2,G,Ryan Yee,195,Instant,Transform all Humans. Prevent all combat damage that would be dealt this turn by creatures other than Werewolves and Wolves. (Only double-faced cards can be transformed.),ISD,,normal,222933,,,Common,,Instant
Mulch,{1}{G},2,G,Christopher Moeller,196,Sorcery,Reveal the top four cards of your library. Put all land cards revealed this way into your hand and the rest into your graveyard.,"STH,ISD,TPR,C15",The land knows no difference between the graves of commoners and nobles.,normal,237012,,,Common,,Sorcery
Naturalize,{1}{G},2,G,Scott Chou,197,Instant,Destroy target artifact or enchantment.,"ONS,8ED,9ED,10E,ALA,M10,ROE,DPA,M11,M12,ISD,M13,GTC,M14,M15,KTK,DTK","""Stone and thought fade into ruin. Only the wind in the leaves will endure.""\n—Tomb inscription",normal,237015,,,Common,,Instant
Orchard Spirit,{2}{G},3,G,Howard Lyon,198,Creature — Spirit,Orchard Spirit can't be blocked except by creatures with flying or reach.,"ISD,ORI","""Pick not the rotten fruit, but neither touch the best. Leave those as an offering for our unseen guests.""\n—Radwick, farmer of Gatstaf",normal,234855,2,2,Common,Spirit,Creature
Parallel Lives,{3}{G},4,G,Steve Prescott,199,Enchantment,"If an effect would put one or more tokens onto the battlefield under your control, it puts twice that many of those tokens onto the battlefield instead.",ISD,"""There will come a time when the only prey left will be each other.""\n—Ulrich of Krallenhorde Pack",normal,249662,,,Rare,,Enchantment
Prey Upon,{G},1,G,Dave Kendall,200,Sorcery,Target creature you control fights target creature you don't control. (Each deals damage equal to its power to the other.),"ISD,M13,DDL","""You don't find many old werewolf hunters.""\n—Paulin, trapper of Somberwald",normal,220383,,,Common,,Sorcery
Ranger's Guile,{G},1,G,Steve Prescott,201,Instant,Target creature you control gets +1/+1 and gains hexproof until end of turn. (It can't be the target of spells or abilities your opponents control.),"ISD,M14,M15","In the remote corners of Kessig, protection is found in secret powers unknown to the Church of Avacyn.",normal,249973,,,Common,,Instant
Somberwald Spider,{4}{G},5,G,Volkan Baga,202,Creature — Spider,Reach (This creature can block creatures with flying.)\nMorbid — Somberwald Spider enters the battlefield with two +1/+1 counters on it if a creature died this turn.,ISD,Stensian vampires encourage spiders near their manors so they can rob the webs.,normal,237013,2,4,Common,Spider,Creature
Spider Spawning,{4}{G},5,"G,B",Daniel Ljunggren,203,Sorcery,Put a 1/2 green Spider creature token with reach onto the battlefield for each creature card in your graveyard.\nFlashback {6}{B} (You may cast this card from your graveyard for its flashback cost. Then exile it.),"ISD,C15",,normal,222175,,,Uncommon,,Sorcery
Spidery Grasp,{2}{G},3,G,James Ryman,204,Instant,Untap target creature. It gets +2/+4 and gains reach until end of turn. (It can block creatures with flying.),ISD,"""Nobody's seen the Lady of Videns for years. Poor dear, no companions at all in that old castle.""\n—Yonda of Gavony",normal,244686,,,Common,,Instant
Splinterfright,{2}{G},3,G,Eric Deschamps,205,Creature — Elemental,"Trample\nSplinterfright's power and toughness are each equal to the number of creature cards in your graveyard.\nAt the beginning of your upkeep, put the top two cards of your library into your graveyard.",ISD,,normal,227301,*,*,Rare,Elemental,Creature
Travel Preparations,{1}{G},2,"G,W",Vincent Proce,206,Sorcery,Put a +1/+1 counter on each of up to two target creatures.\nFlashback {1}{W} (You may cast this card from your graveyard for its flashback cost. Then exile it.),ISD,Visiting a shrine at the start of a journey makes the traveler more likely to finish it.,normal,220026,,,Common,,Sorcery
Tree of Redemption,{3}{G},4,G,Vincent Proce,207,Creature — Plant,Defender\n{T}: Exchange your life total with Tree of Redemption's toughness.,ISD,The executioner's tree in Thraben Cathedral holds the power to absolve more than the souls of the hanged.,normal,247421,0,13,Mythic Rare,Plant,Creature
Ulvenwald Mystics,{2}{G}{G},4,G,Dan Scott,208a,Creature — Human Shaman Werewolf,"At the beginning of each upkeep, if no spells were cast last turn, transform Ulvenwald Mystics.",ISD,"""With this ritual, we cast aside our fragile humanity . . .""",double-faced,222105,3,3,Uncommon,"Human,Shaman,Werewolf",Creature
Ulvenwald Primordials,,4,G,Dan Scott,208b,Creature — Werewolf,"{G}: Regenerate Ulvenwald Primordials.\nAt the beginning of each upkeep, if a player cast two or more spells last turn, transform Ulvenwald Primordials.",ISD,""". . . and embrace the ancient ferocity of the undying Wild.""",double-faced,222108,5,5,Uncommon,Werewolf,Creature
Villagers of Estwald,{2}{G},3,G,Kev Walker,209a,Creature — Human Werewolf,"At the beginning of each upkeep, if no spells were cast last turn, transform Villagers of Estwald.",ISD,You can spot a werewolf-infested town by its lack of butcher shops.,double-faced,222915,2,3,Common,"Human,Werewolf",Creature
Howlpack of Estwald,,3,G,Kev Walker,209b,Creature — Werewolf,"At the beginning of each upkeep, if a player cast two or more spells last turn, transform Howlpack of Estwald.",ISD,Estwald's citizens don't dislike outsiders—they taste just fine.,double-faced,222906,4,6,Common,Werewolf,Creature
Woodland Sleuth,{3}{G},4,G,Tomasz Jedruszek,210,Creature — Human Scout,"Morbid — When Woodland Sleuth enters the battlefield, if a creature died this turn, return a creature card at random from your graveyard to your hand.",ISD,"""Whatever did this is near. Death reversion has not yet occurred. Be alert!""",normal,220654,2,3,Common,"Human,Scout",Creature
Wreath of Geists,{G},1,G,Jason A. Engle,211,Enchantment — Aura,"Enchant creature\nEnchanted creature gets +X/+X, where X is the number of creature cards in your graveyard.",ISD,"Before you travel the woods of Kessig, first get permission from those who died trying.",normal,237017,,,Uncommon,Aura,Enchantment
Evil Twin,{2}{U}{B},4,"U,B",Greg Staples,212,Creature — Shapeshifter,"You may have Evil Twin enter the battlefield as a copy of any creature on the battlefield except it gains ""{U}{B}, {T}: Destroy target creature with the same name as this creature.""",ISD,You can always tell the evil one by the dagger he's sticking in you.,normal,229965,0,0,Rare,Shapeshifter,Creature
Geist of Saint Traft,{1}{W}{U},3,"W,U",Igor Kieryluk,213,Legendary Creature — Spirit Cleric,"Hexproof (This creature can't be the target of spells or abilities your opponents control.)\nWhenever Geist of Saint Traft attacks, put a 4/4 white Angel creature token with flying onto the battlefield tapped and attacking. Exile that token at end of combat.","ISD,pWCQ,DDQ",,normal,247236,2,2,Mythic Rare,"Spirit,Cleric",Creature
"Grimgrin, Corpse-Born",{3}{U}{B},5,"U,B",Peter Mohrbacher,214,Legendary Creature — Zombie Warrior,"Grimgrin, Corpse-Born enters the battlefield tapped and doesn't untap during your untap step.\nSacrifice another creature: Untap Grimgrin and put a +1/+1 counter on it.\nWhenever Grimgrin attacks, destroy target creature defending player controls, then put a +1/+1 counter on Grimgrin.",ISD,,normal,247237,5,5,Mythic Rare,"Zombie,Warrior",Creature
Olivia Voldaren,{2}{B}{R},4,"B,R",Eric Deschamps,215,Legendary Creature — Vampire,Flying\n{1}{R}: Olivia Voldaren deals 1 damage to another target creature. That creature becomes a Vampire in addition to its other types. Put a +1/+1 counter on Olivia Voldaren.\n{3}{B}{B}: Gain control of target Vampire for as long as you control Olivia Voldaren.,ISD,,normal,247235,3,3,Mythic Rare,Vampire,Creature
Blazing Torch,{1},1,,Scott Chou,216,Artifact — Equipment,"Equipped creature can't be blocked by Vampires or Zombies.\nEquipped creature has ""{T}, Sacrifice Blazing Torch: Blazing Torch deals 2 damage to target creature or player.""\nEquip {1} ({1}: Attach to target creature you control. Equip only as a sorcery.)","ZEN,ISD",,normal,221284,,,Common,Equipment,Artifact
Butcher's Cleaver,{3},3,,Jason Felix,217,Artifact — Equipment,"Equipped creature gets +3/+0.\nAs long as equipped creature is a Human, it has lifelink.\nEquip {3}","ISD,DDQ","Outside the safety of Thraben, there is little distinction between tool and weapon.",normal,220049,,,Uncommon,Equipment,Artifact
Cellar Door,{2},2,,Rob Alexander,218,Artifact,"{3}, {T}: Target player puts the bottom card of his or her library into his or her graveyard. If it's a creature card, you put a 2/2 black Zombie creature token onto the battlefield.",ISD,"As if anyone needed another reason to avoid dark, dank cellars.",normal,220390,,,Uncommon,,Artifact
Cobbled Wings,{2},2,,Matt Stewart,219,Artifact — Equipment,Equipped creature has flying.\nEquip {1} ({1}: Attach to target creature you control. Equip only as a sorcery.),"ISD,DDQ","For the necro-alchemist, any puzzle can be solved with intelligence and harvested body parts.",normal,220649,,,Common,Equipment,Artifact
Creepy Doll,{5},5,,Matt Stewart,220,Artifact Creature — Construct,"Indestructible\nWhenever Creepy Doll deals combat damage to a creature, flip a coin. If you win the flip, destroy that creature.",ISD,"A child's porcelain doll went missing one night, as did a pair of kitchen shears and the town magistrate.",normal,220378,1,1,Rare,Construct,"Artifact,Creature"
Demonmail Hauberk,{4},4,,Jason Felix,221,Artifact — Equipment,Equipped creature gets +4/+2.\nEquip—Sacrifice a creature.,ISD,It comes off as easily as your own skin.,normal,227291,,,Uncommon,Equipment,Artifact
Galvanic Juggernaut,{4},4,,Lucas Graciano,222,Artifact Creature — Juggernaut,"Galvanic Juggernaut attacks each turn if able.\nGalvanic Juggernaut doesn't untap during your untap step.\nWhenever another creature dies, untap Galvanic Juggernaut.","ISD,CNS",,normal,230772,5,5,Uncommon,Juggernaut,"Artifact,Creature"
Geistcatcher's Rig,{6},6,,Vincent Proce,223,Artifact Creature — Construct,"When Geistcatcher's Rig enters the battlefield, you may have it deal 4 damage to target creature with flying.",ISD,"The rigs were outlawed except in Nephalia, where malign spirits are as plentiful as crazed inventors.",normal,234445,4,5,Uncommon,Construct,"Artifact,Creature"
Ghoulcaller's Bell,{1},1,,Lars Grant-West,224,Artifact,{T}: Each player puts the top card of his or her library into his or her graveyard.,ISD,The bell's chime heralds the rise of the unhallowed from the grave and the fall of their victims into the earth.,normal,237362,,,Common,,Artifact
Graveyard Shovel,{2},2,,Martina Pilcerova,225,Artifact,"{2}, {T}: Target player exiles a card from his or her graveyard. If it's a creature card, you gain 2 life.",ISD,"Thanks to Havengul's thriving illegal market for corpses, the shovel that interred a body during the day is usually the same one digging it out at night.",normal,221288,,,Uncommon,,Artifact
Grimoire of the Dead,{4},4,,Steven Belledin,226,Legendary Artifact,"{1}, {T}, Discard a card: Put a study counter on Grimoire of the Dead.\n{T}, Remove three study counters from Grimoire of the Dead and sacrifice it: Put all creature cards from all graveyards onto the battlefield under your control. They're black Zombies in addition to their other colors and types.",ISD,,normal,230792,,,Mythic Rare,,Artifact
Inquisitor's Flail,{2},2,,Rob Alexander,227,Artifact — Equipment,"If equipped creature would deal combat damage, it deals double that damage instead.\nIf another creature would deal combat damage to equipped creature, it deals double that damage to equipped creature instead.\nEquip {2}",ISD,,normal,222196,,,Uncommon,Equipment,Artifact
