name,manaCost,cmc,colorIdentity,artist,number,type,text,printings,flavor,layout,multiverseid,power,toughness,rarity,subtypes,types
Stitched Drake,{1}{U}{U},3,U,Chris Rahn,80,Creature — Zombie Drake,"As an additional cost to cast Stitched Drake, exile a creature card from your graveyard.\nFlying","ISD,DDQ","""The best skaab are more powerful and more beautiful than the sum of their parts.""\n—Stitcher Geralf",normal,220652,3,4,Common,"Zombie,Drake",Creature
Stitcher's Apprentice,{1}{U},2,U,Johann Bodin,81,Creature — Homunculus,"{1}{U}, {T}: Put a 2/2 blue Homunculus creature token onto the battlefield, then sacrifice a creature.",ISD,"""Oglor create life, Oglor take it away. Oglor god! . . . until Master return.""",normal,220631,1,2,Common,Homunculus,Creature
Sturmgeist,{3}{U}{U},5,U,Terese Nielsen,82,Creature — Spirit,"Flying\nSturmgeist's power and toughness are each equal to the number of cards in your hand.\nWhenever Sturmgeist deals combat damage to a player, draw a card.",ISD,,normal,246950,*,*,Rare,Spirit,Creature
Think Twice,{1}{U},2,U,Anthony Francisco,83,Instant,Draw a card.\nFlashback {2}{U} (You may cast this card from your graveyard for its flashback cost. Then exile it.),"TSP,ISD","""Either I know just the spell I need, or I'm about to.""",normal,230626,,,Common,,Instant
Undead Alchemist,{3}{U},4,U,Michael C. Hayes,84,Creature — Zombie,"If a Zombie you control would deal combat damage to a player, instead that player puts that many cards from the top of his or her library into his or her graveyard.\nWhenever a creature card is put into an opponent's graveyard from his or her library, exile that card and put a 2/2 black Zombie creature token onto the battlefield.",ISD,,normal,244684,4,2,Rare,Zombie,Creature
Abattoir Ghoul,{3}{B},4,B,Volkan Baga,85,Creature — Zombie,"First strike\nWhenever a creature dealt damage by Abattoir Ghoul this turn dies, you gain life equal to that creature's toughness.","ISD,DDQ",Death took his humanity but not his skill with the knife.,normal,222911,3,2,Uncommon,Zombie,Creature
Altar's Reap,{1}{B},2,B,Donato Giancola,86,Instant,"As an additional cost to cast Altar's Reap, sacrifice a creature.\nDraw two cards.","ISD,M14,CNS,BFZ,C15","""The demons don't care if we mutter niceties and act out ceremonies. Just kill him.""\n—Bishop Volpaig, servant of Griselbrand",normal,226890,,,Common,,Instant
Army of the Damned,{5}{B}{B}{B},8,B,Ryan Pancoast,87,Sorcery,Put thirteen 2/2 black Zombie creature tokens onto the battlefield tapped.\nFlashback {7}{B}{B}{B} (You may cast this card from your graveyard for its flashback cost. Then exile it.),"ISD,C13",Sometimes death comes knocking. Sometimes it tears down the walls.,normal,229968,,,Mythic Rare,,Sorcery
Bitterheart Witch,{4}{B},5,B,Karl Kopinski,88,Creature — Human Shaman,"Deathtouch\nWhen Bitterheart Witch dies, you may search your library for a Curse card, put it onto the battlefield attached to target player, then shuffle your library.",ISD,,normal,222205,1,2,Uncommon,"Human,Shaman",Creature
Bloodgift Demon,{3}{B}{B},5,B,Peter Mohrbacher,89,Creature — Demon,"Flying\nAt the beginning of your upkeep, target player draws a card and loses 1 life.","ISD,C14",He relishes the devotion of his Skirsdag puppets and their belief that it will earn them immortality.,normal,226885,5,4,Rare,Demon,Creature
Bloodline Keeper,{2}{B}{B},4,B,Jason Chan,90a,Creature — Vampire,Flying\n{T}: Put a 2/2 black Vampire creature token with flying onto the battlefield.\n{B}: Transform Bloodline Keeper. Activate this ability only if you control five or more Vampires.,ISD,,double-faced,227061,3,3,Rare,Vampire,Creature
Lord of Lineage,,4,B,Jason Chan,90b,Creature — Vampire,Flying\nOther Vampire creatures you control get +2/+2.\n{T}: Put a 2/2 black Vampire creature token with flying onto the battlefield.,ISD,,double-faced,227072,5,5,Rare,Vampire,Creature
Brain Weevil,{3}{B},4,B,Anthony Jones,91,Creature — Insect,Intimidate (This creature can't be blocked except by artifact creatures and/or creatures that share a color with it.)\nSacrifice Brain Weevil: Target player discards two cards. Activate this ability only any time you could cast a sorcery.,"ISD,DDJ",,normal,235596,1,1,Common,Insect,Creature
Bump in the Night,{B},1,"B,R",Kev Walker,92,Sorcery,Target opponent loses 3 life.\nFlashback {5}{R} (You may cast this card from your graveyard for its flashback cost. Then exile it.),"ISD,DDK",It's not just the wind. It's not all in your head. And it's definitely something to worry about.,normal,222203,,,Common,,Sorcery
Corpse Lunge,{2}{B},3,B,Christopher Moeller,93,Instant,"As an additional cost to cast Corpse Lunge, exile a creature card from your graveyard.\nCorpse Lunge deals damage equal to the exiled card's power to target creature.",ISD,,normal,244680,,,Common,,Instant
Curse of Death's Hold,{3}{B}{B},5,B,Clint Cearley,94,Enchantment — Aura Curse,Enchant player\nCreatures enchanted player controls get -1/-1.,ISD,"""May you and all your kin waste and wither until your clan is no more!""",normal,227075,,,Rare,"Aura,Curse",Enchantment
Curse of Oblivion,{3}{B},4,B,Jana Schirmer & Johannes Voss,95,Enchantment — Aura Curse,"Enchant player\nAt the beginning of enchanted player's upkeep, that player exiles two cards from his or her graveyard.",ISD,The first step to peace is to learn how to forget.,normal,237020,,,Common,"Aura,Curse",Enchantment
Dead Weight,{B},1,B,Randy Gallegos,96,Enchantment — Aura,Enchant creature\nEnchanted creature gets -2/-2.,"ISD,SOI",The crueler vampires' idea of free-range farming.,normal,220393,,,Common,Aura,Enchantment
Diregraf Ghoul,{B},1,B,Dave Kendall,97,Creature — Zombie,Diregraf Ghoul enters the battlefield tapped.,"pMGD,ISD,DDQ","""At least this one still has arms and legs. Well, most of its legs.""\n—Enslow, ghoulcaller of Nephalia",normal,226747,2,2,Uncommon,Zombie,Creature
Disciple of Griselbrand,{1}{B},2,B,Clint Cearley,98,Creature — Human Cleric,"{1}, Sacrifice a creature: You gain life equal to the sacrificed creature's toughness.","ISD,C13","The demon Griselbrand dared to stand against Avacyn, earning him the loathing of thousands and the admiration of a few.",normal,244679,1,1,Uncommon,"Human,Cleric",Creature
Endless Ranks of the Dead,{2}{B}{B},4,B,Ryan Yee,99,Enchantment,"At the beginning of your upkeep, put X 2/2 black Zombie creature tokens onto the battlefield, where X is half the number of Zombies you control, rounded down.",ISD,"With Thraben's army recalled to its city walls, outlying villages were left to fend for themselves.",normal,234430,,,Rare,,Enchantment
Falkenrath Noble,{3}{B},4,B,Slawomir Maniak,100,Creature — Vampire,"Flying\nWhenever Falkenrath Noble or another creature dies, target player loses 1 life and you gain 1 life.","ISD,DDQ","""I often think on how excited they must feel to be chosen as my prey.""",normal,226751,2,2,Uncommon,Vampire,Creature
Ghoulcaller's Chant,{B},1,B,Randy Gallegos,101,Sorcery,Choose one —\n• Return target creature card from your graveyard to your hand.\n• Return two target Zombie cards from your graveyard to your hand.,ISD,"""The living are born small and weak. The dead rise ready to serve. The choice is obvious.""\n—Gisa, ghoulcaller of Gavony",normal,220021,,,Common,,Sorcery
Ghoulraiser,{1}{B}{B},3,B,Steve Prescott,102,Creature — Zombie,"When Ghoulraiser enters the battlefield, return a Zombie card at random from your graveyard to your hand.","ISD,DDQ","""Come. Bring your brothers. Tonight, you feast on living flesh.""\n—Jadar, ghoulcaller of Nephalia",normal,220019,2,2,Common,Zombie,Creature
Gruesome Deformity,{B},1,B,Matt Stewart,103,Enchantment — Aura,Enchant creature\nEnchanted creature has intimidate. (It can't be blocked except by artifact creatures and/or creatures that share a color with it.),ISD,She wanted to inspire terror wherever she went. The demons happily granted her wish.,normal,246945,,,Common,Aura,Enchantment
Heartless Summoning,{1}{B},2,B,Anthony Palumbo,104,Enchantment,Creature spells you cast cost {2} less to cast.\nCreatures you control get -1/-1.,ISD,"""They won't be winning any beauty pageants, but they'll do the trick.""\n—Enslow, ghoulcaller of Nephalia",normal,244678,,,Rare,,Enchantment
Liliana of the Veil,{1}{B}{B},3,B,Steve Argyle,105,Planeswalker — Liliana,+1: Each player discards a card.\n−2: Target player sacrifices a creature.\n−6: Separate all permanents target player controls into two piles. That player sacrifices all permanents in the pile of his or her choice.,ISD,,normal,235597,,,Mythic Rare,Liliana,Planeswalker
Manor Skeleton,{1}{B},2,B,Eric Deschamps,106,Creature — Skeleton,Haste\n{1}{B}: Regenerate Manor Skeleton.,ISD,Lungs dried to parchment wheeze blasphemies within a cage of bleached bone.,normal,249976,1,1,Common,Skeleton,Creature
Markov Patrician,{2}{B},3,B,Jana Schirmer & Johannes Voss,107,Creature — Vampire,Lifelink (Damage dealt by this creature also causes you to gain that much life.),ISD,"Vampires of the Markov bloodline pride themselves on their exquisite taste in fashion, art, and ""wine of the vein.""",normal,226754,3,1,Common,Vampire,Creature
Maw of the Mire,{4}{B},5,B,Vincent Proce,108,Sorcery,Destroy target land. You gain 4 life.,ISD,"As the chapel was dragged under, the bell in the tower rang until the murky depths forever silenced its toll.",normal,246952,,,Common,,Sorcery
Moan of the Unhallowed,{2}{B}{B},4,B,Nils Hamm,109,Sorcery,Put two 2/2 black Zombie creature tokens onto the battlefield.\nFlashback {5}{B}{B} (You may cast this card from your graveyard for its flashback cost. Then exile it.),"ISD,DDQ","For a ghoul, every village is a buffet and every disaster is a reunion.",normal,227286,,,Uncommon,,Sorcery
Morkrut Banshee,{3}{B}{B},5,B,Svetlin Velinov,110,Creature — Spirit,"Morbid — When Morkrut Banshee enters the battlefield, if a creature died this turn, target creature gets -4/-4 until end of turn.","ISD,CNS,C14","""Let go your grudges, or risk wandering the bogs forever in a murderous rage.""\n—Hildin, priest of Avacyn",normal,230777,4,4,Uncommon,Spirit,Creature
Night Terrors,{2}{B},3,B,Christopher Moeller,111,Sorcery,Target player reveals his or her hand. You choose a nonland card from it. Exile that card.,ISD,Innistrad is a place where dreams invade the mind and mere shadows exact a terrible toll.,normal,246947,,,Common,,Sorcery
Reaper from the Abyss,{3}{B}{B}{B},6,B,Matt Stewart,112,Creature — Demon,"Flying\nMorbid — At the beginning of each end step, if a creature died this turn, destroy target non-Demon creature.","ISD,C14","""Avacyn has deserted you. I welcome your devotion in her stead.""",normal,230768,6,6,Mythic Rare,Demon,Creature
Rotting Fensnake,{3}{B},4,B,Tomasz Jedruszek,113,Creature — Zombie Snake,,ISD,"Its venom sacs are long gone, but its crushing strength is somehow greater than ever.",normal,237011,5,1,Common,"Zombie,Snake",Creature
Screeching Bat,{2}{B},3,B,Slawomir Maniak,114a,Creature — Bat,"Flying\nAt the beginning of your upkeep, you may pay {2}{B}{B}. If you do, transform Screeching Bat.",ISD,The bat has such clarity of hearing that simple sounds become symphonies.,double-faced,221211,2,2,Uncommon,Bat,Creature
Stalking Vampire,,3,B,Slawomir Maniak,114b,Creature — Vampire,"At the beginning of your upkeep, you may pay {2}{B}{B}. If you do, transform Stalking Vampire.",ISD,Each form she takes is an exploration of the senses.,double-faced,221215,5,5,Uncommon,Vampire,Creature
Sever the Bloodline,{3}{B},4,B,Clint Cearley,115,Sorcery,Exile target creature and all other creatures with the same name as that creature.\nFlashback {5}{B}{B} (You may cast this card from your graveyard for its flashback cost. Then exile it.),"ISD,C15,DDQ",,normal,245194,,,Rare,,Sorcery
Skeletal Grimace,{1}{B},2,B,Eric Deschamps,116,Enchantment — Aura,"Enchant creature\nEnchanted creature gets +1/+1 and has ""{B}: Regenerate this creature.""",ISD,"""And then I realized we all have skeletons on the inside. Why wait until the bodies are dead to control them?""\n—Jadar, ghoulcaller of Nephalia",normal,220387,,,Common,Aura,Enchantment
Skirsdag High Priest,{1}{B},2,B,Jason A. Engle,117,Creature — Human Cleric,"Morbid — {T}, Tap two untapped creatures you control: Put a 5/5 black Demon creature token with flying onto the battlefield. Activate this ability only if a creature died this turn.","ISD,C14","""Thraben's pleas fall on deaf ears. Ours do not.""",normal,230794,1,2,Rare,"Human,Cleric",Creature
Stromkirk Patrol,{4}{B},5,B,Karl Kopinski,118,Creature — Vampire Soldier,"Whenever Stromkirk Patrol deals combat damage to a player, put a +1/+1 counter on it.",ISD,"""You'd best move along, human. Our palates are far less discerning than our master's.""",normal,226876,4,3,Common,"Vampire,Soldier",Creature
Tribute to Hunger,{2}{B},3,B,Dave Kendall,119,Instant,Target opponent sacrifices a creature. You gain life equal to that creature's toughness.,"ISD,DDQ","Marella was delighted. The ball had attracted so many suitors for her daughter, including that handsome stranger. She wondered where the two were now . . . .",normal,227064,,,Uncommon,,Instant
Typhoid Rats,{B},1,B,Kev Walker,120,Creature — Rat,Deathtouch (Any amount of damage this deals to a creature is enough to destroy it.),"ISD,CNS,M15,FRF",Kidnappers caught in Havengul are given two choices: languish in prison or become rat catchers. The smart ones go to prison.,normal,220634,1,1,Common,Rat,Creature
Unbreathing Horde,{2}{B},3,B,Dave Kendall,121,Creature — Zombie,"Unbreathing Horde enters the battlefield with a +1/+1 counter on it for each other Zombie you control and each Zombie card in your graveyard.\nIf Unbreathing Horde would be dealt damage, prevent that damage and remove a +1/+1 counter from it.","ISD,DDQ",,normal,230786,0,0,Rare,Zombie,Creature
Unburial Rites,{4}{B},5,"B,W",Ryan Pancoast,122,Sorcery,Return target creature card from your graveyard to the battlefield.\nFlashback {3}{W} (You may cast this card from your graveyard for its flashback cost. Then exile it.),ISD,All crave the Blessed Sleep. Few receive it.,normal,227087,,,Uncommon,,Sorcery
Vampire Interloper,{1}{B},2,B,James Ryman,123,Creature — Vampire Scout,Flying\nVampire Interloper can't block.,ISD,"He listens to every heartbeat, deciding which one of hundreds he will stop.",normal,226748,2,1,Common,"Vampire,Scout",Creature
Victim of Night,{B}{B},2,B,Winona Nelson,124,Instant,"Destroy target non-Vampire, non-Werewolf, non-Zombie creature.","ISD,DDQ","""Do not touch a drop. Not yet. I want to watch this so-called slayer's last crisis of faith.""\n—Olivia Voldaren",normal,220023,,,Common,,Instant
Village Cannibals,{2}{B},3,B,Bud Cook,125,Creature — Human,"Whenever another Human creature dies, put a +1/+1 counter on Village Cannibals.",ISD,Some have endured the horrors of Innistrad by becoming the worst monsters of all.,normal,222903,2,2,Uncommon,Human,Creature
Walking Corpse,{1}{B},2,B,Igor Kieryluk,126,Creature — Zombie,,"ISD,M13,M15,W16","""Is it hopeless? When wave upon wave of our dead return as mindless flesh-eaters to claw upon Thraben's walls? We're too busy cutting them down to indulge ourselves in such philosophical foppery.""\n—Mikaeus, the Lunarch",normal,243210,2,2,Common,Zombie,Creature
Ancient Grudge,{1}{R},2,"R,G",Ryan Yee,127,Instant,Destroy target artifact.\nFlashback {G} (You may cast this card from your graveyard for its flashback cost. Then exile it.),"pFNM,TSP,ISD","If there's anything a werewolf hates, it's a collar—especially Avacyn's Collar, the symbol of her church.",normal,235600,,,Common,,Instant
Ashmouth Hound,{1}{R},2,R,Daarken,128,Creature — Elemental Hound,"Whenever Ashmouth Hound blocks or becomes blocked by a creature, Ashmouth Hound deals 1 damage to that creature.","ISD,DDK","Its fiery paws make it easy to track, which is very useful when you want to go in exactly the opposite direction.",normal,233255,2,1,Common,"Elemental,Hound",Creature
Balefire Dragon,{5}{R}{R},7,R,Eric Deschamps,129,Creature — Dragon,"Flying\nWhenever Balefire Dragon deals combat damage to a player, it deals that much damage to each creature that player controls.",ISD,"If it comes for you, die boldly or die swiftly—for die you will.",normal,230774,6,6,Mythic Rare,Dragon,Creature
Blasphemous Act,{8}{R},9,R,Daarken,130,Sorcery,Blasphemous Act costs {1} less to cast for each creature on the battlefield.\nBlasphemous Act deals 13 damage to each creature.,"ISD,C14","""Holy places are no longer sanctuary from death, and death is no longer sanctuary from anything.""\n—Thalia, Knight-Cathar",normal,222206,,,Rare,,Sorcery
Bloodcrazed Neonate,{1}{R},2,R,Cynthia Sheppard,131,Creature — Vampire,"Bloodcrazed Neonate attacks each turn if able.\nWhenever Bloodcrazed Neonate deals combat damage to a player, put a +1/+1 counter on it.","pWPN,ISD","While elder vampires select their meals with care, the newly sired frenzy at the first whiff.",normal,220373,2,1,Common,Vampire,Creature
Brimstone Volley,{2}{R},3,R,Eytan Zana,132,Instant,Brimstone Volley deals 3 damage to target creature or player.\nMorbid — Brimstone Volley deals 5 damage to that creature or player instead if a creature died this turn.,"ISD,CNS",,normal,233253,,,Common,,Instant
Burning Vengeance,{2}{R},3,R,Raymond Swanland,133,Enchantment,"Whenever you cast a spell from your graveyard, Burning Vengeance deals 2 damage to target creature or player.","ISD,EMA",Mist is the geists' sorrow. Wind is their pain. Fire is their vengeance.,normal,243211,,,Uncommon,,Enchantment
Charmbreaker Devils,{5}{R},6,R,Dan Scott,134,Creature — Devil,"At the beginning of your upkeep, return an instant or sorcery card at random from your graveyard to your hand.\nWhenever you cast an instant or sorcery spell, Charmbreaker Devils gets +4/+0 until end of turn.","ISD,C13,C15",,normal,227668,4,4,Rare,Devil,Creature
Crossway Vampire,{1}{R}{R},3,R,Mark Evans,135,Creature — Vampire,"When Crossway Vampire enters the battlefield, target creature can't block this turn.",ISD,"""Do not flatter Fate. It did not guide you into my clutches tonight. That was all my doing.""",normal,230779,3,2,Common,Vampire,Creature
Curse of Stalked Prey,{1}{R},2,R,Christopher Moeller,136,Enchantment — Aura Curse,"Enchant player\nWhenever a creature deals combat damage to enchanted player, put a +1/+1 counter on that creature.",ISD,"""Innocent thorns can fill the air with your bloodscent. Don't stray from the path.""\n—Elmut, crossway watcher",normal,226889,,,Rare,"Aura,Curse",Enchantment
Curse of the Nightly Hunt,{2}{R},3,R,Daarken,137,Enchantment — Aura Curse,Enchant player\nCreatures enchanted player controls attack each turn if able.,"ISD,C15","When the moon rises and the bloodlust takes hold, nothing matters but the kill.",normal,226881,,,Uncommon,"Aura,Curse",Enchantment
Curse of the Pierced Heart,{1}{R},2,R,E. M. Gist,138,Enchantment — Aura Curse,"Enchant player\nAt the beginning of enchanted player's upkeep, Curse of the Pierced Heart deals 1 damage to that player.",ISD,"""May your veins weep, and may every vampire take notice.""\n—Stensian curse",normal,227071,,,Common,"Aura,Curse",Enchantment
Desperate Ravings,{1}{R},2,"R,U",John Stanko,139,Instant,"Draw two cards, then discard a card at random.\nFlashback {2}{U} (You may cast this card from your graveyard for its flashback cost. Then exile it.)","ISD,C15,EMA","Her mind was quite gone, yet she spoke nothing but truth.",normal,237359,,,Uncommon,,Instant
Devil's Play,{X}{R},1,R,Austin Hsu,140,Sorcery,Devil's Play deals X damage to target creature or player.\nFlashback {X}{R}{R}{R} (You may cast this card from your graveyard for its flashback cost. Then exile it.),"pMEI,ISD,DDK",A devil's hands are never idle.,normal,247419,,,Rare,,Sorcery
Falkenrath Marauders,{3}{R}{R},5,R,James Ryman,141,Creature — Vampire Warrior,"Flying, haste\nWhenever Falkenrath Marauders deals combat damage to a player, put two +1/+1 counters on it.",ISD,"No slinking in the dark for them, no luring whispers. They claim their prey in the speed and glory of the hunt.",normal,246954,2,2,Rare,"Vampire,Warrior",Creature
Feral Ridgewolf,{2}{R},3,R,Martina Pilcerova,142,Creature — Wolf,Trample\n{1}{R}: Feral Ridgewolf gets +2/+0 until end of turn.,ISD,"""The wolves no longer hunt just to feed. They kill for sport, or for some madness behind their eyes.""\n—Elmut, crossway watcher",normal,220022,1,2,Common,Wolf,Creature
Furor of the Bitten,{R},1,R,Randy Gallegos,143,Enchantment — Aura,Enchant creature\nEnchanted creature gets +2/+2 and attacks each turn if able.,ISD,Those who only believe themselves infected with lycanthropy can be as dangerous as those who really are.,normal,234431,,,Common,Aura,Enchantment
Geistflame,{R},1,R,Scott Chou,144,Instant,Geistflame deals 1 damage to target creature or player.\nFlashback {3}{R} (You may cast this card from your graveyard for its flashback cost. Then exile it.),"ISD,DDK",Innistrad pyromancers find their best raw materials in the fury of the dead.,normal,247427,,,Common,,Instant
Hanweir Watchkeep,{2}{R},3,R,Wayne Reynolds,145a,Creature — Human Warrior Werewolf,"Defender\nAt the beginning of each upkeep, if no spells were cast last turn, transform Hanweir Watchkeep.",ISD,"He scans for wolves, knowing there's one he can never anticipate.",double-faced,244683,1,5,Uncommon,"Human,Warrior,Werewolf",Creature
Bane of Hanweir,,3,R,Wayne Reynolds,145b,Creature — Werewolf,"Bane of Hanweir attacks each turn if able.\nAt the beginning of each upkeep, if a player cast two or more spells last turn, transform Bane of Hanweir.",ISD,Technically he never left his post. He looks after the wolf wherever it goes.,double-faced,244687,5,5,Uncommon,Werewolf,Creature
Harvest Pyre,{1}{R},2,R,Ryan Yee,146,Instant,"As an additional cost to cast Harvest Pyre, exile X cards from your graveyard.\nHarvest Pyre deals X damage to target creature.",ISD,Corpses destroyed by fire form the most destructive geists.,normal,220010,,,Common,,Instant
Heretic's Punishment,{4}{R},5,R,Vincent Proce,147,Enchantment,"{3}{R}: Choose target creature or player, then put the top three cards of your library into your graveyard.  Heretic's Punishment deals damage to that creature or player equal to the highest converted mana cost among those cards.",ISD,,normal,249974,,,Rare,,Enchantment
Infernal Plunge,{R},1,R,Daarken,148,Sorcery,"As an additional cost to cast Infernal Plunge, sacrifice a creature.\nAdd {R}{R}{R} to your mana pool.",ISD,"""Oh mighty Griselbrand, Scourge of the Heedless World, gladly I consume myself for thee!""",normal,235603,,,Common,,Sorcery
Instigator Gang,{3}{R},4,R,Greg Staples,149a,Creature — Human Werewolf,"Attacking creatures you control get +1/+0.\nAt the beginning of each upkeep, if no spells were cast last turn, transform Instigator Gang.",ISD,,double-faced,227415,2,3,Rare,"Human,Werewolf",Creature
Wildblood Pack,,4,R,Greg Staples,149b,Creature — Werewolf,"Trample\nAttacking creatures you control get +3/+0.\nAt the beginning of each upkeep, if a player cast two or more spells last turn, transform Wildblood Pack.",ISD,,double-faced,227419,5,5,Rare,Werewolf,Creature
Into the Maw of Hell,{4}{R}{R},6,R,Raymond Swanland,150,Sorcery,Destroy target land. Into the Maw of Hell deals 13 damage to target creature.,ISD,"Few entrances lead to where demons and devils lurk. Unfortunately, they occasionally open new ones.",normal,220035,,,Uncommon,,Sorcery
Kessig Wolf,{2}{R},3,R,Wayne England,151,Creature — Wolf,{1}{R}: Kessig Wolf gains first strike until end of turn.,ISD,"""Don't be afraid when you hear the wolves howl. Be afraid when you don't hear them at all.""\n—Saint Trogen, the Slayer",normal,220040,3,1,Common,Wolf,Creature
Kruin Outlaw,{1}{R}{R},3,R,David Rapoza,152a,Creature — Human Rogue Werewolf,"First strike\nAt the beginning of each upkeep, if no spells were cast last turn, transform Kruin Outlaw.",ISD,"""Hold tight. I've got a surprise for them.""",double-faced,227084,2,2,Rare,"Human,Rogue,Werewolf",Creature
Terror of Kruin Pass,,3,R,David Rapoza,152b,Creature — Werewolf,"Double strike\nWerewolves you control have menace. (They can't be blocked except by two or more creatures.)\nAt the beginning of each upkeep, if a player cast two or more spells last turn, transform Terror of Kruin Pass.",ISD,,double-faced,227090,3,3,Rare,Werewolf,Creature
Night Revelers,{4}{R},5,R,Steve Argyle,153,Creature — Vampire,Night Revelers has haste as long as an opponent controls a Human.,ISD,"Vampires think of themselves as the indisputable nobility of Innistrad, able to do as they please. There are few who can prove them wrong.",normal,226879,4,4,Common,Vampire,Creature
Nightbird's Clutches,{1}{R},2,R,Jason A. Engle,154,Sorcery,Up to two target creatures can't block this turn.\nFlashback {3}{R} (You may cast this card from your graveyard for its flashback cost. Then exile it.),ISD,"Shiny polished silver can ward off many creatures, but it attracts others.",normal,220386,,,Common,,Sorcery
Past in Flames,{3}{R},4,R,Anthony Jones,155,Sorcery,Each instant and sorcery card in your graveyard gains flashback until end of turn. The flashback cost is equal to its mana cost.\nFlashback {4}{R} (You may cast this card from your graveyard for its flashback cost. Then exile it.),ISD,,normal,245197,,,Mythic Rare,,Sorcery
Pitchburn Devils,{4}{R},5,R,Johann Bodin,156,Creature — Devil,"When Pitchburn Devils dies, it deals 3 damage to target creature or player.","ISD,M14,CNS","The ingenuity of goblins, the depravity of demons, and the smarts of sheep.",normal,222904,3,3,Common,Devil,Creature
Rage Thrower,{5}{R},6,R,Peter Mohrbacher,157,Creature — Human Shaman,"Whenever another creature dies, Rage Thrower deals 2 damage to target player.",ISD,"""Some lament these haunted times, but I'm a geistflame-tank-half-full kind of person.""",normal,222921,4,2,Uncommon,"Human,Shaman",Creature
