name,manaCost,cmc,colorIdentity,artist,number,type,text,printings,flavor,layout,multiverseid,power,toughness,rarity,subtypes,types
Master of the Hunt,{2}{G}{G},4,G,Jeff A. Menges,,Creature — Human,"{2}{G}{G}: Put a 1/1 green Wolf creature token named Wolves of the Hunt onto the battlefield. It has ""bands with other creatures named Wolves of the Hunt."" (Any creatures named Wolves of the Hunt can attack in a band as long as at least one has ""bands with other creatures named Wolves of the Hunt."" Bands are blocked as a group. If at least two creatures named Wolves of the Hunt you control, one of which has ""bands with other creatures named Wolves of the Hunt,"" are blocking or being blocked by the same creature, you divide that creature's combat damage, not its controller, among any of the creatures it's being blocked by or is blocking.)",LEG,,normal,1534,2,2,Rare,Human,Creature
Mirror Universe,{6},6,,Phil Foglio,,Artifact,"{T}, Sacrifice Mirror Universe: Exchange life totals with target opponent. Activate this ability only during your upkeep.","LEG,MED",,normal,1414,,,Rare,,Artifact
Moat,{2}{W}{W},4,W,Jeff A. Menges,,Enchantment,Creatures without flying can't attack.,"LEG,MED","The purpose of any moat is to impede attack. Some are filled with water, some with thistles. Some are filled with things best left unseen.",normal,1626,,,Rare,,Enchantment
Mold Demon,{5}{B}{B},7,B,Jesper Myrfors,,Creature — Fungus Demon,"When Mold Demon enters the battlefield, sacrifice it unless you sacrifice two Swamps.",LEG,,normal,1452,6,6,Rare,"Fungus,Demon",Creature
Moss Monster,{3}{G}{G},5,G,Jesper Myrfors,,Creature — Elemental,,"LEG,8ED","After the battle, an eerie silence gripped the forest. The losers' remains were lightly dusted with green.",normal,1535,3,6,Common,Elemental,Creature
Mountain Stronghold,,,,Tom Wänerstrand,,Land,"Red legendary creatures you control have ""bands with other legendary creatures."" (Any legendary creatures can attack in a band as long as at least one has ""bands with other legendary creatures."" Bands are blocked as a group. If at least two legendary creatures you control, one of which has ""bands with other legendary creatures,"" are blocking or being blocked by the same creature, you divide that creature's combat damage, not its controller, among any of the creatures it's being blocked by or is blocking.)",LEG,,normal,1702,,,Uncommon,,Land
Mountain Yeti,{2}{R}{R},4,R,Dan Frazier,,Creature — Yeti,Mountainwalk (This creature can't be blocked as long as defending player controls a Mountain.)\nProtection from white,"LEG,CHR,MED",The Yeti's single greatest asset is its unnerving ability to blend in with its surroundings.,normal,1585,3,3,Uncommon,Yeti,Creature
Nebuchadnezzar,{3}{U}{B},5,"U,B",Richard Kane Ferguson,,Legendary Creature — Human Wizard,"{X}, {T}: Name a card. Target opponent reveals X cards at random from his or her hand. Then that player discards all cards with that name revealed this way. Activate this ability only during your turn.","LEG,CHR,ME3",,normal,1671,3,3,Rare,"Human,Wizard",Creature
Nether Void,{3}{B},4,B,Harold McNeill,,World Enchantment,"Whenever a player casts a spell, counter it unless that player pays {3}.","LEG,ME3","These days, some wizards are finding that they have a little too much spell left at the end of their mana.",normal,1453,,,Rare,,Enchantment
Nicol Bolas,{2}{U}{U}{B}{B}{R}{R},8,"U,B,R","Edward P. Beard, Jr.",,Legendary Creature — Elder Dragon,"Flying\nAt the beginning of your upkeep, sacrifice Nicol Bolas unless you pay {U}{B}{R}.\nWhenever Nicol Bolas deals damage to an opponent, that player discards his or her hand.","LEG,CHR,TSB,DRB,ME3",,normal,1672,7,7,Rare,"Elder,Dragon",Creature
North Star,{4},4,,Kaja Foglio,,Artifact,"{4}, {T}: For one spell this turn, you may spend mana as though it were mana of any type to pay that spell's mana cost. (Additional costs are still paid normally.)",LEG,,normal,1415,,,Rare,,Artifact
Nova Pentacle,{4},4,,Richard Thomas,,Artifact,"{3}, {T}: The next time a source of your choice would deal damage to you this turn, that damage is dealt to target creature of an opponent's choice instead.","LEG,ME3",,normal,1416,,,Rare,,Artifact
Osai Vultures,{1}{W},2,W,Dan Frazier,,Creature — Bird,"Flying\nAt the beginning of each end step, if a creature died this turn, put a carrion counter on Osai Vultures.\nRemove two carrion counters from Osai Vultures: Osai Vultures gets +1/+1 until end of turn.","LEG,4ED,ME4","A sign of battle, the Vultures circle and wait for the victorious to depart.",normal,1627,1,1,Common,Bird,Creature
Palladia-Mors,{2}{R}{R}{G}{G}{W}{W},8,"W,R,G","Edward P. Beard, Jr.",,Legendary Creature — Elder Dragon,"Flying, trample\nAt the beginning of your upkeep, sacrifice Palladia-Mors unless you pay {R}{G}{W}.","LEG,CHR,ME3",,normal,1673,7,7,Rare,"Elder,Dragon",Creature
Part Water,{X}{X}{U},1,U,NéNé Thomas,,Sorcery,X target creatures gain islandwalk until end of turn. (They can't be blocked as long as defending player controls an Island.),LEG,""". . . and the waters were a wall unto them on their right hand, and on their left."" —Exodus, 14:22",normal,1492,,,Uncommon,,Sorcery
Pavel Maliki,{4}{B}{R},6,"B,R",Andi Rusu,,Legendary Creature — Human,{B}{R}: Pavel Maliki gets +1/+0 until end of turn.,"LEG,ME3","We all know the legend: Pavel wanders the realms, helping those in greatest need. But is this a measure of his generosity, or of his obligation to atone?",normal,1674,5,3,Uncommon,Human,Creature
Pendelhaven,,,G,Bryon Wackwitz,,Legendary Land,{T}: Add {G} to your mana pool.\n{T}: Target 1/1 creature gets +1/+2 until end of turn.,"LEG,ATH,pFNM,TSB","""This is the forest primeval. The murmuring pines and the hemlocks . . . / Stand like Druids of old."" —Henry Wadsworth Longfellow, ""Evangeline""",normal,1703,,,Uncommon,,Land
Petra Sphinx,{2}{W}{W}{W},5,W,Sandra Everingham,,Creature — Sphinx,"{T}: Target player names a card, then reveals the top card of his or her library. If that card is the named card, that player puts it into his or her hand. If it isn't, the player puts it into his or her graveyard.","LEG,CHR,MED","What walks on four legs in the morning, two legs in the afternoon, and three legs in the evening?",normal,1628,3,4,Rare,Sphinx,Creature
Pit Scorpion,{2}{B},3,B,Scott Kirschner,,Creature — Scorpion,"Whenever Pit Scorpion deals damage to a player, that player gets a poison counter. (A player with ten or more poison counters loses the game.)","LEG,4ED,5ED",Sometimes the smallest nuisance can be the greatest pain.,normal,1454,1,1,Common,Scorpion,Creature
Pixie Queen,{2}{G}{G},4,G,Quinton Hoover,,Creature — Faerie,"Flying\n{G}{G}{G}, {T}: Target creature gains flying until end of turn.",LEG,,normal,1536,1,1,Rare,Faerie,Creature
Planar Gate,{6},6,,Melissa A. Benson,,Artifact,Creature spells you cast cost up to {2} less to cast.,"LEG,ME4","Nireya reached through the Gate, sensing the energies trapped beyond.",normal,1417,,,Rare,,Artifact
Pradesh Gypsies,{2}{G},3,G,Quinton Hoover,,Creature — Human Nomad,"{1}{G}, {T}: Target creature gets -2/-0 until end of turn.","LEG,4ED,5ED,6ED",,normal,1537,1,1,Uncommon,"Human,Nomad",Creature
Presence of the Master,{3}{W},4,W,Phil Foglio,,Enchantment,"Whenever a player casts an enchantment spell, counter it.","LEG,USG",,normal,1629,,,Uncommon,,Enchantment
Primordial Ooze,{R},1,R,Sandra Everingham,,Creature — Ooze,"Primordial Ooze attacks each turn if able.\nAt the beginning of your upkeep, put a +1/+1 counter on Primordial Ooze. Then you may pay {X}, where X is the number of +1/+1 counters on it. If you don't, tap Primordial Ooze and it deals X damage to you.","LEG,CHR,5ED","The thick, moving mass from the beginning of evolution swallows and digests the animate and inanimate as it unthinkingly strives to continue its existence.",normal,1586,1,1,Uncommon,Ooze,Creature
Princess Lucrezia,{3}{U}{U}{B},6,"U,B","Edward P. Beard, Jr.",,Legendary Creature — Human Wizard,{T}: Add {U} to your mana pool.,"LEG,ME3",,normal,1675,5,4,Uncommon,"Human,Wizard",Creature
Psionic Entity,{4}{U},5,U,Justin Hampton,,Creature — Illusion,{T}: Psionic Entity deals 2 damage to target creature or player and 3 damage to itself.,"LEG,4ED",Creatures of the Æther are notorious for neglecting their own well-being.,normal,1493,2,2,Rare,Illusion,Creature
Psychic Purge,{U},1,U,Susan Van Camp,,Sorcery,"Psychic Purge deals 1 damage to target creature or player.\nWhen a spell or ability an opponent controls causes you to discard Psychic Purge, that player loses 5 life.","LEG,MED",,normal,1494,,,Common,,Sorcery
Puppet Master,{U}{U}{U},3,U,Sandra Everingham,,Enchantment — Aura,"Enchant creature\nWhen enchanted creature dies, return that card to its owner's hand. If that card is returned to its owner's hand this way, you may pay {U}{U}{U}. If you do, return Puppet Master to its owner's hand.","LEG,CHR",,normal,1495,,,Uncommon,Aura,Enchantment
Pyrotechnics,{4}{R},5,R,Anson Maddocks,,Sorcery,Pyrotechnics deals 4 damage divided as you choose among any number of target creatures and/or players.,"LEG,4ED,RQS,ITP,5ED,ATH,6ED,7ED,8ED,HOP,FRF","""Hi! ni! ya! Behold the man of flint, that's me!/ Four lightnings zigzag from me, strike and return.""\n—Navajo war chant",normal,1587,,,Common,,Sorcery
Quagmire,{2}{B},3,B,Dan Frazier,,Enchantment,Creatures with swampwalk can be blocked as though they didn't have swampwalk.,LEG,,normal,1455,,,Uncommon,,Enchantment
Quarum Trench Gnomes,{3}{R},4,R,Dan Frazier,,Creature — Gnome,"{T}: If target Plains is tapped for mana, it produces colorless mana instead of white mana. (This effect lasts indefinitely.)",LEG,"""O Great Captain, all is lost. They tunneled, they burrowed, they trenched. They sapped the strength of our defenses."" —Sorgus, Chronicles of the Quarum Plains",normal,1588,1,1,Rare,Gnome,Creature
Rabid Wombat,{2}{G}{G},4,G,Kaja Foglio,,Creature — Wombat,Vigilance\nRabid Wombat gets +2/+2 for each Aura attached to it.,"LEG,CHR,5ED,MED",,normal,1538,0,1,Uncommon,Wombat,Creature
Radjan Spirit,{3}{G},4,G,Christopher Rush,,Creature — Spirit,{T}: Target creature loses flying until end of turn.,"LEG,4ED,5ED,6ED,ME4",,normal,1539,3,2,Uncommon,Spirit,Creature
Raging Bull,{2}{R},3,R,Randy Asplund-Faith,,Creature — Ox,,LEG,"""Sometimes the bulls win, and sometimes the bears win. But the bulls have more fun."" —Anonymous",normal,1589,2,2,Common,Ox,Creature
Ragnar,{G}{W}{U},3,"W,U,G",Melissa A. Benson,,Legendary Creature — Human Cleric,"{G}{W}{U}, {T}: Regenerate target creature.","LEG,ME3","""On the field of honor, a soldier need have no fear.""",normal,1676,2,2,Rare,"Human,Cleric",Creature
Ramirez DePietro,{3}{U}{B}{B},6,"U,B",Phil Foglio,,Legendary Creature — Human Pirate,First strike,"LEG,ME3","Ramirez DePietro is a most flamboyant pirate. Be careful not to believe his tall tales, especially when you ask his age.",normal,1677,4,3,Uncommon,"Human,Pirate",Creature
Ramses Overdark,{2}{U}{U}{B}{B},6,"U,B",Richard Kane Ferguson,,Legendary Creature — Human Assassin,{T}: Destroy target enchanted creature.,"LEG,ME3",,normal,1678,4,3,Rare,"Human,Assassin",Creature
Rapid Fire,{3}{W},4,W,Justin Hampton,,Instant,"Cast Rapid Fire only before blockers are declared.\nTarget creature gains first strike until end of turn. If it doesn't have rampage, that creature gains rampage 2 until end of turn. (Whenever this creature becomes blocked, it gets +2/+2 until end of turn for each creature blocking it beyond the first.)",LEG,,normal,1630,,,Rare,,Instant
Rasputin Dreamweaver,{4}{W}{U},6,"W,U",Andi Rusu,,Legendary Creature — Human Wizard,"Rasputin Dreamweaver enters the battlefield with seven dream counters on it.\nRemove a dream counter from Rasputin: Add {C} to your mana pool.\nRemove a dream counter from Rasputin: Prevent the next 1 damage that would be dealt to Rasputin this turn.\nAt the beginning of your upkeep, if Rasputin started the turn untapped, put a dream counter on it.\nRasputin can't have more than seven dream counters on it.","LEG,ME3",,normal,1679,4,1,Rare,"Human,Wizard",Creature
Rebirth,{3}{G}{G}{G},6,G,Mark Tedin,,Sorcery,"Remove Rebirth from your deck before playing if you're not playing for ante.\nEach player may ante the top card of his or her library. If a player does, his or her life total becomes 20.","LEG,4ED",,normal,1540,,,Rare,,Sorcery
Recall,{X}{X}{U},1,U,Brian Snõddy,,Sorcery,"Discard X cards, then return a card from your graveyard to your hand for each card discarded this way. Exile Recall.","LEG,CHR,5ED,6ED,ME3",,normal,1496,,,Rare,,Sorcery
Red Mana Battery,{4},4,R,Mark Tedin,,Artifact,"{2}, {T}: Put a charge counter on Red Mana Battery.\n{T}, Remove any number of charge counters from Red Mana Battery: Add {R} to your mana pool, then add an additional {R} to your mana pool for each charge counter removed this way.","LEG,4ED",,normal,1418,,,Uncommon,,Artifact
Reincarnation,{1}{G}{G},3,G,"Edward P. Beard, Jr.",,Instant,"Choose target creature. When that creature dies this turn, return a creature card from its owner's graveyard to the battlefield under the control of that creature's owner.","LEG,ME3,C13",,normal,1541,,,Uncommon,,Instant
Relic Barrier,{2},2,,Harold McNeill,,Artifact,{T}: Tap target artifact.,"LEG,5DN",,normal,1419,,,Uncommon,,Artifact
Relic Bind,{2}{U},3,U,Christopher Rush,,Enchantment — Aura,"Enchant artifact an opponent controls\nWhenever enchanted artifact becomes tapped, choose one —\n• Relic Bind deals 1 damage to target player.\n• Target player gains 1 life.","LEG,4ED",,normal,1497,,,Uncommon,Aura,Enchantment
Remove Enchantments,{W},1,W,Brian Snõddy,,Instant,"Return to your hand all enchantments you both own and control, all Auras you own attached to permanents you control, and all Auras you own attached to attacking creatures your opponents control. Then destroy all other enchantments you control, all other Auras attached to permanents you control, and all other Auras attached to attacking creatures your opponents control.",LEG,,normal,1631,,,Common,,Instant
Remove Soul,{1}{U},2,U,Brian Snõddy,,Instant,Counter target creature spell.,"LEG,CHR,5ED,6ED,S99,7ED,pMPR,8ED,9ED,10E,ME3","Nethya stiffened suddenly, head cocked as if straining to hear some distant sound, then fell lifeless to the ground.",normal,1498,,,Common,,Instant
Reset,{U}{U},2,U,Nicola Leonard,,Instant,Cast Reset only during an opponent's turn after his or her upkeep step.\nUntap all lands you control.,"LEG,ME3",,normal,1499,,,Uncommon,,Instant
Revelation,{G},1,G,Kaja Foglio,,World Enchantment,Players play with their hands revealed.,"LEG,CHR","""Many are in high place, and of renown: but mysteries are revealed unto the meek."" —Ecclesiastes 3:19",normal,1542,,,Rare,,Enchantment
Reverberation,{2}{U}{U},4,U,Justin Hampton,,Instant,All damage that would be dealt this turn by target sorcery spell is dealt to that spell's controller instead.,LEG,,normal,1500,,,Rare,,Instant
Righteous Avengers,{4}{W},5,W,Heather Hudson,,Creature — Human Soldier,Plainswalk (This creature can't be blocked as long as defending player controls a Plains.),"LEG,MED",Few can withstand the wrath of the righteous.,normal,1632,3,1,Uncommon,"Human,Soldier",Creature
Ring of Immortals,{5},5,,Melissa A. Benson,,Artifact,"{3}, {T}: Counter target instant or Aura spell that targets a permanent you control.",LEG,,normal,1420,,,Rare,,Artifact
Riven Turnbull,{5}{U}{B},7,"U,B",Richard Kane Ferguson,,Legendary Creature — Human Advisor,{T}: Add {B} to your mana pool.,"LEG,ME3","""Political violence is a perfectly legitimate answer to the persecution handed down by dignitaries of the state.""",normal,1680,5,7,Uncommon,"Human,Advisor",Creature
Rohgahh of Kher Keep,{2}{B}{B}{R}{R},6,"B,R","Edward P. Beard, Jr.",,Legendary Creature — Kobold,"At the beginning of your upkeep, you may pay {R}{R}{R}. If you don't, tap Rohgahh of Kher Keep and all creatures named Kobolds of Kher Keep, then an opponent gains control of them.\nCreatures you control named Kobolds of Kher Keep get +2/+2.","LEG,ME3",,normal,1681,5,5,Rare,Kobold,Creature
Rubinia Soulsinger,{2}{G}{W}{U},5,"W,U,G",Rob Alexander,,Legendary Creature — Faerie,You may choose not to untap Rubinia Soulsinger during your untap step.\n{T}: Gain control of target creature for as long as you control Rubinia and Rubinia remains tapped.,"LEG,CHR,ME3,C13",,normal,1682,2,3,Rare,Faerie,Creature
Rust,{G},1,G,Liz Danforth,,Instant,Counter target activated ability from an artifact source. (Mana abilities can't be targeted.),LEG,"""How dull it is to pause, to make an end,/ To rust unburnished, not to shine in use,/ As though to breathe were life!"" —Alfred, Lord Tennyson, ""Ulysses""",normal,1543,,,Common,,Instant
Sea Kings' Blessing,{U},1,U,Randy Asplund-Faith,,Instant,Any number of target creatures become blue until end of turn.,LEG,,normal,1501,,,Uncommon,,Instant
Seafarer's Quay,,,,Tom Wänerstrand,,Land,"Blue legendary creatures you control have ""bands with other legendary creatures."" (Any legendary creatures can attack in a band as long as at least one has ""bands with other legendary creatures."" Bands are blocked as a group. If at least two legendary creatures you control, one of which has ""bands with other legendary creatures,"" are blocking or being blocked by the same creature, you divide that creature's combat damage, not its controller, among any of the creatures it's being blocked by or is blocking.)",LEG,,normal,1704,,,Uncommon,,Land
Seeker,{2}{W}{W},4,W,Mark Poole,,Enchantment — Aura,Enchant creature\nEnchanted creature can't be blocked except by artifact creatures and/or white creatures.,"LEG,4ED",,normal,1633,,,Uncommon,Aura,Enchantment
Segovian Leviathan,{4}{U},5,U,Melissa A. Benson,,Creature — Leviathan,Islandwalk (This creature can't be blocked as long as defending player controls an Island.),"LEG,4ED,5ED,6ED","""Leviathan, too! Can you catch him with a fish-hook/ or run a line round his tongue?"" —Job 40:25",normal,1502,3,3,Uncommon,Leviathan,Creature
Sentinel,{4},4,,Randy Asplund-Faith,,Artifact Creature — Shapeshifter,{0}: Change Sentinel's base toughness to 1 plus the power of target creature blocking or blocked by Sentinel. (This effect lasts indefinitely.),"LEG,CHR",,normal,1421,1,1,Rare,Shapeshifter,"Artifact,Creature"
Serpent Generator,{6},6,,Mark Tedin,,Artifact,"{4}, {T}: Put a 1/1 colorless Snake artifact creature token onto the battlefield. It has ""Whenever this creature deals damage to a player, that player gets a poison counter."" (A player with ten or more poison counters loses the game.)","LEG,CHR,5ED,MED",,normal,1422,,,Rare,,Artifact
Shelkin Brownie,{1}{G},2,G,Douglas Shuler,,Creature — Ouphe,"{T}: Target creature loses all ""bands with other"" abilities until end of turn.",LEG,"Leave a bowl of milk on your doorstep each night for the brownies, or they'll cause you no end of mischief.",normal,1544,1,1,Common,Ouphe,Creature
Shield Wall,{1}{W},2,W,Douglas Shuler,,Instant,Creatures you control get +0/+2 until end of turn.,"LEG,CHR,5ED,7ED",,normal,1634,,,Uncommon,,Instant
Shimian Night Stalker,{3}{B}{B},5,B,Jesper Myrfors,,Creature — Nightstalker,"{B}, {T}: All damage that would be dealt to you this turn by target attacking creature is dealt to Shimian Night Stalker instead.","LEG,CHR","""‘Tis now the very witching time of night,/ When churchyards yawn and hell itself breathes out/ Contagion to this world."" —William Shakespeare, Hamlet",normal,1456,4,4,Uncommon,Nightstalker,Creature
Silhouette,{1}{U},2,U,Kaja Foglio,,Instant,Prevent all damage that would be dealt to target creature this turn by spells or abilities that target it.,LEG,,normal,1503,,,Uncommon,,Instant
Sir Shandlar of Eberyn,{4}{G}{W},6,"W,G",Andi Rusu,,Legendary Creature — Human Knight,,"LEG,ME3","""Remember Sir Shandlar! Remember and stand firm!"" —rallying cry of the Eberyn militia",normal,1683,4,7,Uncommon,"Human,Knight",Creature
Sivitri Scarzam,{5}{U}{B},7,"U,B",NéNé Thomas,,Legendary Creature — Human,,"LEG,CHR,ME3",Even the brave have cause to tremble at the sight of Sivitri Scarzam. Who else has tamed Scarzam's Dragon?,normal,1684,6,4,Uncommon,Human,Creature
Sol'kanar the Swamp King,{2}{U}{B}{R},5,"U,B,R",Richard Kane Ferguson,,Legendary Creature — Demon,"Swampwalk (This creature can't be blocked as long as defending player controls a Swamp.)\nWhenever a player casts a black spell, you gain 1 life.","LEG,CHR,TSB",,normal,1685,5,5,Rare,Demon,Creature
Spectral Cloak,{U}{U},2,U,Rob Alexander,,Enchantment — Aura,Enchant creature\nEnchanted creature has shroud as long as it's untapped. (It can't be the target of spells or abilities.),LEG,,normal,1504,,,Uncommon,Aura,Enchantment
Spinal Villain,{2}{R},3,R,Anson Maddocks,,Creature — Beast,{T}: Destroy target blue creature.,"LEG,MED","""Striking silent as a dream,/ Cutting short the strangled scream . . ."" —Tobrian, ""Watchdragon""",normal,1590,1,2,Rare,Beast,Creature
Spirit Link,{W},1,W,Kaja Foglio,,Enchantment — Aura,"Enchant creature (Target a creature as you cast this. This card enters the battlefield attached to that creature.)\nWhenever enchanted creature deals damage, you gain that much life.","LEG,4ED,5ED,6ED,7ED,8ED,9ED,10E",,normal,1635,,,Uncommon,Aura,Enchantment
Spirit Shackle,{B}{B},2,B,"Edward P. Beard, Jr.",,Enchantment — Aura,"Enchant creature\nWhenever enchanted creature becomes tapped, put a -0/-2 counter on it.","LEG,4ED,ME3",,normal,1457,,,Common,Aura,Enchantment
Spiritual Sanctuary,{2}{W}{W},4,W,Amy Weber,,Enchantment,"At the beginning of each player's upkeep, if that player controls a Plains, he or she gains 1 life.",LEG,,normal,1636,,,Rare,,Enchantment
Stangg,{4}{R}{G},6,"R,G",Mark Poole,,Legendary Creature — Human Warrior,"When Stangg enters the battlefield, put a legendary 3/4 red and green Human Warrior creature token named Stangg Twin onto the battlefield. When Stangg leaves the battlefield, exile that token. When that token leaves the battlefield, sacrifice Stangg.","LEG,CHR,ME3",,normal,1686,3,4,Rare,"Human,Warrior",Creature
Storm Seeker,{3}{G},4,G,Mark Poole,,Instant,Storm Seeker deals damage to target player equal to the number of cards in that player's hand.,"LEG,CHR,MED",,normal,1545,,,Uncommon,,Instant
Storm World,{R},1,R,Christopher Rush,,World Enchantment,"At the beginning of each player's upkeep, Storm World deals X damage to that player, where X is 4 minus the number of cards in his or her hand.","LEG,ME3",,normal,1591,,,Rare,,Enchantment
Subdue,{G},1,G,Brian Snõddy,,Instant,"Prevent all combat damage that would be dealt by target creature this turn. That creature gets +0/+X until end of turn, where X is its converted mana cost.",LEG,,normal,1546,,,Common,,Instant
Sunastian Falconer,{3}{R}{G},5,"R,G",Christopher Rush,,Legendary Creature — Human Shaman,{T}: Add {C}{C} to your mana pool.,"LEG,ME3",Sunastian has roots in both sorcery and swordplay; he has learned never to depend too heavily on the latter.,normal,1687,4,4,Uncommon,"Human,Shaman",Creature
Sword of the Ages,{6},6,,Dan Frazier,,Artifact,"Sword of the Ages enters the battlefield tapped.\n{T}, Sacrifice Sword of the Ages and any number of creatures you control: Sword of the Ages deals X damage to target creature or player, where X is the total power of the creatures sacrificed this way, then exile Sword of the Ages and those creature cards.","LEG,ME3",,normal,1423,,,Rare,,Artifact
Sylvan Library,{1}{G},2,G,Harold McNeill,,Enchantment,"At the beginning of your draw step, you may draw two additional cards. If you do, choose two cards in your hand drawn this turn. For each of those cards, pay 4 life or put the card on top of your library.","LEG,4ED,5ED,MED,CM1,VMA,EMA",,normal,1547,,,Uncommon,,Enchantment
Sylvan Paradise,{G},1,G,Randy Asplund-Faith,,Instant,Any number of target creatures become green until end of turn.,LEG,,normal,1548,,,Uncommon,,Instant
Syphon Soul,{2}{B},3,B,Melissa A. Benson,,Sorcery,Syphon Soul deals 2 damage to each other player. You gain life equal to the damage dealt this way.,"LEG,6ED,BRB,ONS,HOP,CNS","""Her lips suck forth; see, where it flies!""\n—Christopher Marlowe, The Tragical History of Doctor Faustus",normal,1458,,,Common,,Sorcery
Takklemaggot,{2}{B}{B},4,B,Daniel Gelon,,Enchantment — Aura,"Enchant creature\nAt the beginning of the upkeep of enchanted creature's controller, put a -0/-1 counter on that creature.\nWhen enchanted creature dies, that creature's controller chooses a creature that Takklemaggot could enchant. If he or she does, return Takklemaggot to the battlefield under your control attached to that creature. If he or she doesn't, return Takklemaggot to the battlefield under your control as a non-Aura enchantment. It loses ""enchant creature"" and gains ""At the beginning of that player's upkeep, Takklemaggot deals 1 damage to him or her.""","LEG,CHR,ME3",,normal,1459,,,Uncommon,Aura,Enchantment
Telekinesis,{U}{U},2,U,Daniel Gelon,,Instant,Tap target creature. Prevent all combat damage that would be dealt by that creature this turn. It doesn't untap during its controller's next two untap steps.,"LEG,MED",,normal,1505,,,Rare,,Instant
Teleport,{U}{U}{U},3,U,Douglas Shuler,,Instant,Cast Teleport only during the declare attackers step.\nTarget creature can't be blocked this turn.,"LEG,CHR",,normal,1506,,,Rare,,Instant
Tempest Efreet,{1}{R}{R}{R},4,R,NéNé Thomas,,Creature — Efreet,"Remove Tempest Efreet from your deck before playing if you're not playing for ante.\n{T}, Sacrifice Tempest Efreet: Target opponent may pay 10 life. If that player doesn't, he or she reveals a card at random from his or her hand. Exchange ownership of the revealed card and Tempest Efreet. Put the revealed card into your hand and Tempest Efreet from anywhere into that player's graveyard. This change in ownership is permanent.","LEG,4ED",,normal,1592,3,3,Rare,Efreet,Creature
