name,manaCost,cmc,colorIdentity,artist,number,type,text,printings,flavor,layout,multiverseid,power,toughness,rarity,subtypes,types
Tetsuo Umezawa,{U}{B}{R},3,"U,B,R",Julie Baroh,,Legendary Creature — Human Archer,"Tetsuo Umezawa can't be the target of Aura spells.\n{U}{B}{B}{R}, {T}: Destroy target tapped or blocking creature.","LEG,ME3",,normal,1688,3,3,Rare,"Human,Archer",Creature
The Abyss,{3}{B},4,B,Pete Venters,,World Enchantment,"At the beginning of each player's upkeep, destroy target nonartifact creature that player controls of his or her choice. It can't be regenerated.","LEG,ME3","""An immense river of oblivion is sweeping us away into a nameless abyss."" —Ernest Renan, Souvenirs d'Enfance et de Jeunesse",normal,1460,,,Rare,,Enchantment
The Brute,{1}{R},2,R,Mark Poole,,Enchantment — Aura,Enchant creature\nEnchanted creature gets +1/+0.\n{R}{R}{R}: Regenerate enchanted creature.,"LEG,4ED,5ED","""Union may be strength, but it is mere blind brute strength unless wisely directed."" —Samuel Butler",normal,1593,,,Common,Aura,Enchantment
The Lady of the Mountain,{4}{R}{G},6,"R,G",Richard Kane Ferguson,,Legendary Creature — Giant,,"LEG,ME3","Her given name has been lost in the mists of time. Legend says that her silent vigil will one day be ended by the one who, pure of heart and spirit, calls out that name again.",normal,1689,5,5,Uncommon,Giant,Creature
The Tabernacle at Pendrell Vale,,,,Nicola Leonard,,Legendary Land,"All creatures have ""At the beginning of your upkeep, destroy this creature unless you pay {1}.""","LEG,ME3",,normal,1690,,,Rare,,Land
The Wretched,{3}{B}{B},5,B,Christopher Rush,,Creature — Demon,"At end of combat, gain control of all creatures blocking The Wretched for as long as you control The Wretched.","LEG,CHR,5ED,ME3",,normal,1461,2,5,Rare,Demon,Creature
Thunder Spirit,{1}{W}{W},3,W,Randy Asplund-Faith,,Creature — Elemental Spirit,"Flying, first strike","LEG,MED","""It was full of fire and smoke and light and . . . it drove between us and the Efrafans like a thousand thunderstorms with lightning."" —Richard Adams, Watership Down",normal,1637,2,2,Rare,"Elemental,Spirit",Creature
Time Elemental,{2}{U},3,U,Amy Weber,,Creature — Elemental,"When Time Elemental attacks or blocks, at end of combat, sacrifice it and it deals 5 damage to you.\n{2}{U}{U}, {T}: Return target permanent that isn't enchanted to its owner's hand.","LEG,4ED,5ED,MED",,normal,1507,0,2,Rare,Elemental,Creature
Tobias Andrion,{3}{W}{U},5,"W,U",Andi Rusu,,Legendary Creature — Human Advisor,,"LEG,CHR,ME3","Administrator of the military state of Sheoltun, Tobias is the military right arm of the empire and the figurehead of its freedom.",normal,1691,4,4,Uncommon,"Human,Advisor",Creature
Tolaria,,,U,Nicola Leonard,,Legendary Land,"{T}: Add {U} to your mana pool.\n{T}: Target creature loses banding and all ""bands with other"" abilities until end of turn. Activate this ability only during any upkeep step.",LEG,"""Fairest Isle, all isles excelling,/ Seat of pleasures, and of loves . . ."" —John Dryden",normal,1705,,,Uncommon,,Land
Tor Wauki,{2}{B}{B}{R},5,"B,R",Randy Asplund-Faith,,Legendary Creature — Human Archer,{T}: Tor Wauki deals 2 damage to target attacking or blocking creature.,"LEG,CHR,ME3",,normal,1692,3,3,Uncommon,"Human,Archer",Creature
Torsten Von Ursus,{3}{G}{G}{W},6,"W,G",Mark Poole,,Legendary Creature — Human Soldier,,"LEG,ME3","""How can you accuse me of evil? Though these deeds be unsavory, no one will argue: good shall follow from them.""",normal,1693,5,5,Uncommon,"Human,Soldier",Creature
Touch of Darkness,{B},1,B,Pete Venters,,Instant,Any number of target creatures become black until end of turn.,LEG,"""Black spirits and white, red spirits and gray,/ Mingle, mingle, mingle, you that mingle may."" —Thomas Middleton, The Witch",normal,1462,,,Uncommon,,Instant
Transmutation,{1}{B},2,B,Susan Van Camp,,Instant,Switch target creature's power and toughness until end of turn.,"LEG,CHR","""You know what I was,/ You see what I am: change me, change me!""\n—Randall",normal,1463,,,Common,,Instant
Triassic Egg,{4},4,,Dan Frazier,,Artifact,"{3}, {T}: Put a hatchling counter on Triassic Egg.\nSacrifice Triassic Egg: Choose one —\n• You may put a creature card from your hand onto the battlefield. Activate this ability only if two or more hatchling counters are on Triassic Egg.\n• Return target creature card from your graveyard to the battlefield. Activate this ability only if two or more hatchling counters are on Triassic Egg.","LEG,CHR,ME4",,normal,1424,,,Rare,,Artifact
Tuknir Deathlock,{R}{R}{G}{G},4,"R,G",Liz Danforth,,Legendary Creature — Human Wizard,"Flying\n{R}{G}, {T}: Target creature gets +2/+2 until end of turn.","LEG,ME3","An explorer of the Æther, Tuknir often discovers himself in the most unusual physical realms.",normal,1694,2,2,Rare,"Human,Wizard",Creature
Tundra Wolves,{W},1,W,Quinton Hoover,,Creature — Wolf,First strike (This creature deals combat damage before creatures without first strike.),"LEG,4ED,5ED,6ED,8ED,10E","I heard their eerie howling, the wolves calling their kindred across the frozen plains.",normal,1638,1,1,Common,Wolf,Creature
Typhoon,{2}{G},3,G,Anson Maddocks,,Sorcery,Typhoon deals damage to each opponent equal to the number of Islands that player controls.,LEG,Fierce winds ripped across the tropical landscape. What they did not destroy with their fiery breath was washed away by torrential rain.,normal,1549,,,Rare,,Sorcery
Undertow,{2}{U},3,U,Randy Asplund-Faith,,Enchantment,Creatures with islandwalk can be blocked as though they didn't have islandwalk.,LEG,,normal,1508,,,Uncommon,,Enchantment
Underworld Dreams,{B}{B}{B},3,B,Julie Baroh,,Enchantment,"Whenever an opponent draws a card, Underworld Dreams deals 1 damage to him or her.","LEG,8ED,9ED,p2HG,10E,M10,DPA","""In the drowsy dark cave of the mind dreams build their nest with fragments dropped from day's caravan."" —Rabindranath Tagore",normal,1464,,,Uncommon,,Enchantment
Unholy Citadel,,,,Mark Poole,,Land,"Black legendary creatures you control have ""bands with other legendary creatures."" (Any legendary creatures can attack in a band as long as at least one has ""bands with other legendary creatures."" Bands are blocked as a group. If at least two legendary creatures you control, one of which has ""bands with other legendary creatures,"" are blocking or being blocked by the same creature, you divide that creature's combat damage, not its controller, among any of the creatures it's being blocked by or is blocking.)",LEG,,normal,1706,,,Uncommon,,Land
Untamed Wilds,{2}{G},3,G,NéNé Thomas,,Sorcery,Search your library for a basic land card and put that card onto the battlefield. Then shuffle your library.,"LEG,4ED,RQS,ITP,5ED,POR,PO2,6ED,S99,7ED",,normal,1550,,,Uncommon,,Sorcery
Ur-Drago,{3}{U}{U}{B}{B},7,"U,B",Christopher Rush,,Legendary Creature — Elemental,First strike\nCreatures with swampwalk can be blocked as though they didn't have swampwalk.,LEG,,normal,1695,4,4,Rare,Elemental,Creature
Urborg,,,B,Bryon Wackwitz,,Legendary Land,{T}: Add {B} to your mana pool.\n{T}: Target creature loses first strike or swampwalk until end of turn.,"LEG,ME3","""Resignedly beneath the sky/The melancholy waters lie./So blend the turrets and shadows there/That all seem pendulous in air,/While from a proud tower in town/Death looks gigantically down."" —Edgar Allan Poe, ""The City in the Sea""",normal,1707,,,Uncommon,,Land
Vaevictis Asmadi,{2}{B}{B}{R}{R}{G}{G},8,"B,R,G",Andi Rusu,,Legendary Creature — Elder Dragon,"Flying\nAt the beginning of your upkeep, sacrifice Vaevictis Asmadi unless you pay {B}{R}{G}.\n{B}: Vaevictis Asmadi gets +1/+0 until end of turn.\n{R}: Vaevictis Asmadi gets +1/+0 until end of turn.\n{G}: Vaevictis Asmadi gets +1/+0 until end of turn.","LEG,CHR,ME3",,normal,1696,7,7,Rare,"Elder,Dragon",Creature
Vampire Bats,{B},1,B,Anson Maddocks,,Creature — Bat,Flying (This creature can't be blocked except by creatures with flying or reach.)\n{B}: Vampire Bats gets +1/+0 until end of turn. Activate this ability no more than twice each turn.,"LEG,4ED,RQS,ITP,5ED,10E,DDD,DD3_GVL","""For something is amiss or out of place/ When mice with wings can wear a human face."" —Theodore Roethke, ""The Bat""",normal,1465,0,1,Common,Bat,Creature
Venarian Gold,{X}{U}{U},2,U,Daniel Gelon,,Enchantment — Aura,"Enchant creature\nWhen Venarian Gold enters the battlefield, tap enchanted creature and put a number of sleep counters on it equal to the value of X as you cast Venarian Gold.\nEnchanted creature doesn't untap during its controller's untap step if it has a sleep counter on it.\nAt the beginning of the upkeep of enchanted creature's controller, remove a sleep counter from that creature.",LEG,,normal,1509,,,Common,Aura,Enchantment
Visions,{W},1,W,NéNé Thomas,,Sorcery,Look at the top five cards of target player's library. You may then have that player shuffle that library.,"LEG,4ED","""Visions of glory, spare my aching sight,/ Ye unborn ages, crowd not on my soul!""\n—Thomas Gray, The Bard",normal,1639,,,Uncommon,,Sorcery
Voodoo Doll,{6},6,,Sandra Everingham,,Artifact,"At the beginning of your upkeep, put a pin counter on Voodoo Doll.\nAt the beginning of your end step, if Voodoo Doll is untapped, destroy Voodoo Doll and it deals damage to you equal to the number of pin counters on it.\n{X}{X}, {T}: Voodoo Doll deals damage equal to the number of pin counters on it to target creature or player. X is the number of pin counters on Voodoo Doll.","LEG,CHR,ME3",,normal,1425,,,Rare,,Artifact
Walking Dead,{1}{B},2,B,Dan Frazier,,Creature — Zombie,{B}: Regenerate Walking Dead.,LEG,The Walking Dead are the remains of freakish experiments by the Necromantic Lords.,normal,1466,1,1,Common,Zombie,Creature
Wall of Caltrops,{1}{W},2,W,Brian Snõddy,,Creature — Wall,"Defender (This creature can't attack.)\nWhenever Wall of Caltrops blocks a creature, if at least one other Wall creature is blocking that creature and no non-Wall creatures are blocking that creature, Wall of Caltrops gains banding until end of turn. (If any creatures with banding you control are blocking a creature, you divide that creature's combat damage, not its controller, among any of the creatures it's being blocked by.)",LEG,"""Ow! Ow ow ow! Oooh, ow, OW!""",normal,1640,2,1,Common,Wall,Creature
Wall of Dust,{2}{R},3,R,Richard Thomas,,Creature — Wall,"Defender (This creature can't attack.)\nWhenever Wall of Dust blocks a creature, that creature can't attack during its controller's next turn.","LEG,4ED",An ever-moving swarm of dust engulfs and disorients anything that comes near.,normal,1594,1,4,Uncommon,Wall,Creature
Wall of Earth,{1}{R},2,R,Richard Thomas,,Creature — Wall,Defender (This creature can't attack.),LEG,"The ground shuddered violently and the earth seemed to come to life. The elemental force contained in the vast wall of earth was trapped, bent to its controller's will.",normal,1595,0,6,Common,Wall,Creature
Wall of Heat,{2}{R},3,R,Richard Thomas,,Creature — Wall,Defender (This creature can't attack.),"LEG,CHR,BRB","At a distance, we mistook the sound for a waterfall . . .",normal,1596,2,6,Common,Wall,Creature
Wall of Light,{2}{W},3,W,Richard Thomas,,Creature — Wall,Defender (This creature can't attack.)\nProtection from black,"LEG,ME3",As many attackers were dazzled by the wall's beauty as were halted by its force.,normal,1641,1,5,Uncommon,Wall,Creature
Wall of Opposition,{3}{R}{R},5,R,Harold McNeill,,Creature — Wall,Defender (This creature can't attack.)\n{1}: Wall of Opposition gets +1/+0 until end of turn.,"LEG,CHR","Like so many obstacles in life, the Wall of Opposition is but an illusion, held fast by the focus and belief of the one who creates it.",normal,1597,0,6,Rare,Wall,Creature
Wall of Putrid Flesh,{2}{B},3,B,Richard Thomas,,Creature — Wall,Defender (This creature can't attack.)\nProtection from white\nPrevent all damage that would be dealt to Wall of Putrid Flesh by enchanted creatures.,LEG,,normal,1467,2,4,Uncommon,Wall,Creature
Wall of Shadows,{1}{B}{B},3,B,Pete Venters,,Creature — Wall,Defender (This creature can't attack.)\nPrevent all damage that would be dealt to Wall of Shadows by creatures it's blocking.\nWall of Shadows can't be the target of spells that can target only Walls or of abilities that can target only Walls.,"LEG,CHR",,normal,1468,0,1,Common,Wall,Creature
Wall of Tombstones,{1}{B},2,B,Dan Frazier,,Creature — Wall,"Defender (This creature can't attack.)\nAt the beginning of your upkeep, change Wall of Tombstones's base toughness to 1 plus the number of creature cards in your graveyard. (This effect lasts indefinitely.)",LEG,,normal,1469,0,1,Uncommon,Wall,Creature
Wall of Vapor,{3}{U},4,U,Richard Thomas,,Creature — Wall,Defender (This creature can't attack.)\nPrevent all damage that would be dealt to Wall of Vapor by creatures it's blocking.,"LEG,CHR","""Walls of a castle are made out of stone,/ Walls of a house out of bricks or of wood./ My walls are made out of magic alone,/ Stronger than any that ever have stood."" —Chrysoberyl Earthsdaughter, Incantations",normal,1510,0,1,Common,Wall,Creature
Wall of Wonder,{2}{U}{U},4,U,Richard Thomas,,Creature — Wall,Defender (This creature can't attack.)\n{2}{U}{U}: Wall of Wonder gets +4/-4 until end of turn and can attack this turn as though it didn't have defender.,"LEG,CHR,7ED",So confusing is the Wall's appearance that few of its victims even see it move.,normal,1511,1,5,Uncommon,Wall,Creature
Whirling Dervish,{G}{G},2,G,Susan Van Camp,,Creature — Human Monk,"Protection from black\nAt the beginning of each end step, if Whirling Dervish dealt damage to an opponent this turn, put a +1/+1 counter on it.","LEG,4ED,RQS,ITP,5ED,pSUS,TSB",,normal,1551,1,1,Uncommon,"Human,Monk",Creature
White Mana Battery,{4},4,W,Anthony Waters,,Artifact,"{2}, {T}: Put a charge counter on White Mana Battery.\n{T}, Remove any number of charge counters from White Mana Battery: Add {W} to your mana pool, then add an additional {W} to your mana pool for each charge counter removed this way.","LEG,4ED",,normal,1426,,,Uncommon,,Artifact
Willow Satyr,{2}{G}{G},4,G,Jeff A. Menges,,Creature — Satyr,You may choose not to untap Willow Satyr during your untap step.\n{T}: Gain control of target legendary creature for as long as you control Willow Satyr and Willow Satyr remains tapped.,"LEG,ME3",,normal,1552,1,1,Rare,Satyr,Creature
Winds of Change,{R},1,R,Justin Hampton,,Sorcery,"Each player shuffles the cards from his or her hand into his or her library, then draws that many cards.","LEG,4ED,5ED,POR,MED","""‘Tis the set of sails, and not the gales,/ Which tells us the way to go."" —Ella Wheeler Wilcox",normal,1598,,,Uncommon,,Sorcery
Winter Blast,{X}{G},1,G,Kaja Foglio,,Sorcery,Tap X target creatures. Winter Blast deals 2 damage to each of those creatures with flying.,"LEG,4ED,RQS,ITP,5ED,MED","""Blow, winds, and crack your cheeks! rage! blow!"" —William Shakespeare, King Lear",normal,1553,,,Rare,,Sorcery
Wolverine Pack,{2}{G}{G},4,G,Jeff A. Menges,,Creature — Wolverine,"Rampage 2 (Whenever this creature becomes blocked, it gets +2/+2 until end of turn for each creature blocking it beyond the first.)","LEG,5ED","""Give them great meals of beef and iron and steel, they will eat like wolves and fight like devils."" —William Shakespeare, King Henry V",normal,1554,2,4,Common,Wolverine,Creature
Wood Elemental,{3}{G},4,G,Brian Snõddy,,Creature — Elemental,"As Wood Elemental enters the battlefield, sacrifice any number of untapped Forests.\nWood Elemental's power and toughness are each equal to the number of Forests sacrificed as it entered the battlefield.","LEG,ME4",,normal,1555,*,*,Rare,Elemental,Creature
Xira Arien,{B}{R}{G},3,"B,R,G",Melissa A. Benson,,Legendary Creature — Insect Wizard,"Flying\n{B}{R}{G}, {T}: Target player draws a card.","LEG,CHR,ME3","A regular guest at the Royal Masquerade, Arien is the envy of the Court. She appears in a new costume every hour.",normal,1697,1,2,Rare,"Insect,Wizard",Creature
Zephyr Falcon,{1}{U},2,U,Heather Hudson,,Creature — Bird,"Flying, vigilance","LEG,4ED,RQS,ITP,5ED","Although greatly prized among falconers, the Zephyr Falcon is capricious and not easily tamed.",normal,1512,1,1,Common,Bird,Creature
