name,manaCost,cmc,colorIdentity,artist,number,type,text,printings,flavor,layout,multiverseid,power,toughness,rarity,subtypes,types
Relentless Hunter,{1}{R}{G},3,"R,G",Matt Stewart,158,Creature — Human Warrior,{1}{R}{G}: Relentless Hunter gets +1/+1 and gains trample until end of turn.,OGW,"""I swore to take one head for each member of my family they killed. My task is nowhere near its end.""",normal,407668,3,3,Uncommon,"Human,Warrior",Creature
Stormchaser Mage,{U}{R},2,"U,R",Clint Cearley,159,Creature — Human Wizard,"Flying, haste\nProwess (Whenever you cast a noncreature spell, this creature gets +1/+1 until end of turn.)",OGW,Roilmages' tactics are as chaotic as the energies they channel.,normal,407669,1,3,Uncommon,"Human,Wizard",Creature
Weapons Trainer,{R}{W},2,"W,R",Greg Opalinski,160,Creature — Human Soldier Ally,Other creatures you control get +1/+0 as long as you control an Equipment.,OGW,"""When I'm done training you, anything will be a deadly weapon.""",normal,407670,3,2,Uncommon,"Human,Soldier,Ally",Creature
Bone Saw,{0},,,Kev Walker,161,Artifact — Equipment,Equipped creature gets +1/+0.\nEquip {1} ({1}: Attach to target creature you control. Equip only as a sorcery.),"CON,OGW","Once a simple tool, it—like everything else on Zendikar—has been turned into a weapon against the Eldrazi.",normal,407671,,,Common,Equipment,Artifact
Captain's Claws,{2},2,,Anthony Palumbo,162,Artifact — Equipment,"Equipped creature gets +1/+0.\nWhenever equipped creature attacks, put a 1/1 white Kor Ally creature token onto the battlefield tapped and attacking.\nEquip {1}",OGW,Forged for victory in a time of despair.,normal,407672,,,Rare,Equipment,Artifact
Chitinous Cloak,{3},3,,Chris Rahn,163,Artifact — Equipment,Equipped creature gets +2/+2 and has menace. (It can't be blocked except by two or more creatures.)\nEquip {3},OGW,"""If we're going to survive, we have to use every tool at our disposal. Especially the disgusting ones.""\n—Ryza, Oran-Rief scout",normal,407673,,,Uncommon,Equipment,Artifact
Hedron Crawler,{2},2,,Daniel Ljunggren,164,Artifact Creature — Construct,{T}: Add {C} to your mana pool. ({C} represents colorless mana.),OGW,"""It's endearing, in a mystical, pointy sort of way.""\n—General Tazri, allied commander",normal,407674,0,1,Common,Construct,"Artifact,Creature"
Seer's Lantern,{3},3,,Jung Park,165,Artifact,"{T}: Add {C} to your mana pool. ({C} represents colorless mana.)\n{2}, {T}: Scry 1. (Look at the top card of your library. You may put that card on the bottom of your library.)",OGW,A light to bring hope in dark times.,normal,407675,,,Common,,Artifact
Stoneforge Masterwork,{1},1,,Ben Maier,166,Artifact — Equipment,Equipped creature gets +1/+1 for each other creature you control that shares a creature type with it.\nEquip {2},OGW,"The nomadic kor carry only necessities on their long treks. The coming of the Eldrazi redefined ""necessities.""",normal,407676,,,Rare,Equipment,Artifact
Strider Harness,{3},3,,Kev Walker,167,Artifact — Equipment,Equipped creature gets +1/+1 and has haste.\nEquip {1},"SOM,OGW","""Sometimes being fast is as important as being smart.""\n—Ryza, Oran-Rief scout",normal,407677,,,Uncommon,Equipment,Artifact
Cinder Barrens,,,"B,R",Cliff Childs,168,Land,Cinder Barrens enters the battlefield tapped.\n{T}: Add {B} or {R} to your mana pool.,OGW,A mudflow swallowed the lowlands years ago. All that remains are a bottomless mire and an endless rain of ash.,normal,407678,,,Uncommon,,Land
Corrupted Crossroads,,,,Ryan Pancoast,169,Land,"{T}: Add {C} to your mana pool. ({C} represents colorless mana.)\n{T}, Pay 1 life: Add one mana of any color to your mana pool. Spend this mana only to cast a spell with devoid.",OGW,"""Look, and see the future.""\n—Ayli, high priest of the Eternal Pilgrims",normal,407679,,,Rare,,Land
Crumbling Vestige,,,,Zack Stella,170,Land,"Crumbling Vestige enters the battlefield tapped.\nWhen Crumbling Vestige enters the battlefield, add one mana of any color to your mana pool.\n{T}: Add {C} to your mana pool. ({C} represents colorless mana.)",OGW,,normal,407680,,,Common,,Land
Hissing Quagmire,,,"B,G",Cliff Childs,171,Land,Hissing Quagmire enters the battlefield tapped.\n{T}: Add {B} or {G} to your mana pool.\n{1}{B}{G}: Hissing Quagmire becomes a 2/2 black and green Elemental creature with deathtouch until end of turn. It's still a land.,OGW,,normal,407681,,,Rare,,Land
Holdout Settlement,,,,Kieran Yanner,172,Land,"{T}: Add {C} to your mana pool. ({C} represents colorless mana.)\n{T}, Tap an untapped creature you control: Add one mana of any color to your mana pool.",OGW,"Even in areas of profound devastation, the hedrons remained intact.",normal,407682,,,Common,,Land
Meandering River,,,"W,U",Cliff Childs,173,Land,Meandering River enters the battlefield tapped.\n{T}: Add {W} or {U} to your mana pool.,OGW,The river split into many channels as it flowed to the Halimar Sea. Few travelers could follow the same one twice.,normal,407683,,,Uncommon,,Land
Mirrorpool,,,,Cliff Childs,174,Land,"Mirrorpool enters the battlefield tapped.\n{T}: Add {C} to your mana pool.\n{2}{C}, {T}, Sacrifice Mirrorpool: Copy target instant or sorcery spell you control. You may choose new targets for the copy.\n{4}{C}, {T}, Sacrifice Mirrorpool: Put a token onto the battlefield that's a copy of target creature you control.",OGW,,normal,407684,,,Mythic Rare,,Land
Needle Spires,,,"R,W",Jonas De Ro,175,Land,Needle Spires enters the battlefield tapped.\n{T}: Add {R} or {W} to your mana pool.\n{2}{R}{W}: Needle Spires becomes a 2/1 red and white Elemental creature with double strike until end of turn. It's still a land.,OGW,,normal,407685,,,Rare,,Land
Ruins of Oran-Rief,,,,Jason Felix,176,Land,Ruins of Oran-Rief enters the battlefield tapped.\n{T}: Add {C} to your mana pool. ({C} represents colorless mana.)\n{T}: Put a +1/+1 counter on target colorless creature that entered the battlefield this turn.,OGW,,normal,407686,,,Rare,,Land
Sea Gate Wreckage,,,,Zack Stella,177,Land,"{T}: Add {C} to your mana pool. ({C} represents colorless mana.)\n{2}{C}, {T}: Draw a card. Activate this ability only if you have no cards in hand.",OGW,"Once a center for knowledge, Sea Gate now serves as a reminder of what was lost.",normal,407687,,,Rare,,Land
Submerged Boneyard,,,"U,B",Cliff Childs,178,Land,Submerged Boneyard enters the battlefield tapped.\n{T}: Add {U} or {B} to your mana pool.,OGW,"""Long after the land has given up the last of its secrets, there will still be mysteries in the depths of the sea.""\n—Kiora",normal,407688,,,Uncommon,,Land
Timber Gorge,,,"R,G",Cliff Childs,179,Land,Timber Gorge enters the battlefield tapped.\n{T}: Add {R} or {G} to your mana pool.,OGW,"Tazeem's embrace is harsh, but for those that call it home, nothing else will do.",normal,407689,,,Uncommon,,Land
Tranquil Expanse,,,"G,W",Cliff Childs,180,Land,Tranquil Expanse enters the battlefield tapped.\n{T}: Add {G} or {W} to your mana pool.,OGW,"Despite the chaos of the Roil and the devastation of the Eldrazi, Zendikar is a world of breathtaking beauty.",normal,407690,,,Uncommon,,Land
Unknown Shores,,,,Jung Park,181,Land,"{T}: Add {C} to your mana pool. ({C} represents colorless mana.)\n{1}, {T}: Add one mana of any color to your mana pool.","THS,OGW","Kozilek's presence warped the land, stripping away layer after layer.",normal,407691,,,Common,,Land
Wandering Fumarole,,,"U,R",Florian de Gesincourt,182,Land,"Wandering Fumarole enters the battlefield tapped.\n{T}: Add {U} or {R} to your mana pool.\n{2}{U}{R}: Until end of turn, Wandering Fumarole becomes a 1/4 blue and red Elemental creature with ""{0}: Switch this creature's power and toughness until end of turn."" It's still a land.",OGW,,normal,407692,,,Rare,,Land
Wastes,,,,Jason Felix,183,Basic Land,,OGW,,normal,407693,,,Basic Land,,Land
Wastes,,,,Jason Felix,183,Basic Land,,OGW,,normal,407694,,,Basic Land,,Land
Wastes,,,,Raymond Swanland,184,Basic Land,,OGW,,normal,407695,,,Basic Land,,Land
Wastes,,,,Raymond Swanland,184,Basic Land,,OGW,,normal,407696,,,Basic Land,,Land
