name,manaCost,cmc,colorIdentity,artist,number,type,text,printings,flavor,layout,multiverseid,power,toughness,rarity,subtypes,types
"Oloro, Ageless Ascetic",{3}{W}{U}{B},6,,Eric Deschamps,88,Legendary Creature — Giant Soldier,"At the beginning of your upkeep, you gain 2 life.\nWhenever you gain life, you may pay {1}. If you do, draw a card and each opponent loses 1 life.\nAt the beginning of your upkeep, if Oloro, Ageless Ascetic is in the command zone, you gain 2 life.","pJGP,C13",,normal,,4,5,Special,"Giant,Soldier",Creature
Plains,,,,Terese Nielsen,89,Basic Land — Plains,,"LEA,LEB,2ED,CED,CEI,3ED,4ED,ICE,RQS,pARL,MIR,ITP,5ED,POR,pPRE,TMP,pJGP,PO2,UGL,pALP,USG,ATH,6ED,PTK,S99,pGRU,MMQ,BRB,pELP,S00,INV,7ED,ODY,ONS,8ED,MRD,CHK,UNH,9ED,RAV,CST,TSP,10E,MED,LRW,SHM,ALA,DDC,M10,HOP,ME3,ZEN,H09,DDE,ROE,ARC,M11,DDF,SOM,MBS,DDG,NPH,CMD,M12,DDH,ISD,DDI,AVR,PC2,M13,RTR,DDK,M14,DDL,THS,C13,MD1,M15,DDN,KTK,C14,DD3_DVD,FRF,DDO,DTK,TPR,ORI,DDP,BFZ,C15,DDQ,SOI",,normal,,,,Basic Land,Plains,Land
Island,,,,Terese Nielsen,90,Basic Land — Island,,"LEA,LEB,2ED,CED,CEI,3ED,4ED,ICE,RQS,pARL,MIR,ITP,5ED,POR,TMP,pJGP,PO2,UGL,pALP,USG,6ED,PTK,S99,pGRU,MMQ,BRB,pELP,S00,BTD,INV,7ED,ODY,ONS,8ED,MRD,CHK,UNH,9ED,RAV,CST,TSP,10E,MED,LRW,SHM,ALA,DD2,M10,HOP,ME3,ZEN,H09,DDE,ROE,DPA,ARC,M11,DDF,SOM,MBS,NPH,CMD,M12,DDH,ISD,DDI,AVR,PC2,M13,DDJ,RTR,M14,THS,C13,DDM,M15,DDN,KTK,C14,DD3_JVC,FRF,DDO,DTK,TPR,ORI,BFZ,C15,DDQ,SOI",,normal,,,,Basic Land,Island,Land
Swamp,,,,Terese Nielsen,91,Basic Land — Swamp,,"LEA,LEB,2ED,CED,CEI,3ED,4ED,ICE,RQS,pARL,MIR,ITP,5ED,POR,TMP,pJGP,PO2,UGL,pALP,USG,ATH,6ED,PTK,S99,pGRU,MMQ,BRB,pELP,S00,BTD,INV,7ED,ODY,DKM,ONS,8ED,MRD,CHK,UNH,9ED,RAV,CST,TSP,10E,MED,LRW,SHM,ALA,DDC,M10,HOP,ME3,ZEN,DDD,H09,DDE,ROE,DPA,ARC,M11,SOM,MBS,NPH,CMD,M12,DDH,ISD,PD3,AVR,PC2,M13,DDJ,RTR,DDK,M14,THS,C13,DDM,MD1,M15,DDN,KTK,C14,DD3_DVD,DD3_GVL,FRF,DTK,TPR,ORI,DDP,BFZ,C15,DDQ,SOI",,normal,,,,Basic Land,Swamp,Land
Mountain,,,,Terese Nielsen,92,Basic Land — Mountain,,"LEA,LEB,2ED,ARN,CED,CEI,3ED,4ED,ICE,RQS,pARL,MIR,ITP,5ED,POR,TMP,pJGP,PO2,UGL,pALP,USG,ATH,6ED,PTK,S99,pGRU,MMQ,BRB,pELP,S00,BTD,INV,7ED,ODY,DKM,ONS,8ED,MRD,CHK,UNH,9ED,RAV,CST,TSP,10E,MED,LRW,EVG,SHM,ALA,DD2,M10,HOP,ME3,ZEN,H09,DDE,ROE,DPA,ARC,M11,SOM,PD2,MBS,DDG,NPH,CMD,M12,DDH,ISD,DDI,AVR,PC2,M13,DDJ,RTR,DDK,M14,DDL,THS,C13,M15,DDN,KTK,C14,DD3_EVG,DD3_JVC,FRF,DTK,TPR,ORI,DDP,BFZ,C15,SOI",,normal,,,,Basic Land,Mountain,Land
Forest,,,,Terese Nielsen,93,Basic Land — Forest,,"LEA,LEB,2ED,CED,CEI,3ED,4ED,ICE,RQS,pARL,MIR,ITP,5ED,POR,TMP,pJGP,PO2,UGL,pALP,USG,ATH,6ED,PTK,S99,pGRU,MMQ,BRB,pELP,S00,BTD,INV,7ED,ODY,DKM,ONS,8ED,MRD,CHK,UNH,9ED,RAV,CST,TSP,10E,MED,LRW,EVG,SHM,ALA,M10,HOP,ME3,ZEN,DDD,H09,DDE,ROE,DPA,ARC,M11,SOM,MBS,DDG,NPH,CMD,M12,DDH,ISD,AVR,PC2,M13,DDJ,RTR,M14,DDL,THS,C13,DDM,M15,KTK,C14,DD3_EVG,DD3_GVL,FRF,DDO,DTK,TPR,ORI,DDP,BFZ,C15,SOI",,normal,,,,Basic Land,Forest,Land
Ravages of War,{3}{W},4,,Fang Yue,97,Sorcery,Destroy all lands.,"PTK,ME2","""Thorn bushes spring up wherever the army has passed. Lean years follow in the wake of a great war.""\n—Lao Tzu, Tao Te Ching, trans. Feng and English",normal,,,,Special,,Sorcery
Damnation,{2}{B}{B},4,,Kev Walker,98,Sorcery,Destroy all creatures. They can't be regenerated.,"pMPR,PLC",,normal,,,,Special,,Sorcery
Dualcaster Mage,{1}{R}{R},3,,Matt Stewart,99,Creature — Human Wizard,"Flash\nWhen Dualcaster Mage enters the battlefield, copy target instant or sorcery spell. You may choose new targets for the copy.","C14,EMA","""It has been my experience that disasters like to strike in pairs.""",normal,,2,2,Special,"Human,Wizard",Creature
Feldon of the Third Path,{1}{R}{R},3,,Chase Stone,100,Legendary Creature — Human Artificer,"{2}{R}, {T}: Put a token onto the battlefield that's a copy of target creature card in your graveyard, except it's an artifact in addition to its other types. It gains haste. Sacrifice it at the beginning of the next end step.",C14,"""She will come back to me.""",normal,,2,3,Special,"Human,Artificer",Creature
Wasteland,,,,Steven Belledin,101,Land,"{T}: Add {C} to your mana pool.\n{T}, Sacrifice Wasteland: Destroy target nonbasic land.","TMP,pJGP,pMPR,TPR,EXP,EMA","The land was left depleted and empty, an unsettling taste of things to come.",normal,,,,Special,,Land
Mana Drain,{U}{U},2,,Mike Bierek,103,Instant,"Counter target spell. At the beginning of your next main phase, add an amount of {C} to your mana pool equal to that spell's converted mana cost.","LEG,ME3,VMA","""Power is wasted on the weak. They never keep it for long.""\n—Nicol Bolas",normal,,,,Special,,Instant
Command Beacon,,,,Jonas De Ro,105,Land,"{T}: Add {C} to your mana pool.\n{T}, Sacrifice Command Beacon: Put your commander into your hand from the command zone.",C15,"""I gazed once into that light. Now it burns in my mind, forever denying me rest.""\n—Riku of Two Reflections",normal,,,,Special,,Land
