name,manaCost,cmc,colorIdentity,artist,number,type,text,printings,flavor,layout,multiverseid,power,toughness,rarity,subtypes,types
Scroll of Origins,{2},2,,Dany Orizio,159,Artifact,"{2}, {T}: Draw a card if you have seven or more cards in hand.",SOK,"The words from which language sprang, the knowledge from which thought was born, the story from which history was woven.",normal,88811,,,Rare,,Artifact
Soratami Cloud Chariot,{5},5,,Franz Vohwinkel,160,Artifact,{2}: Target creature you control gains flying until end of turn.\n{2}: Prevent all combat damage that would be dealt to and dealt by target creature you control this turn.,SOK,,normal,74174,,,Uncommon,,Artifact
Wine of Blood and Iron,{3},3,,Luca Zontini,161,Artifact,"{4}: Target creature gets +X/+0 until end of turn, where X is its power. Sacrifice Wine of Blood and Iron at the beginning of the next end step.",SOK,"Godo never revealed what went into his special brew, but he always had more of it after great victories.",normal,74130,,,Rare,,Artifact
"Mikokoro, Center of the Sea",,,,John Avon,162,Legendary Land,"{T}: Add {C} to your mana pool.\n{2}, {T}: Each player draws a card.",SOK,"""Center of the Sea, Eye of the World, Shrine of Enlightenment. Seek it for answers. Seek it for healing. Seek it and return transformed.""\n—Scroll fragment from the ruins of Minamo",normal,74388,,,Rare,,Land
"Miren, the Moaning Well",,,,Rob Alexander,163,Legendary Land,"{T}: Add {C} to your mana pool.\n{3}, {T}, Sacrifice a creature: You gain life equal to the sacrificed creature's toughness.",SOK,,normal,88807,,,Rare,,Land
"Oboro, Palace in the Clouds",,,U,Rob Alexander,164,Legendary Land,"{T}: Add {U} to your mana pool.\n{1}: Return Oboro, Palace in the Clouds to its owner's hand.",SOK,"Here the soratami wove their endless plots—graceful, artful, and deceitful, while the unwitting world moved below.",normal,74206,,,Rare,,Land
Tomb of Urami,,,B,Alex Horley-Orlandelli,165,Legendary Land,"{T}: Add {B} to your mana pool. Tomb of Urami deals 1 damage to you if you don't control an Ogre.\n{2}{B}{B}, {T}, Sacrifice all lands you control: Put a legendary 5/5 black Demon Spirit creature token with flying named Urami onto the battlefield.",SOK,,normal,74492,,,Rare,,Land
