name,cost,artist,number,type,text,printings
Descendant of Masumaro,,Rob Alexander,126,Creature — Human Monk,"At the beginning of your upkeep, put a +1/+1 counter on Descendant of Masumaro for each card in your hand, then remove a +1/+1 counter from Descendant of Masumaro for each card in target opponent's hand.",SOK
Dosan's Oldest Chant,,Tim Hildebrandt,127,Sorcery,You gain 6 life.\nDraw a card.,SOK
Elder Pine of Jukai,,Alan Pollack,128,Creature — Spirit,"Whenever you cast a Spirit or Arcane spell, reveal the top three cards of your library. Put all land cards revealed this way into your hand and the rest on the bottom of your library in any order.\nSoulshift 2 (When this creature dies, you may return target Spirit card with converted mana cost 2 or less from your graveyard to your hand.)",SOK
Endless Swarm,,Jeremy Jarvis,129,Sorcery,"Put a 1/1 green Snake creature token onto the battlefield for each card in your hand.\nEpic (For the rest of the game, you can't cast spells. At the beginning of each of your upkeeps, copy this spell except for its epic ability.)",SOK
Fiddlehead Kami,,Rebecca Guay,130,Creature — Spirit,"Whenever you cast a Spirit or Arcane spell, regenerate Fiddlehead Kami.",SOK
Ghost-Lit Nourisher,,Tsutomu Kawade,131,Creature — Spirit,"{2}{G}, {T}: Target creature gets +2/+2 until end of turn.\nChannel — {3}{G}, Discard Ghost-Lit Nourisher: Target creature gets +4/+4 until end of turn.",SOK
Haru-Onna,,Rebecca Guay,132,Creature — Spirit,"When Haru-Onna enters the battlefield, draw a card.\nWhenever you cast a Spirit or Arcane spell, you may return Haru-Onna to its owner's hand.",SOK
"Inner Calm, Outer Strength",,Stephen Tappin,133,Instant — Arcane,"Target creature gets +X/+X until end of turn, where X is the number of cards in your hand.",SOK
Kami of the Tended Garden,,Thomas M. Baxa,134,Creature — Spirit,"At the beginning of your upkeep, sacrifice Kami of the Tended Garden unless you pay {G}.\nSoulshift 3 (When this creature dies, you may return target Spirit card with converted mana cost 3 or less from your graveyard to your hand.)",SOK
Kashi-Tribe Elite,,Ben Thompson,135,Creature — Snake Warrior,"Legendary Snakes you control have shroud. (They can't be the targets of spells or abilities.)\nWhenever Kashi-Tribe Elite deals combat damage to a creature, tap that creature and it doesn't untap during its controller's next untap step.",SOK
"Masumaro, First to Live",,Adam Rex,136,Legendary Creature — Spirit,"Masumaro, First to Live's power and toughness are each equal to twice the number of cards in your hand.",SOK
Matsu-Tribe Birdstalker,,Heather Hudson,137,Creature — Snake Warrior Archer,"Whenever Matsu-Tribe Birdstalker deals combat damage to a creature, tap that creature and it doesn't untap during its controller's next untap step.\n{G}: Matsu-Tribe Birdstalker gains reach until end of turn. (It can block creatures with flying.)",SOK
Molting Skin,,Jeremy Jarvis,138,Enchantment,Return Molting Skin to its owner's hand: Regenerate target creature.,SOK
Nightsoil Kami,,Jim Nelson,139,Creature — Spirit,"Soulshift 5 (When this creature dies, you may return target Spirit card with converted mana cost 5 or less from your graveyard to your hand.)",SOK
Okina Nightwatch,,Heather Hudson,140,Creature — Human Monk,"As long as you have more cards in hand than each opponent, Okina Nightwatch gets +3/+3.","pARL,SOK"
Promised Kannushi,,Matt Thompson,141,Creature — Human Druid,"Soulshift 7 (When this creature dies, you may return target Spirit card with converted mana cost 7 or less from your graveyard to your hand.)",SOK
"Reki, the History of Kamigawa",,"Edward P. Beard, Jr.",142,Legendary Creature — Human Shaman,"Whenever you cast a legendary spell, draw a card.",SOK
Rending Vines,,Dan Frazier,143,Instant — Arcane,Destroy target artifact or enchantment if its converted mana cost is less than or equal to the number of cards in your hand.\nDraw a card.,SOK
Sakura-Tribe Scout,,Darrell Riche,144,Creature — Snake Shaman Scout,{T}: You may put a land card from your hand onto the battlefield.,SOK
"Sasaya, Orochi Ascendant",,Christopher Moeller,145a,Legendary Creature — Snake Monk,"Reveal your hand: If you have seven or more land cards in your hand, flip Sasaya, Orochi Ascendant.",SOK
Sasaya's Essence,,Christopher Moeller,145b,Legendary Enchantment,"Whenever a land you control is tapped for mana, for each other land you control with the same name, add one mana to your mana pool of any type that land produced.",SOK
Seed the Land,,Anthony S. Waters,146,Enchantment,"Whenever a land enters the battlefield, its controller puts a 1/1 green Snake creature token onto the battlefield.",SOK
Seek the Horizon,,Eric Polak,147,Sorcery,"Search your library for up to three basic land cards, reveal them, and put them into your hand. Then shuffle your library.","SOK,RTR,KTK"
"Sekki, Seasons' Guide",,Kev Walker,148,Legendary Creature — Spirit,"Sekki, Seasons' Guide enters the battlefield with eight +1/+1 counters on it.\nIf damage would be dealt to Sekki, prevent that damage, remove that many +1/+1 counters from Sekki, and put that many 1/1 colorless Spirit creature tokens onto the battlefield.
Sacrifice eight Spirits: Return Sekki from your graveyard to the battlefield.",SOK
Shinen of Life's Roar,,Matt Cavotta,149,Creature — Spirit,"All creatures able to block Shinen of Life's Roar do so.\nChannel — {2}{G}{G}, Discard Shinen of Life's Roar: All creatures able to block target creature this turn do so.","SOK,ARC"
Stampeding Serow,,"Edward P. Beard, Jr.",150,Creature — Antelope Beast,"Trample\nAt the beginning of your upkeep, return a green creature you control to its owner's hand.",SOK
Iname as One,,Stephen Tappin,151,Legendary Creature — Spirit,"When Iname as One enters the battlefield, if you cast it from your hand, you may search your library for a Spirit permanent card, put it onto the battlefield, then shuffle your library.\nWhen Iname as One dies, you may exile it. If you do, return target Spirit permanent card from your graveyard to the battlefield.",SOK
Ashes of the Fallen,,Dan Frazier,152,Artifact,"As Ashes of the Fallen enters the battlefield, choose a creature type.\nEach creature card in your graveyard has the chosen creature type in addition to its other types.",SOK
Blood Clock,,Keith Garletts,153,Artifact,"At the beginning of each player's upkeep, that player returns a permanent he or she controls to its owner's hand unless he or she pays 2 life.",SOK
Ebony Owl Netsuke,,Tim Hildebrandt,154,Artifact,"At the beginning of each opponent's upkeep, if that player has seven or more cards in hand, Ebony Owl Netsuke deals 4 damage to him or her.",SOK
Ivory Crane Netsuke,,Greg Hildebrandt,155,Artifact,"At the beginning of your upkeep, if you have seven or more cards in hand, you gain 4 life.",SOK
Manriki-Gusari,,Thomas Gianni,156,Artifact — Equipment,Equipped creature gets +1/+2 and has "{T}: Destroy target Equipment."\nEquip {1} ({1}: Attach to target creature you control. Equip only as a sorcery.),SOK
O-Naginata,,Brian Snõddy,157,Artifact — Equipment,O-Naginata can be attached only to a creature with power 3 or greater.\nEquipped creature gets +3/+0 and has trample.
Equip {2} ({2}: Attach to target creature you control. Equip only as a sorcery.),SOK
Pithing Needle,,Pete Venters,158,Artifact,"As Pithing Needle enters the battlefield, name a card.\nActivated abilities of sources with the chosen name can't be activated unless they're mana abilities.","SOK,10E,M10,RTR"
Scroll of Origins,,Dany Orizio,159,Artifact,"{2}, {T}: Draw a card if you have seven or more cards in hand.",SOK
Soratami Cloud Chariot,,Franz Vohwinkel,160,Artifact,{2}: Target creature you control gains flying until end of turn.\n{2}: Prevent all combat damage that would be dealt to and dealt by target creature you control this turn.,SOK
Wine of Blood and Iron,,Luca Zontini,161,Artifact,"{4}: Target creature gets +X/+0 until end of turn, where X is its power. Sacrifice Wine of Blood and Iron at the beginning of the next end step.",SOK
"Mikokoro, Center of the Sea",,John Avon,162,Legendary Land,"{T}: Add {1} to your mana pool.\n{2}, {T}: Each player draws a card.",SOK
"Miren, the Moaning Well",,Rob Alexander,163,Legendary Land,"{T}: Add {1} to your mana pool.\n{3}, {T}, Sacrifice a creature: You gain life equal to the sacrificed creature's toughness.",SOK
"Oboro, Palace in the Clouds",,Rob Alexander,164,Legendary Land,"{T}: Add {U} to your mana pool.\n{1}: Return Oboro, Palace in the Clouds to its owner's hand.",SOK
Tomb of Urami,,Alex Horley-Orlandelli,165,Legendary Land,"{T}: Add {B} to your mana pool. Tomb of Urami deals 1 damage to you if you don't control an Ogre.\n{2}{B}{B}, {T}, Sacrifice all lands you control: Put a legendary 5/5 black Demon Spirit creature token with flying named Urami onto the battlefield.",SOK
