name,cost,artist,number,type,text,printings
"Endrek Sahr, Master Breeder",,Mark Tedin,106,Legendary Creature — Human Wizard,"Whenever you cast a creature spell, put X 1/1 black Thrull creature tokens onto the battlefield, where X is that spell's converted mana cost.\nWhen you control seven or more Thrulls, sacrifice Endrek Sahr, Master Breeder.","TSP,C13,MM2"
Evil Eye of Urborg,,Clint Langley,107,Creature — Eye,"Non-Eye creatures you control can't attack.\nWhenever Evil Eye of Urborg becomes blocked by a creature, destroy that creature.",TSP
Faceless Devourer,,Chippy,108,Creature — Nightmare Horror,"Shadow (This creature can block or be blocked by only creatures with shadow.)\nWhen Faceless Devourer enters the battlefield, exile another target creature with shadow.
When Faceless Devourer leaves the battlefield, return the exiled card to the battlefield under its owner's control.",TSP
Fallen Ideal,,Anson Maddocks,109,Enchantment — Aura,"Enchant creature\nEnchanted creature has flying and "Sacrifice a creature: This creature gets +2/+1 until end of turn."
When Fallen Ideal is put into a graveyard from the battlefield, return Fallen Ideal to its owner's hand.","TSP,C15"
Feebleness,,Kev Walker,110,Enchantment — Aura,Flash (You may cast this spell any time you could cast an instant.)\nEnchant creature
Enchanted creature gets -2/-1.,TSP
Gorgon Recluse,,Darrell Riche,111,Creature — Gorgon,"Whenever Gorgon Recluse blocks or becomes blocked by a nonblack creature, destroy that creature at end of combat.\nMadness {B}{B} (If you discard this card, you may cast it for its madness cost instead of putting it into your graveyard.)",TSP
Haunting Hymn,,rk post,112,Instant,"Target player discards two cards. If you cast this spell during your main phase, that player discards four cards instead.",TSP
Liege of the Pit,,Jeremy Jarvis,113,Creature — Demon,"Flying, trample\nAt the beginning of your upkeep, sacrifice a creature other than Liege of the Pit. If you can't, Liege of the Pit deals 7 damage to you.
Morph {B}{B}{B}{B} (You may cast this card face down as a 2/2 creature for {3}. Turn it face up any time for its morph cost.)",TSP
Lim-Dûl the Necromancer,,Matt Cavotta,114,Legendary Creature — Human Wizard,"Whenever a creature an opponent controls dies, you may pay {1}{B}. If you do, return that card to the battlefield under your control. If it's a creature, it's a Zombie in addition to its other creature types.\n{1}{B}: Regenerate target Zombie.",TSP
Living End,,Greg Staples,115,Sorcery,"Suspend 3—{2}{B}{B} (Rather than cast this card from your hand, pay {2}{B}{B} and exile it with three time counters on it. At the beginning of your upkeep, remove a time counter. When the last is removed, cast it without paying its mana cost.)\nEach player exiles all creature cards from his or her graveyard, then sacrifices all creatures he or she controls, then puts all cards he or she exiled this way onto the battlefield.",TSP
Magus of the Mirror,,Christopher Moeller,116,Creature — Human Wizard,"{T}, Sacrifice Magus of the Mirror: Exchange life totals with target opponent. Activate this ability only during your upkeep.","TSP,CNS"
Mana Skimmer,,Daniel Gelon,117,Creature — Leech,"Flying\nWhenever Mana Skimmer deals damage to a player, tap target land that player controls. That land doesn't untap during its controller's next untap step.",TSP
Mindlash Sliver,,Jeff Miracola,118,Creature — Sliver,"All Slivers have "{1}, Sacrifice this permanent: Each player discards a card."",TSP
Mindstab,,Mark Tedin,119,Sorcery,"Target player discards three cards.\nSuspend 4—{B} (Rather than cast this card from your hand, you may pay {B} and exile it with four time counters on it. At the beginning of your upkeep, remove a time counter. When the last is removed, cast it without paying its mana cost.)",TSP
Nether Traitor,,Vance Kovacs,120,Creature — Spirit,"Haste\nShadow (This creature can block or be blocked by only creatures with shadow.)
Whenever another creature is put into your graveyard from the battlefield, you may pay {B}. If you do, return Nether Traitor from your graveyard to the battlefield.",TSP
Nightshade Assassin,,Alan Pollack,121,Creature — Human Assassin,"First strike\nWhen Nightshade Assassin enters the battlefield, you may reveal X black cards in your hand. If you do, target creature gets -X/-X until end of turn.
Madness {1}{B} (If you discard this card, you may cast it for its madness cost instead of putting it into your graveyard.)",TSP
Phthisis,,Carl Critchlow,122,Sorcery,"Destroy target creature. Its controller loses life equal to its power plus its toughness.\nSuspend 5—{1}{B} (Rather than cast this card from your hand, you may pay {1}{B} and exile it with five time counters on it. At the beginning of your upkeep, remove a time counter. When the last is removed, cast it without paying its mana cost.)","TSP,MMA,C13"
Pit Keeper,,Anthony S. Waters,123,Creature — Human Wizard,"When Pit Keeper enters the battlefield, if you have four or more creature cards in your graveyard, you may return target creature card from your graveyard to your hand.",TSP
Plague Sliver,,Dave Allsop,124,Creature — Sliver,"All Slivers have "At the beginning of your upkeep, this permanent deals 1 damage to you."",TSP
Premature Burial,,Clint Langley,125,Sorcery,Destroy target nonblack creature that entered the battlefield since your last turn ended.,TSP
Psychotic Episode,,Drew Tucker,126,Sorcery,"Target player reveals his or her hand and the top card of his or her library. You choose a card revealed this way. That player puts the chosen card on the bottom of his or her library.\nMadness {1}{B} (If you discard this card, you may cast it for its madness cost instead of putting it into your graveyard.)",TSP
Sangrophage,,Pete Venters,127,Creature — Zombie,"At the beginning of your upkeep, tap Sangrophage unless you pay 2 life.",TSP
Sengir Nosferatu,,Scott M. Fischer,128,Creature — Vampire,"Flying\n{1}{B}, Exile Sengir Nosferatu: Put a 1/2 black Bat creature token with flying onto the battlefield. It has "{1}{B}, Sacrifice this creature: Return an exiled card named Sengir Nosferatu to the battlefield under its owner's control."",TSP
Skittering Monstrosity,,rk post,129,Creature — Horror,"When you cast a creature spell, sacrifice Skittering Monstrosity.",TSP
Skulking Knight,,rk post,130,Creature — Zombie Knight,"Flanking (Whenever a creature without flanking blocks this creature, the blocking creature gets -1/-1 until end of turn.)\nWhen Skulking Knight becomes the target of a spell or ability, sacrifice it.",TSP
Smallpox,,Janine Johnston,131,Sorcery,"Each player loses 1 life, discards a card, sacrifices a creature, then sacrifices a land.","TSP,M12,CNS"
Strangling Soot,,Jim Murray,132,Instant,Destroy target creature with toughness 3 or less.\nFlashback {5}{R} (You may cast this card from your graveyard for its flashback cost. Then exile it.),"TSP,DDK"
Stronghold Overseer,,Puddnhead,133,Creature — Demon,Flying\nShadow (This creature can block or be blocked by only creatures with shadow.)
{B}{B}: Creatures with shadow get +1/+0 until end of turn and creatures without shadow get -1/-0 until end of turn.,TSP
Sudden Death,,Dave Allsop,134,Instant,"Split second (As long as this spell is on the stack, players can't cast spells or activate abilities that aren't mana abilities.)\nTarget creature gets -4/-4 until end of turn.",TSP
Sudden Spoiling,,Alan Pollack,135,Instant,"Split second (As long as this spell is on the stack, players can't cast spells or activate abilities that aren't mana abilities.)\nUntil end of turn, creatures target player controls lose all abilities and have base power and toughness 0/2.","TSP,C13,C14"
Tendrils of Corruption,,Mike Dringenberg,136,Instant,"Tendrils of Corruption deals X damage to target creature and you gain X life, where X is the number of Swamps you control.","TSP,M10,DDD,DDE,C14,DD3_GVL"
Traitor's Clutch,,Dave Allsop,137,Instant,"Target creature gets +1/+0, becomes black, and gains shadow until end of turn. (It can block or be blocked by only creatures with shadow.)\nFlashback {1}{B} (You may cast this card from your graveyard for its flashback cost. Then exile it.)",TSP
Trespasser il-Vec,,Jim Murray,138,Creature — Human Rogue,Discard a card: Trespasser il-Vec gains shadow until end of turn. (It can block or be blocked by only creatures with shadow.),TSP
Urborg Syphon-Mage,,Greg Staples,139,Creature — Human Spellshaper,"{2}{B}, {T}, Discard a card: Each other player loses 2 life. You gain life equal to the life lost this way.","TSP,DDD,ARC,DD3_GVL"
Vampiric Sliver,,Thomas M. Baxa,140,Creature — Sliver,"All Sliver creatures have "Whenever a creature dealt damage by this creature this turn dies, put a +1/+1 counter on this creature."",TSP
Viscid Lemures,,Drew Tucker,141,Creature — Spirit,{0}: Viscid Lemures gets -1/-0 and gains swampwalk until end of turn. (It can't be blocked as long as defending player controls a Swamp.),TSP
Ætherflame Wall,,Justin Sweet,142,Creature — Wall,Defender\nÆtherflame Wall can block creatures with shadow as though they didn't have shadow.
{R}: Ætherflame Wall gets +1/+0 until end of turn.,TSP
Ancient Grudge,,Jim Nelson,143,Instant,Destroy target artifact.\nFlashback {G} (You may cast this card from your graveyard for its flashback cost. Then exile it.),"pFNM,TSP,ISD"
Barbed Shocker,,Tony Szczudlo,144,Creature — Insect,"Trample, haste\nWhenever Barbed Shocker deals damage to a player, that player discards all the cards in his or her hand, then draws that many cards.","TSP,CNS"
Basalt Gargoyle,,Clint Langley,145,Creature — Gargoyle,"Flying\nEcho {2}{R} (At the beginning of your upkeep, if this came under your control since the beginning of your last upkeep, sacrifice it unless you pay its echo cost.)
{R}: Basalt Gargoyle gets +0/+1 until end of turn.",TSP
Blazing Blade Askari,,Dan Frazier,146,Creature — Human Knight,"Flanking (Whenever a creature without flanking blocks this creature, the blocking creature gets -1/-1 until end of turn.)\n{2}: Blazing Blade Askari becomes colorless until end of turn.",TSP
Bogardan Hellkite,,Scott M. Fischer,147,Creature — Dragon,"Flash\nFlying
When Bogardan Hellkite enters the battlefield, it deals 5 damage divided as you choose among any number of target creatures and/or players.","TSP,DRB,M10,DDG,C14"
Bogardan Rager,,Clint Langley,148,Creature — Elemental,"Flash (You may cast this spell any time you could cast an instant.)\nWhen Bogardan Rager enters the battlefield, target creature gets +4/+0 until end of turn.","TSP,HOP,DDG"
Bonesplitter Sliver,,Dany Orizio,149,Creature — Sliver,All Sliver creatures get +2/+0.,TSP
Coal Stoker,,Mark Zug,150,Creature — Elemental,"When Coal Stoker enters the battlefield, if you cast it from your hand, add {R}{R}{R} to your mana pool.","TSP,DDK"
Conflagrate,,Warren Mahy,151,Sorcery,"Conflagrate deals X damage divided as you choose among any number of target creatures and/or players.\nFlashback—{R}{R}, Discard X cards. (You may cast this card from your graveyard for its flashback cost. Then exile it.)",TSP
Empty the Warrens,,Mark Brill,152,Sorcery,"Put two 1/1 red Goblin creature tokens onto the battlefield.\nStorm (When you cast this spell, copy it for each spell cast before it this turn.)","TSP,MMA"
Firemaw Kavu,,Greg Hildebrandt,153,Creature — Kavu,"Echo {5}{R} (At the beginning of your upkeep, if this came under your control since the beginning of your last upkeep, sacrifice it unless you pay its echo cost.)\nWhen Firemaw Kavu enters the battlefield, it deals 2 damage to target creature.
When Firemaw Kavu leaves the battlefield, it deals 4 damage to target creature.",TSP
Flamecore Elemental,,Dave Dorman,154,Creature — Elemental,"Echo {2}{R}{R} (At the beginning of your upkeep, if this came under your control since the beginning of your last upkeep, sacrifice it unless you pay its echo cost.)",TSP
Flowstone Channeler,,Alan Pollack,155,Creature — Human Spellshaper,"{1}{R}, {T}, Discard a card: Target creature gets +1/-1 and gains haste until end of turn.",TSP
Fortune Thief,,Christopher Moeller,156,Creature — Human Rogue,Damage that would reduce your life total to less than 1 reduces it to 1 instead.\nMorph {R}{R} (You may cast this card face down as a 2/2 creature for {3}. Turn it face up any time for its morph cost.),TSP
Fury Sliver,,Paolo Parente,157,Creature — Sliver,All Sliver creatures have double strike.,"TSP,H09"
Ghitu Firebreathing,,Jim Nelson,158,Enchantment — Aura,Flash (You may cast this spell any time you could cast an instant.)\nEnchant creature
{R}: Enchanted creature gets +1/+0 until end of turn.
{R}: Return Ghitu Firebreathing to its owner's hand.,TSP
Goblin Skycutter,,Clint Langley,159,Creature — Goblin Warrior,Sacrifice Goblin Skycutter: Goblin Skycutter deals 2 damage to target creature with flying. That creature loses flying until end of turn.,TSP
Grapeshot,,Pete Venters,160,Sorcery,"Grapeshot deals 1 damage to target creature or player.\nStorm (When you cast this spell, copy it for each spell cast before it this turn. You may choose new targets for the copies.)","TSP,MMA"
Greater Gargadon,,Rob Alexander,161,Creature — Beast,"Suspend 10—{R}\nSacrifice an artifact, creature, or land: Remove a time counter from Greater Gargadon. Activate this ability only if Greater Gargadon is suspended.","TSP,MMA"
Ground Rift,,Thomas M. Baxa,162,Sorcery,"Target creature without flying can't block this turn.\nStorm (When you cast this spell, copy it for each spell cast before it this turn. You may choose new targets for the copies.)",TSP
"Ib Halfheart, Goblin Tactician",,Wayne Reynolds,163,Legendary Creature — Goblin Advisor,"Whenever another Goblin you control becomes blocked, sacrifice it. If you do, it deals 4 damage to each creature blocking it.\nSacrifice two Mountains: Put two 1/1 red Goblin creature tokens onto the battlefield.","TSP,EVG,DD3_EVG"
Ignite Memories,,Justin Sweet,164,Sorcery,"Target player reveals a card at random from his or her hand. Ignite Memories deals damage to that player equal to that card's converted mana cost.\nStorm (When you cast this spell, copy it for each spell cast before it this turn. You may choose new targets for the copies.)",TSP
Ironclaw Buzzardiers,,Carl Critchlow,165,Creature — Orc Scout,Ironclaw Buzzardiers can't block creatures with power 2 or greater.\n{R}: Ironclaw Buzzardiers gains flying until end of turn.,TSP
"Jaya Ballard, Task Mage",,Matt Cavotta,166,Legendary Creature — Human Spellshaper,"{R}, {T}, Discard a card: Destroy target blue permanent.\n{1}{R}, {T}, Discard a card: Jaya Ballard, Task Mage deals 3 damage to target creature or player. A creature dealt damage this way can't be regenerated this turn.
{5}{R}{R}, {T}, Discard a card: Jaya Ballard deals 6 damage to each creature and each player.","pMEI,TSP,PD2"
Keldon Halberdier,,Paolo Parente,167,Creature — Human Warrior,"First strike\nSuspend 4—{R} (Rather than cast this card from your hand, you may pay {R} and exile it with four time counters on it. At the beginning of your upkeep, remove a time counter. When the last is removed, cast it without paying its mana cost. It has haste.)",TSP
Lightning Axe,,Dan Scott,168,Instant,"As an additional cost to cast Lightning Axe, discard a card or pay {5}.\nLightning Axe deals 5 damage to target creature.",TSP
Magus of the Scroll,,Greg Staples,169,Creature — Human Wizard,"{3}, {T}: Name a card. Reveal a card at random from your hand. If it's the named card, Magus of the Scroll deals 2 damage to target creature or player.",TSP
Mogg War Marshal,,Wayne England,170,Creature — Goblin Warrior,"Echo {1}{R} (At the beginning of your upkeep, if this came under your control since the beginning of your last upkeep, sacrifice it unless you pay its echo cost.)\nWhen Mogg War Marshal enters the battlefield or dies, put a 1/1 red Goblin creature token onto the battlefield.","TSP,EVG,MMA,DD3_EVG"
Norin the Wary,,Heather Hudson,171,Legendary Creature — Human Warrior,"When a player casts a spell or a creature attacks, exile Norin the Wary. Return it to the battlefield under its owner's control at the beginning of the next end step.",TSP
Orcish Cannonade,,Pete Venters,172,Instant,Orcish Cannonade deals 2 damage to target creature or player and 3 damage to you.\nDraw a card.,"TSP,CNS,DDN"
Pardic Dragon,,Zoltan Boros & Gabor Szikszai,173,Creature — Dragon,"Flying\n{R}: Pardic Dragon gets +1/+0 until end of turn.
Suspend 2—{R}{R}
Whenever an opponent casts a spell, if Pardic Dragon is suspended, that player may put a time counter on Pardic Dragon.","TSP,MMA"
Plunder,,Thomas M. Baxa,174,Sorcery,"Destroy target artifact or land.\nSuspend 4—{1}{R} (Rather than cast this card from your hand, you may pay {1}{R} and exile it with four time counters on it. At the beginning of your upkeep, remove a time counter. When the last is removed, cast it without paying its mana cost.)",TSP
Reiterate,,Dan Scott,175,Instant,"Buyback {3} (You may pay an additional {3} as you cast this spell. If you do, put this card into your hand as it resolves.)\nCopy target instant or sorcery spell. You may choose new targets for the copy.",TSP
Rift Bolt,,Michael Sutfin,176,Sorcery,"Rift Bolt deals 3 damage to target creature or player.\nSuspend 1—{R} (Rather than cast this card from your hand, you may pay {R} and exile it with a time counter on it. At the beginning of your upkeep, remove a time counter. When the last is removed, cast it without paying its mana cost.)","pFNM,TSP,MMA"
Sedge Sliver,,Richard Kane Ferguson,177,Creature — Sliver,All Sliver creatures have "This creature gets +1/+1 as long as you control a Swamp."\nAll Slivers have "{B}: Regenerate this permanent.",TSP
Subterranean Shambler,,Kev Walker,178,Creature — Elemental,"Echo {3}{R} (At the beginning of your upkeep, if this came under your control since the beginning of your last upkeep, sacrifice it unless you pay its echo cost.)\nWhen Subterranean Shambler enters the battlefield or leaves the battlefield, it deals 1 damage to each creature without flying.",TSP
Sudden Shock,,Vance Kovacs,179,Instant,"Split second (As long as this spell is on the stack, players can't cast spells or activate abilities that aren't mana abilities.)\nSudden Shock deals 2 damage to target creature or player.","pREL,TSP,MMA"
Sulfurous Blast,,Jeff Miracola,180,Instant,"Sulfurous Blast deals 2 damage to each creature and each player. If you cast this spell during your main phase, Sulfurous Blast deals 3 damage to each creature and each player instead.","TSP,CMD"
Tectonic Fiend,,Mark Tedin,181,Creature — Elemental,"Echo {4}{R}{R} (At the beginning of your upkeep, if this came under your control since the beginning of your last upkeep, sacrifice it unless you pay its echo cost.)\nTectonic Fiend attacks each turn if able.",TSP
Thick-Skinned Goblin,,Ralph Horsley,182,Creature — Goblin Shaman,You may pay {0} rather than pay the echo cost for permanents you control.\n{R}: Thick-Skinned Goblin gains protection from red until end of turn.,TSP
Two-Headed Sliver,,Dany Orizio,183,Creature — Sliver,All Sliver creatures have menace. (They can't be blocked except by two or more creatures.),TSP
Undying Rage,,Scott M. Fischer,184,Enchantment — Aura,"Enchant creature\nEnchanted creature gets +2/+2 and can't block.
When Undying Rage is put into a graveyard from the battlefield, return Undying Rage to its owner's hand.","TSP,DDL"
Viashino Bladescout,,Dany Orizio,185,Creature — Viashino Scout,"Flash (You may cast this spell any time you could cast an instant.)\nWhen Viashino Bladescout enters the battlefield, target creature gains first strike until end of turn.",TSP
Volcanic Awakening,,Dan Scott,186,Sorcery,"Destroy target land.\nStorm (When you cast this spell, copy it for each spell cast before it this turn. You may choose new targets for the copies.)",TSP
Wheel of Fate,,Kev Walker,187,Sorcery,"Suspend 4—{1}{R} (Rather than cast this card from your hand, pay {1}{R} and exile it with four time counters on it. At the beginning of your upkeep, remove a time counter. When the last is removed, cast it without paying its mana cost.)\nEach player discards his or her hand, then draws seven cards.",TSP
Word of Seizing,,Vance Kovacs,188,Instant,"Split second (As long as this spell is on the stack, players can't cast spells or activate abilities that aren't mana abilities.)\nUntap target permanent and gain control of it until end of turn. It gains haste until end of turn.","TSP,C14,C15"
Æther Web,,Justin Sweet,189,Enchantment — Aura,"Flash (You may cast this spell any time you could cast an instant.)\nEnchant creature
Enchanted creature gets +1/+1, has reach, and can block creatures with shadow as though they didn't have shadow. (Creatures with reach can block creatures with flying.)",TSP
Ashcoat Bear,,Carl Critchlow,190,Creature — Bear,Flash (You may cast this spell any time you could cast an instant.),TSP
Aspect of Mongoose,,Dave Dorman,191,Enchantment — Aura,"Enchant creature\nEnchanted creature has shroud. (It can't be the target of spells or abilities.)
When Aspect of Mongoose is put into a graveyard from the battlefield, return Aspect of Mongoose to its owner's hand.",TSP
Chameleon Blur,,Anthony S. Waters,192,Instant,Prevent all damage that creatures would deal to players this turn.,TSP
Durkwood Baloth,,Dan Frazier,193,Creature — Beast,"Suspend 5—{G} (Rather than cast this card from your hand, you may pay {G} and exile it with five time counters on it. At the beginning of your upkeep, remove a time counter. When the last is removed, cast it without paying its mana cost. It has haste.)","TSP,MMA"
Durkwood Tracker,,Michael Phillippi,194,Creature — Giant,"{1}{G}, {T}: If Durkwood Tracker is on the battlefield, it deals damage equal to its power to target attacking creature. That creature deals damage equal to its power to Durkwood Tracker.",TSP
Fungus Sliver,,Daniel Gelon,195,Creature — Fungus Sliver,"All Sliver creatures have "Whenever this creature is dealt damage, put a +1/+1 counter on it." (The damage is dealt before the counter is put on.)","TSP,H09"
Gemhide Sliver,,John Matson,196,Creature — Sliver,All Slivers have "{T}: Add one mana of any color to your mana pool.","TSP,H09"
Glass Asp,,Richard Kane Ferguson,197,Creature — Snake,"Whenever Glass Asp deals combat damage to a player, that player loses 2 life at the beginning of his or her next draw step unless he or she pays {2} before that step.",TSP
Greenseeker,,Rebecca Guay,198,Creature — Elf Spellshaper,"{G}, {T}, Discard a card: Search your library for a basic land card, reveal it, and put it into your hand. Then shuffle your library.",TSP
Havenwood Wurm,,Stuart Griffin,199,Creature — Wurm,Flash (You may cast this spell any time you could cast an instant.)\nTrample,TSP
Herd Gnarr,,Daren Bader,200,Creature — Beast,"Whenever another creature enters the battlefield under your control, Herd Gnarr gets +2/+2 until end of turn.",TSP
Hypergenesis,,Ron Spears,201,Sorcery,"Suspend 3—{1}{G}{G} (Rather than cast this card from your hand, pay {1}{G}{G} and exile it with three time counters on it. At the beginning of your upkeep, remove a time counter. When the last is removed, cast it without paying its mana cost.)\nStarting with you, each player may put an artifact, creature, enchantment, or land card from his or her hand onto the battlefield. Repeat this process until no one puts a card onto the battlefield.",TSP
Krosan Grip,,Zoltan Boros & Gabor Szikszai,202,Instant,"Split second (As long as this spell is on the stack, players can't cast spells or activate abilities that aren't mana abilities.)\nDestroy target artifact or enchantment.","pFNM,TSP,MMA,C13,C15"
Magus of the Candelabra,,Terese Nielsen,203,Creature — Human Wizard,"{X}, {T}: Untap X target lands.",TSP
Might of Old Krosa,,Una Fricker,204,Instant,"Target creature gets +2/+2 until end of turn. If you cast this spell during your main phase, that creature gets +4/+4 until end of turn instead.",TSP
Might Sliver,,Jeff Miracola,205,Creature — Sliver,All Sliver creatures get +2/+2.,"TSP,H09"
Molder,,Greg Hildebrandt,206,Instant,Destroy target artifact or enchantment with converted mana cost X. It can't be regenerated. You gain X life.,TSP
Mwonvuli Acid-Moss,,Randy Gallegos,207,Sorcery,Destroy target land. Search your library for a Forest card and put that card onto the battlefield tapped. Then shuffle your library.,TSP
Nantuko Shaman,,Daren Bader,208,Creature — Insect Shaman,"When Nantuko Shaman enters the battlefield, if you control no tapped lands, draw a card.\nSuspend 1—{2}{G}{G} (Rather than cast this card from your hand, you may pay {2}{G}{G} and exile it with a time counter on it. At the beginning of your upkeep, remove a time counter. When the last is removed, cast it without paying its mana cost. It has haste.)","TSP,MMA"
Pendelhaven Elder,,Pete Venters,209,Creature — Elf Shaman,{T}: Each 1/1 creature you control gets +1/+2 until end of turn.,TSP
Penumbra Spider,,Jeff Easley,210,Creature — Spider,"Reach\nWhen Penumbra Spider dies, put a 2/4 black Spider creature token with reach onto the battlefield.","TSP,CMD,PC2,MMA"
Phantom Wurm,,Alan Pollack,211,Creature — Wurm Spirit,"Phantom Wurm enters the battlefield with four +1/+1 counters on it.\nIf damage would be dealt to Phantom Wurm, prevent that damage. Remove a +1/+1 counter from Phantom Wurm.",TSP
Primal Forcemage,,Jeff Miracola,212,Creature — Elf Shaman,"Whenever another creature enters the battlefield under your control, that creature gets +3/+3 until end of turn.",TSP
Savage Thallid,,Luca Zontini,213,Creature — Fungus,"At the beginning of your upkeep, put a spore counter on Savage Thallid.\nRemove three spore counters from Savage Thallid: Put a 1/1 green Saproling creature token onto the battlefield.
Sacrifice a Saproling: Regenerate target Fungus.",TSP
