name,manaCost,cmc,colorIdentity,artist,number,type,text,printings,flavor,layout,multiverseid,power,toughness,rarity,subtypes,types
Academy Rector,{3}{W},4,W,Heather Hudson,1,Creature — Human Cleric,"When Academy Rector dies, you may exile it. If you do, search your library for an enchantment card, put that card onto the battlefield, then shuffle your library.",UDS,,normal,15138,1,2,Rare,"Human,Cleric",Creature
Archery Training,{W},1,W,Mark Brill,2,Enchantment — Aura,"Enchant creature\nAt the beginning of your upkeep, you may put an arrow counter on Archery Training.\nEnchanted creature has ""{T}: This creature deals X damage to target attacking or blocking creature, where X is the number of arrow counters on Archery Training.""",UDS,,normal,15135,,,Uncommon,Aura,Enchantment
Capashen Knight,{1}{W},2,W,Kev Walker,3,Creature — Human Knight,First strike (This creature deals combat damage before creatures without first strike.)\n{1}{W}: Capashen Knight gets +1/+0 until end of turn.,"UDS,M14","Few warriors dare to challenge a knight of Capashen. Should one do so, there is one fewer.",normal,15125,1,1,Common,"Human,Knight",Creature
Capashen Standard,{W},1,W,Todd Lockwood,4,Enchantment — Aura,"Enchant creature\nEnchanted creature gets +1/+1.\n{2}, Sacrifice Capashen Standard: Draw a card.",UDS,Benalia has no need for peacocks to serve as symbols of vanity. The Capashens strut more proudly than any bird.,normal,19095,,,Common,Aura,Enchantment
Capashen Templar,{2}{W},3,W,Todd Lockwood,5,Creature — Human Knight,{W}: Capashen Templar gets +0/+1 until end of turn.,UDS,Their shields are Benalia's outermost battlements.,normal,15762,2,2,Common,"Human,Knight",Creature
False Prophet,{2}{W}{W},4,W,Eric Peterson,6,Creature — Human Cleric,"When False Prophet dies, exile all creatures.","pPRE,UDS,CMD","""You lived for Serra's love. Will you not die for it?""",normal,15765,2,2,Rare,"Human,Cleric",Creature
Fend Off,{1}{W},2,W,Paolo Parente,7,Instant,"Prevent all combat damage that would be dealt by target creature this turn.\nCycling {2} ({2}, Discard this card: Draw a card.)",UDS,The best defense is to not get hit.,normal,15763,,,Common,,Instant
Field Surgeon,{1}{W},2,W,Heather Hudson,8,Creature — Human Cleric,Tap an untapped creature you control: Prevent the next 1 damage that would be dealt to target creature this turn.,UDS,Commanders order soldiers to attack. Field surgeons order them to heal. Both are obeyed without question.,normal,15121,1,1,Common,"Human,Cleric",Creature
Flicker,{1}{W},2,W,Douglas Shuler,9,Sorcery,"Exile target nontoken permanent, then return it to the battlefield under its owner's control.",UDS,"Who is truer: you who are, or you who are to be?",normal,15127,,,Rare,,Sorcery
Jasmine Seer,{3}{W},4,W,Donato Giancola,10,Creature — Human Wizard,"{2}{W}, {T}: Reveal any number of white cards in your hand. You gain 2 life for each card revealed this way.",UDS,,normal,15124,1,1,Uncommon,"Human,Wizard",Creature
Mask of Law and Grace,{W},1,W,Kev Walker,11,Enchantment — Aura,Enchant creature\nEnchanted creature has protection from black and from red.,UDS,The archangels zealously drove Serra's light into every corner of their new home as if their creator still commanded them.,normal,15129,,,Common,Aura,Enchantment
Master Healer,{4}{W},5,W,Adam Rex,12,Creature — Human Cleric,{T}: Prevent the next 4 damage that would be dealt to target creature or player this turn.,"UDS,7ED,8ED,9ED",Behind his eyes is the pain of every soldier his hands have healed.,normal,15874,1,4,Rare,"Human,Cleric",Creature
Opalescence,{2}{W}{W},4,W,John Avon,13,Enchantment,Each other non-Aura enchantment is a creature in addition to its other types and has base power and base toughness each equal to its converted mana cost.,UDS,,normal,15142,,,Rare,,Enchantment
Reliquary Monk,{2}{W},3,W,Thomas M. Baxa,14,Creature — Human Monk Cleric,"When Reliquary Monk dies, destroy target artifact or enchantment.",UDS,A thing of Serra's realm exists only by the grace of her followers' faith.,normal,15123,2,2,Common,"Human,Monk,Cleric",Creature
Replenish,{3}{W},4,W,Jim Nelson,15,Sorcery,Return all enchantment cards from your graveyard to the battlefield. (Auras with nothing to enchant remain in your graveyard.),UDS,"Treasures, trinkets, trash—the relics of the past are brought forth again.",normal,15143,,,Rare,,Sorcery
Sanctimony,{1}{W},2,W,Mark Brill,16,Enchantment,"Whenever an opponent taps a Mountain for mana, you may gain 1 life.","UDS,7ED,8ED","""To forgive our enemies is to forgive ourselves.""",normal,15873,,,Uncommon,,Enchantment
Scent of Jasmine,{W},1,W,Douglas Shuler,17,Instant,Reveal any number of white cards in your hand. You gain 2 life for each card revealed this way.,UDS,,normal,15263,,,Common,,Instant
Scour,{2}{W}{W},4,W,Eric Peterson,18,Instant,"Exile target enchantment. Search its controller's graveyard, hand, and library for all cards with the same name as that enchantment and exile them. Then that player shuffles his or her library.","UDS,BOK",,normal,15134,,,Uncommon,,Instant
Serra Advocate,{3}{W},4,W,Scott Hampton,19,Creature — Angel,Flying\n{T}: Target attacking or blocking creature gets +2/+2 until end of turn.,"UDS,7ED,DDC,DD3_DVD",An angel's touch can prepare a soldier for battle more than a thousand military drills.,normal,14485,2,2,Uncommon,Angel,Creature
Solidarity,{3}{W},4,W,John Zeleznik,20,Instant,Creatures you control get +0/+5 until end of turn.,"UDS,8ED",Their commitment to Serra is as solid as any shield.,normal,15764,,,Common,,Instant
Tethered Griffin,{W},1,W,Matthew D. Wilson,21,Creature — Griffin,"Flying\nWhen you control no enchantments, sacrifice Tethered Griffin.",UDS,Poorly trained griffins sometimes attack the noble audiences that gather to watch their progress.,normal,15769,2,3,Rare,Griffin,Creature
Tormented Angel,{3}{W},4,W,Greg & Tim Hildebrandt,22,Creature — Angel,Flying,UDS,Falling from heaven is not as painful as surviving the impact.,normal,18287,1,5,Common,Angel,Creature
Voice of Duty,{3}{W},4,W,Mark Zug,23,Creature — Angel,"Flying, protection from green",UDS,"""Next to Law is Duty, and Duty must be obeyed. If the frame of Duty is broken, none shall weave life's fabric.""\n—Song of All, canto 167",normal,15132,2,2,Uncommon,Angel,Creature
Voice of Reason,{3}{W},4,W,Ray Lago,24,Creature — Angel,"Flying, protection from blue",UDS,"""Next to Grace is Reason, and Reason must be retained. If the web of Reason comes unwoven, madness will escape.""\n—Song of All, canto 167",normal,15131,2,2,Uncommon,Angel,Creature
Wall of Glare,{1}{W},2,W,Patrick Ho,25,Creature — Wall,Defender (This creature can't attack.)\nWall of Glare can block any number of creatures.,UDS,The blinding barrier served Benalia better than a hundred shields.,normal,15120,0,5,Common,Wall,Creature
Aura Thief,{3}{U},4,U,Ron Spears,26,Creature — Illusion,"Flying\nWhen Aura Thief dies, you gain control of all enchantments. (You don't get to move Auras.)",UDS,Illusion steals reality from the unwise.,normal,15261,2,2,Rare,Illusion,Creature
Blizzard Elemental,{5}{U}{U},7,U,Thomas M. Baxa,27,Creature — Elemental,Flying\n{3}{U}: Untap Blizzard Elemental.,"UDS,BTD",Students who had seen Rayne argue with Urza were certain she had summoned it to make him seem warmer by comparison.,normal,15146,5,5,Rare,Elemental,Creature
Brine Seer,{3}{U},4,U,Donato Giancola,28,Creature — Human Wizard,"{2}{U}, {T}: Reveal any number of blue cards in your hand. Counter target spell unless its controller pays {1} for each card revealed this way.",UDS,,normal,15148,1,1,Uncommon,"Human,Wizard",Creature
Bubbling Beebles,{4}{U},5,U,Jeff Miracola,29,Creature — Beeble,Bubbling Beebles can't be blocked as long as defending player controls an enchantment.,UDS,"""Chancellor Rayne canceled the annual beeble roast. I should have married a crueler woman.""\n—Barrin",normal,15783,3,3,Common,Beeble,Creature
Disappear,{2}{U}{U},4,U,"Edward P. Beard, Jr.",30,Enchantment — Aura,Enchant creature\n{U}: Return enchanted creature and Disappear to their owners' hands.,UDS,"If at first you don't succeed, run away and hide.",normal,15151,,,Uncommon,Aura,Enchantment
Donate,{2}{U},3,U,Jeff Miracola,31,Sorcery,Target player gains control of target permanent you control.,UDS,"Campus pranksters initiate new students with the old ""beeble bomb"" routine.",normal,15168,,,Rare,,Sorcery
Fatigue,{1}{U},2,U,Jeff Miracola,32,Sorcery,Target player skips his or her next draw step.,UDS,"""Mind if I just lie down right here for a few weeks?""",normal,19098,,,Common,,Sorcery
Fledgling Osprey,{U},1,U,Heather Hudson,33,Creature — Bird,Fledgling Osprey has flying as long as it's enchanted.,UDS,It isn't truly born until its first flight.,normal,15145,1,1,Common,Bird,Creature
Illuminated Wings,{1}{U},2,U,Jim Nelson,34,Enchantment — Aura,"Enchant creature\nEnchanted creature has flying.\n{2}, Sacrifice Illuminated Wings: Draw a card.",UDS,"For a moment, Urza thought not of war and destruction, but of the freedom of the skies.",normal,19097,,,Common,Aura,Enchantment
Iridescent Drake,{3}{U},4,U,Jim Nelson,35,Creature — Drake,"Flying\nWhen Iridescent Drake enters the battlefield, put target Aura card from a graveyard onto the battlefield under your control attached to Iridescent Drake.",UDS,,normal,15163,2,2,Uncommon,Drake,Creature
Kingfisher,{3}{U},4,U,"Edward P. Beard, Jr.",36,Creature — Bird,"Flying\nWhen Kingfisher dies, draw a card.",UDS,It's tastiest when served with the fish it stole.,normal,15147,2,2,Common,Bird,Creature
Mental Discipline,{1}{U}{U},3,U,"Edward P. Beard, Jr.",37,Enchantment,"{1}{U}, Discard a card: Draw a card.",UDS,Barrin drowned his doubts about Urza's project by delving ever deeper into its details.,normal,15158,,,Common,,Enchantment
Metathran Elite,{1}{U}{U},3,U,Jim Nelson,38,Creature — Metathran Soldier,Metathran Elite can't be blocked as long as it's enchanted.,UDS,"If the eyes are windows to the soul, their souls are not of this world.",normal,15157,2,3,Uncommon,"Metathran,Soldier",Creature
Metathran Soldier,{1}{U},2,U,Paolo Parente,39,Creature — Metathran Soldier,Metathran Soldier can't be blocked.,UDS,"Just as Serra crafted angels of light and faith, Urza constructed an army of sorcery and power to resist the coming invasion.",normal,19096,1,1,Common,"Metathran,Soldier",Creature
Opposition,{2}{U}{U},4,U,Todd Lockwood,40,Enchantment,"Tap an untapped creature you control: Tap target artifact, creature, or land.","UDS,7ED","""Urza says he's sane. Perhaps, but measures of sanity among planeswalkers are hard to come by.""\n—Barrin",normal,15162,,,Rare,,Enchantment
Private Research,{U},1,U,Scott M. Fischer,41,Enchantment — Aura,"Enchant creature\nAt the beginning of your upkeep, you may put a page counter on Private Research.\nWhen enchanted creature dies, draw a card for each page counter on Private Research.",UDS,,normal,15161,,,Uncommon,Aura,Enchantment
Quash,{2}{U}{U},4,U,Don Hazeltine,42,Instant,"Counter target instant or sorcery spell. Search its controller's graveyard, hand, and library for all cards with the same name as that spell and exile them. Then that player shuffles his or her library.","UDS,BOK",,normal,15160,,,Uncommon,,Instant
"Rayne, Academy Chancellor",{2}{U},3,U,Matthew D. Wilson,43,Legendary Creature — Human Wizard,"Whenever you or a permanent you control becomes the target of a spell or ability an opponent controls, you may draw a card. You may draw an additional card if Rayne, Academy Chancellor is enchanted.",UDS,,normal,15164,1,1,Rare,"Human,Wizard",Creature
Rescue,{U},1,U,Greg Staples,44,Instant,Return target permanent you control to its owner's hand.,UDS,"""Urza, I've discovered more promising students than you and my husband have, combined. And I haven't lost a single one.""\n—Rayne, Academy Chancellor",normal,15154,,,Common,,Instant
Scent of Brine,{1}{U},2,U,Greg Staples,45,Instant,Reveal any number of blue cards in your hand. Counter target spell unless its controller pays {1} for each card revealed this way.,UDS,,normal,15266,,,Common,,Instant
Sigil of Sleep,{U},1,U,Greg & Tim Hildebrandt,46,Enchantment — Aura,"Enchant creature\nWhenever enchanted creature deals damage to a player, return target creature that player controls to its owner's hand.","UDS,DDI",Arrows are only one way to remove an enemy.,normal,15784,,,Common,Aura,Enchantment
Telepathic Spies,{2}{U},3,U,Thomas M. Baxa,47,Creature — Human Wizard,"When Telepathic Spies enters the battlefield, look at target opponent's hand.","UDS,7ED","""Do try to keep an open mind, would you?""",normal,15149,2,2,Common,"Human,Wizard",Creature
Temporal Adept,{1}{U}{U},3,U,Heather Hudson,48,Creature — Human Wizard,"{U}{U}{U}, {T}: Return target permanent to its owner's hand.","UDS,7ED,8ED,9ED","""Of course she's at the head of her class. All her classmates have disappeared.""\n—Gatha, Tolarian renegade",normal,15875,1,1,Rare,"Human,Wizard",Creature
Thieving Magpie,{2}{U}{U},4,U,Una Fricker,49,Creature — Bird,"Flying (This creature can't be blocked except by creatures with flying or reach.)\nWhenever Thieving Magpie deals damage to an opponent, draw a card.","UDS,7ED,8ED,9ED,10E,DPA",Rayne once made several unkind comparisons between the bird's naked opportunism and Urza's.,normal,15156,1,3,Uncommon,Bird,Creature
Treachery,{3}{U}{U},5,U,Matthew D. Wilson,50,Enchantment — Aura,"Enchant creature\nWhen Treachery enters the battlefield, untap up to five lands.\nYou control enchanted creature.",UDS,"""The academy educates; I employ. It's a perfect arrangement.""\n—Gatha, Tolarian renegade",normal,12148,,,Rare,Aura,Enchantment
Apprentice Necromancer,{1}{B},2,B,Pete Venters,51,Creature — Zombie Wizard,"{B}, {T}, Sacrifice Apprentice Necromancer: Return target creature card from your graveyard to the battlefield. That creature gains haste. At the beginning of the next end step, sacrifice it.",UDS,,normal,14442,1,1,Rare,"Zombie,Wizard",Creature
Attrition,{1}{B}{B},3,B,Scott M. Fischer,52,Enchantment,"{B}, Sacrifice a creature: Destroy target nonblack creature.","UDS,CMD","""I will trade life for life with the insurgents. Our resources, unlike theirs, are limitless.""\n—Davvol, Evincar of Rath",normal,15191,,,Rare,,Enchantment
Body Snatcher,{2}{B}{B},4,B,Mark Zug,53,Creature — Minion,"When Body Snatcher enters the battlefield, exile it unless you discard a creature card.\nWhen Body Snatcher dies, exile Body Snatcher and return target creature card from your graveyard to the battlefield.",UDS,,normal,15189,2,2,Rare,Minion,Creature
Bubbling Muck,{B},1,B,Greg & Tim Hildebrandt,54,Sorcery,"Until end of turn, whenever a player taps a Swamp for mana, that player adds {B} to his or her mana pool (in addition to the mana the land produces).",UDS,The muck claims a hundred living things for each meager treasure it spews forth.,normal,15179,,,Common,,Sorcery
Carnival of Souls,{1}{B},2,B,Brian Snõddy,55,Enchantment,"Whenever a creature enters the battlefield, you lose 1 life and add {B} to your mana pool.",UDS,"""‘Davvol, blast those elves.' ‘Davvol, transport those troops.' No one cares that today is my birthday.""",normal,19115,,,Rare,,Enchantment
Chime of Night,{1}{B},2,B,Pete Venters,56,Enchantment — Aura,"Enchant creature\nWhen Chime of Night is put into a graveyard from the battlefield, destroy target nonblack creature.",UDS,"Many sent to serve Davvol carried such instruments, as if to remind him who their true masters were.",normal,15768,,,Common,Aura,Enchantment
Disease Carriers,{2}{B}{B},4,B,Chippy & Matthew Wilson,57,Creature — Rat,"When Disease Carriers dies, target creature gets -2/-2 until end of turn.",UDS,Rath is a disease all its inhabitants carry.,normal,15169,2,2,Common,Rat,Creature
Dying Wail,{1}{B},2,B,Brian Snõddy,58,Enchantment — Aura,"Enchant creature\nWhen enchanted creature dies, target player discards two cards.",UDS,This is a world of spiteful wasps that sting and kill even as they die.,normal,15183,,,Common,Aura,Enchantment
Encroach,{B},1,B,rk post,59,Sorcery,Target player reveals his or her hand. You choose a nonbasic land card from it. That player discards that card.,UDS,"""The rate of spread in this region is unacceptable. Start again.""\n—Davvol, Evincar of Rath",normal,15175,,,Uncommon,,Sorcery
Eradicate,{2}{B}{B},4,B,Kev Walker,60,Sorcery,"Exile target nonblack creature. Search its controller's graveyard, hand, and library for all cards with the same name as that creature and exile them. Then that player shuffles his or her library.","UDS,BOK",,normal,15186,,,Uncommon,,Sorcery
Festering Wound,{1}{B},2,B,Chippy & Matthew Wilson,61,Enchantment — Aura,"Enchant creature\nAt the beginning of your upkeep, you may put an infection counter on Festering Wound.\nAt the beginning of the upkeep of enchanted creature's controller, Festering Wound deals X damage to that player, where X is the number of infection counters on Festering Wound.",UDS,,normal,15184,,,Uncommon,Aura,Enchantment
Lurking Jackals,{B},1,B,Greg Staples,62,Enchantment,"When an opponent has 10 or less life, if Lurking Jackals is an enchantment, it becomes a 3/2 Hound creature.",UDS,Often it's not the hunter or the hunted but the opportunist who thrives in Rath.,normal,19116,,,Uncommon,,Enchantment
Nightshade Seer,{3}{B},4,B,Donato Giancola,63,Creature — Human Wizard,"{2}{B}, {T}: Reveal any number of black cards in your hand. Target creature gets -X/-X until end of turn, where X is the number of cards revealed this way.",UDS,,normal,15173,1,1,Uncommon,"Human,Wizard",Creature
Phyrexian Monitor,{3}{B},4,B,Carl Critchlow,64,Creature — Skeleton,{B}: Regenerate Phyrexian Monitor.,UDS,"Being one would be an honor, if the word ""honor"" had any meaning in Phyrexia.",normal,19113,2,2,Common,Skeleton,Creature
Phyrexian Negator,{2}{B},3,B,John Zeleznik,65,Creature — Horror,"Trample\nWhenever Phyrexian Negator is dealt damage, sacrifice that many permanents.","pJGP,UDS,DDE",They exist to cease.,normal,5559,5,5,Rare,Horror,Creature
Plague Dogs,{4}{B},5,B,Chippy & Matthew Wilson,66,Creature — Zombie Hound,"When Plague Dogs dies, all creatures get -1/-1 until end of turn.\n{2}, Sacrifice Plague Dogs: Draw a card.",UDS,"""They're not just retrievers, they're carriers.""",normal,15180,3,3,Uncommon,"Zombie,Hound",Creature
Rapid Decay,{1}{B},2,B,Chippy,67,Instant,"Exile up to three target cards from a single graveyard.\nCycling {2} ({2}, Discard this card: Draw a card.)",UDS,The grave robbers arrived the day after the burial. They were a day too late.,normal,15177,,,Rare,,Instant
Ravenous Rats,{1}{B},2,B,Carl Critchlow,68,Creature — Rat,"When Ravenous Rats enters the battlefield, target opponent discards a card.","PO2,UDS,S99,INV,8ED,9ED,10E,DDD,DPA,M13,DDJ,DD3_GVL","""For all the priceless tomes they have destroyed, one would think they would taste better.""\n—Davvol, Evincar of Rath",normal,15172,1,1,Common,Rat,Creature
Scent of Nightshade,{1}{B},2,B,John Avon,69,Instant,"Reveal any number of black cards in your hand. Target creature gets -X/-X until end of turn, where X is the number of cards revealed this way.",UDS,,normal,15265,,,Common,,Instant
Skittering Horror,{2}{B},3,B,Mark Zug,70,Creature — Horror,"When you cast a creature spell, sacrifice Skittering Horror.","UDS,BTD","""This monstrosity will do—for now.""\n—Davvol, Evincar of Rath",normal,15787,4,3,Common,Horror,Creature
Slinking Skirge,{3}{B},4,B,Ron Spencer,71,Creature — Imp,"Flying\n{2}, Sacrifice Slinking Skirge: Draw a card.",UDS,Davvol encouraged the skirges; they made excellent sentries and were quite edible if properly seasoned.,normal,15786,2,1,Common,Imp,Creature
Soul Feast,{3}{B}{B},5,B,Ray Lago,72,Sorcery,Target player loses 4 life and you gain 4 life.,"UDS,S99,7ED,8ED,9ED,10E","As no one has ever accepted a second invitation to Davvol's table, the evincar often dines alone.",normal,15767,,,Uncommon,,Sorcery
Squirming Mass,{1}{B},2,B,Ron Spencer,73,Creature — Horror,Fear (This creature can't be blocked except by artifact creatures and/or black creatures.),UDS,Only the coldest hearts and the strongest stomachs can stand against it.,normal,15170,1,1,Common,Horror,Creature
Twisted Experiment,{1}{B},2,B,rk post,74,Enchantment — Aura,Enchant creature\nEnchanted creature gets +3/-1.,UDS,"Gatha showed remarkable prowess in increasing his subjects' stature. Their lifespans, however, were another matter.",normal,19114,,,Common,Aura,Enchantment
Yawgmoth's Bargain,{4}{B}{B},6,B,Michael Sutfin,75,Enchantment,Skip your draw step.\nPay 1 life: Draw a card.,"UDS,VMA",He craves only one commodity.,normal,15193,,,Rare,,Enchantment
Æther Sting,{3}{R},4,R,Pete Venters,76,Enchantment,"Whenever an opponent casts a creature spell, Æther Sting deals 1 damage to that player.",UDS,"When Gatha fell, he was called to account for each abomination he created.",normal,12612,,,Uncommon,,Enchantment
Bloodshot Cyclops,{5}{R},6,R,Ray Lago,77,Creature — Cyclops Giant,"{T}, Sacrifice a creature: Bloodshot Cyclops deals damage equal to the sacrificed creature's power to target creature or player.","UDS,7ED,8ED","After their first encounter, the goblins named him Chuck.",normal,15214,4,4,Rare,"Cyclops,Giant",Creature
Cinder Seer,{3}{R},4,R,Donato Giancola,78,Creature — Human Wizard,"{2}{R}, {T}: Reveal any number of red cards in your hand. Cinder Seer deals X damage to target creature or player, where X is the number of cards revealed this way.",UDS,,normal,15199,1,1,Uncommon,"Human,Wizard",Creature
Colos Yearling,{2}{R},3,R,Patrick Ho,79,Creature — Goat Beast,Mountainwalk (This creature can't be blocked as long as defending player controls a Mountain.)\n{R}: Colos Yearling gets +1/+0 until end of turn.,UDS,A steed grows with its rider.,normal,15195,1,1,Common,"Goat,Beast",Creature
Covetous Dragon,{4}{R},5,R,rk post,80,Creature — Dragon,"Flying\nWhen you control no artifacts, sacrifice Covetous Dragon.",UDS,Gatha survived as long as he did by giving all Keld's predators exactly what they wanted.,normal,15770,6,5,Rare,Dragon,Creature
Flame Jet,{1}{R},2,R,John Avon,81,Sorcery,"Flame Jet deals 3 damage to target player.\nCycling {2} ({2}, Discard this card: Draw a card.)",UDS,Did the land make the Keldons? Did the Keldons make the land? Or were they simply meant for each other?,normal,15201,,,Common,,Sorcery
Goblin Berserker,{3}{R},4,R,Christopher Rush,82,Creature — Goblin Berserker,"First strike, haste",UDS,"Goblins don't know the meaning of the word ""tactics""—or the word ""meaning,"" for that matter.",normal,15876,2,2,Uncommon,"Goblin,Berserker",Creature
Goblin Festival,{1}{R},2,R,Jeff Laubenstein,83,Enchantment,"{2}: Goblin Festival deals 1 damage to target creature or player. Flip a coin. If you lose the flip, choose one of your opponents. That player gains control of Goblin Festival.",UDS,"""What are we celebratin' again?""",normal,15771,,,Rare,,Enchantment
Goblin Gardener,{3}{R},4,R,Dan Frazier,84,Creature — Goblin,"When Goblin Gardener dies, destroy target land.","UDS,7ED","""Grow food in dirt? Save time—eat dirt.""",normal,15197,2,1,Common,Goblin,Creature
Goblin Marshal,{4}{R}{R},6,R,DiTerlizzi,85,Creature — Goblin Warrior,"Echo {4}{R}{R} (At the beginning of your upkeep, if this came under your control since the beginning of your last upkeep, sacrifice it unless you pay its echo cost.)\nWhen Goblin Marshal enters the battlefield or dies, put two 1/1 red Goblin creature tokens onto the battlefield.",UDS,,normal,15212,3,3,Rare,"Goblin,Warrior",Creature
Goblin Masons,{1}{R},2,R,DiTerlizzi,86,Creature — Goblin,"When Goblin Masons dies, destroy target Wall.",UDS,"""Goblins build with true zeal—and anything else within arm's reach.""",normal,15202,2,1,Common,Goblin,Creature
Hulking Ogre,{2}{R},3,R,Greg & Tim Hildebrandt,87,Creature — Ogre,Hulking Ogre can't block.,"UDS,S99","""The Keldons' ogre campaign provided more body parts than my meager facility could properly use.""\n—Gatha, Tolarian renegade",normal,15196,3,3,Common,Ogre,Creature
Impatience,{2}{R},3,R,Mark Brill,88,Enchantment,"At the beginning of each player's end step, if that player didn't cast a spell this turn, Impatience deals 2 damage to him or her.","UDS,7ED",Ask a Keldon to hold his temper and you'll be left holding your guts.,normal,15217,,,Rare,,Enchantment
Incendiary,{R},1,R,Jeff Laubenstein,89,Enchantment — Aura,"Enchant creature\nAt the beginning of your upkeep, you may put a fuse counter on Incendiary.\nWhen enchanted creature dies, Incendiary deals X damage to target creature or player, where X is the number of fuse counters on Incendiary.",UDS,,normal,15211,,,Uncommon,Aura,Enchantment
Keldon Champion,{2}{R}{R},4,R,Mark Tedin,90,Creature — Human Barbarian,"Haste\nEcho {2}{R}{R} (At the beginning of your upkeep, if this came under your control since the beginning of your last upkeep, sacrifice it unless you pay its echo cost.)\nWhen Keldon Champion enters the battlefield, it deals 3 damage to target player.","UDS,HOP,PD2,EMA",,normal,15206,3,2,Uncommon,"Human,Barbarian",Creature
Keldon Vandals,{2}{R},3,R,Greg Staples,91,Creature — Human Rogue,"Echo {2}{R} (At the beginning of your upkeep, if this came under your control since the beginning of your last upkeep, sacrifice it unless you pay its echo cost.)\nWhen Keldon Vandals enters the battlefield, destroy target artifact.",UDS,Keldons divide all their spoils into two groups: trophies and catapult ammunition.,normal,15194,4,1,Common,"Human,Rogue",Creature
Landslide,{R},1,R,Jeff Laubenstein,92,Sorcery,Sacrifice any number of Mountains. Landslide deals that much damage to target player.,UDS,Sometimes the mountain takes.\n—Keldon saying,normal,13821,,,Uncommon,,Sorcery
